id,title,url
8224,Automate Linkedin Invitations With Browserflow And Google Sheets Tracking,https://n8n.io/workflows/8224-automate-linkedin-invitations-with-browserflow-and-google-sheets-tracking/
8201,Automate User Creation And Access Group Assignment In Curseduca,https://n8n.io/workflows/8201-automate-user-creation-and-access-group-assignment-in-curseduca/
8182,Generate And Research Sales Leads With Jina Ai And Openai Email Automation Via Gmail,https://n8n.io/workflows/8182-generate-and-research-sales-leads-with-jina-ai-and-openai-email-automation-via-gmail/
8095,Email New Leads From Google Sheets Via Outlook On A Schedule,https://n8n.io/workflows/8095-email-new-leads-from-google-sheets-via-outlook-on-a-schedule/
8058,Personalized Follow Up Emails For Zoom Attendees With Gpt 4 And Gmail,https://n8n.io/workflows/8058-personalized-follow-up-emails-for-zoom-attendees-with-gpt-4-and-gmail/
8014,Automate Sales Outreach With Openai Tavily And Google Sheets For Prospect Research,https://n8n.io/workflows/8014-automate-sales-outreach-with-openai-tavily-and-google-sheets-for-prospect-research/
7971,Automated Patient Response System With Gpt 35 And Google Sheets For Dental Clinics,https://n8n.io/workflows/7971-automated-patient-response-system-with-gpt-35-and-google-sheets-for-dental-clinics/
7929,B2B Outreach Automation Linkedin To Email Sequence With Gpt Anymailfinder And Perplexity,https://n8n.io/workflows/7929-b2b-outreach-automation-linkedin-to-email-sequence-with-gpt-anymailfinder-and-perplexity/
7856,Cost Free Email Follow Up Sequence With Google Sheets And Gmail,https://n8n.io/workflows/7856-cost-free-email-follow-up-sequence-with-google-sheets-and-gmail/
7844,Linkedin Lead Generation Auto Dm System With Comment Triggers Using Unipile And Nocodb,https://n8n.io/workflows/7844-linkedin-lead-generation-auto-dm-system-with-comment-triggers-using-unipile-and-nocodb/
7748,Enrich Mondaycom Leads And Draft Personalized Emails With Explorium Mcp And Gpt 41,https://n8n.io/workflows/7748-enrich-mondaycom-leads-and-draft-personalized-emails-with-explorium-mcp-and-gpt-41/
7713,Personalized Cold Email Generator With Supabase Smartlead And Google Gemini Ai,https://n8n.io/workflows/7713-personalized-cold-email-generator-with-supabase-smartlead-and-google-gemini-ai/
7712,Automated Whatsapp Lead Nurturing With Personalized Messages Via Postgres And Gallabox,https://n8n.io/workflows/7712-automated-whatsapp-lead-nurturing-with-personalized-messages-via-postgres-and-gallabox/
7668,Write Personalised Direct Messages For Instagram With Apify Openai Gsheets,https://n8n.io/workflows/7668-write-personalised-direct-messages-for-instagram-with-apify-openai-gsheets/
7621,Automate Abm Research To Outreach With Octave Ai And Instantlyai,https://n8n.io/workflows/7621-automate-abm-research-to-outreach-with-octave-ai-and-instantlyai/
7617,Generate Personalized Email Sequences With Octave Llm And External Data,https://n8n.io/workflows/7617-generate-personalized-email-sequences-with-octave-llm-and-external-data/
7583,Generate Personalized Cold Emails With Gpt 4O Mini And Google Sheets,https://n8n.io/workflows/7583-generate-personalized-cold-emails-with-gpt-4o-mini-and-google-sheets/
7532,Cold Email Outreach Personalized By Business With Gmail Google Sheet And Gemini,https://n8n.io/workflows/7532-cold-email-outreach-personalized-by-business-with-gmail-google-sheet-and-gemini/
7530,Personalized Linkedin Network Outreach With Groq Ai And Browserflow Automation,https://n8n.io/workflows/7530-personalized-linkedin-network-outreach-with-groq-ai-and-browserflow-automation/
7491,Automate Sales Call Research And Follow Ups With Gpt 4 Tavily Google Sheets,https://n8n.io/workflows/7491-automate-sales-call-research-and-follow-ups-with-gpt-4-tavily-google-sheets/
7329,Real Estate Property Search With Sql Database And Email Delivery,https://n8n.io/workflows/7329-real-estate-property-search-with-sql-database-and-email-delivery/
7311,Automated Linkedin Lead Generation And Dm Outreach With Airtable And Unipile,https://n8n.io/workflows/7311-automated-linkedin-lead-generation-and-dm-outreach-with-airtable-and-unipile/
7306,Send Personalized Follow Up Emails For Calendly Bookings With Gpt 4 And Outlook,https://n8n.io/workflows/7306-send-personalized-follow-up-emails-for-calendly-bookings-with-gpt-4-and-outlook/
7250,Real Estate Chatbot With Ai Property Matching And Automated Calendar Scheduling,https://n8n.io/workflows/7250-real-estate-chatbot-with-ai-property-matching-and-automated-calendar-scheduling/
7233,Automate Lead Enrichment And Personalized Outreach With Hubspot Phantombuster And Gpt,https://n8n.io/workflows/7233-automate-lead-enrichment-and-personalized-outreach-with-hubspot-phantombuster-and-gpt/
7221,Automated Sales Follow Up With Gpt Tavily Research And Gmail,https://n8n.io/workflows/7221-automated-sales-follow-up-with-gpt-tavily-research-and-gmail/
7219,Capture Website Leads With Slack Notifications Gmail Responses And Sheets Archiving,https://n8n.io/workflows/7219-capture-website-leads-with-slack-notifications-gmail-responses-and-sheets-archiving/
7163,Automate Hyper Personalized Email Outreach With Ai Gmail And Google Sheets,https://n8n.io/workflows/7163-automate-hyper-personalized-email-outreach-with-ai-gmail-and-google-sheets/
7149,Generate Personalized Sales Emails With Madkudu Research And Openai For Outreachio Sequences,https://n8n.io/workflows/7149-generate-personalized-sales-emails-with-madkudu-research-and-openai-for-outreachio-sequences/
7064,Automated Whatsapp Messaging And Lead Nurturing With Gallabox And Supabase,https://n8n.io/workflows/7064-automated-whatsapp-messaging-and-lead-nurturing-with-gallabox-and-supabase/
7005,Automate Whatsapp Sales With Deepseek Ai Google Sheets And Gmail Notifications,https://n8n.io/workflows/7005-automate-whatsapp-sales-with-deepseek-ai-google-sheets-and-gmail-notifications/
6983,Automate Lead Generation And Personalized Outreach With Apollo Ai And Instantlyai,https://n8n.io/workflows/6983-automate-lead-generation-and-personalized-outreach-with-apollo-ai-and-instantlyai/
6919,Cold Lead Re Engagement Email Generator With Gpt 4O Mini Outlook And Sheets,https://n8n.io/workflows/6919-cold-lead-re-engagement-email-generator-with-gpt-4o-mini-outlook-and-sheets/
6917,Send Predefined Personalized Emails To Leads From Google Sheets Using Sendgrid,https://n8n.io/workflows/6917-send-predefined-personalized-emails-to-leads-from-google-sheets-using-sendgrid/
6909,Multi Agent Cold Email Campaign Generator With O3 Director And Gpt 41 Specialists,https://n8n.io/workflows/6909-multi-agent-cold-email-campaign-generator-with-o3-director-and-gpt-41-specialists/
6758,Automated Cold Email Campaign With Google Sheets Email Verification And Smtp,https://n8n.io/workflows/6758-automated-cold-email-campaign-with-google-sheets-email-verification-and-smtp/
6733,Automate User Onboarding From Database To Saleshandy With Google Sheets Tracking,https://n8n.io/workflows/6733-automate-user-onboarding-from-database-to-saleshandy-with-google-sheets-tracking/
6720,Automated Lead Capture And Ai Personalized Audio Follow Up With Openai And Elevenlabs,https://n8n.io/workflows/6720-automated-lead-capture-and-ai-personalized-audio-follow-up-with-openai-and-elevenlabs/
6716,Ai Powered Web Form Responder With Gpt 4O Mini Outlook Email And Twilio Sms,https://n8n.io/workflows/6716-ai-powered-web-form-responder-with-gpt-4o-mini-outlook-email-and-twilio-sms/
6711,Automated Lead Response Template Using Google Forms Sheets And Gmail,https://n8n.io/workflows/6711-automated-lead-response-template-using-google-forms-sheets-and-gmail/
6699,Match Medical Symptoms To Products With Openai Qdrant And Google Sheets Rag,https://n8n.io/workflows/6699-match-medical-symptoms-to-products-with-openai-qdrant-and-google-sheets-rag/
6695,Trigger Outbound Vapi Ai Voice Calls From New Jotform Submissions,https://n8n.io/workflows/6695-trigger-outbound-vapi-ai-voice-calls-from-new-jotform-submissions/
6656,Automate Lead Qualification And Customer Support With Gpt 4O Mini Agents,https://n8n.io/workflows/6656-automate-lead-qualification-and-customer-support-with-gpt-4o-mini-agents/
6630,Automate Real Estate Marketing With Llama Ai Vapi Calls And Gmail Campaigns,https://n8n.io/workflows/6630-automate-real-estate-marketing-with-llama-ai-vapi-calls-and-gmail-campaigns/
6596,Whatsapp Outbound Messaging With Baserow And Wasenderapi,https://n8n.io/workflows/6596-whatsapp-outbound-messaging-with-baserow-and-wasenderapi/
6585,Automate Personalized B2B Outreach With Gpt 4 Linkedin And Hunterio,https://n8n.io/workflows/6585-automate-personalized-b2b-outreach-with-gpt-4-linkedin-and-hunterio/
6577,Automate Outbound Voice Calls With Vapi From Form Submissions,https://n8n.io/workflows/6577-automate-outbound-voice-calls-with-vapi-from-form-submissions/
6573,Auto Call New Typeform Submissions With Vapi Voice Assistant,https://n8n.io/workflows/6573-auto-call-new-typeform-submissions-with-vapi-voice-assistant/
6533,Personalized Thank You Emails With Website Scraping Gpt 4O And Gmail,https://n8n.io/workflows/6533-personalized-thank-you-emails-with-website-scraping-gpt-4o-and-gmail/
6502,Auto Send Welcome Messages To Vtiger Crm Leads Via Evolution Api Whatsapp,https://n8n.io/workflows/6502-auto-send-welcome-messages-to-vtiger-crm-leads-via-evolution-api-whatsapp/
6491,Automated Client Journey Appointment Reminders And Follow Ups With Twilio,https://n8n.io/workflows/6491-automated-client-journey-appointment-reminders-and-follow-ups-with-twilio/
6481,Voice Driven Travel Itinerary Generator Using Elevenlabs Gpt 4O And Pinecone,https://n8n.io/workflows/6481-voice-driven-travel-itinerary-generator-using-elevenlabs-gpt-4o-and-pinecone/
6414,Automated Lead Nurturing And Qualification With Gmail Google Sheets And Slack,https://n8n.io/workflows/6414-automated-lead-nurturing-and-qualification-with-gmail-google-sheets-and-slack/
6404,Respond To Inbound Leads With Personalized Videos Using Heygen Ai And Gpt 4,https://n8n.io/workflows/6404-respond-to-inbound-leads-with-personalized-videos-using-heygen-ai-and-gpt-4/
6402,Automate Personalized Cold Email Sequences With Gpt 4 Mailgun And Supabase,https://n8n.io/workflows/6402-automate-personalized-cold-email-sequences-with-gpt-4-mailgun-and-supabase/
6386,Auto Follow Up For Canceled Calendly Meetings With Gpt 4 Loom And Asana,https://n8n.io/workflows/6386-auto-follow-up-for-canceled-calendly-meetings-with-gpt-4-loom-and-asana/
6384,Smart Amazon Shopping Assistant With Gemini Ai And Telegram,https://n8n.io/workflows/6384-smart-amazon-shopping-assistant-with-gemini-ai-and-telegram/
6377,Automate Real Estate Property Tours With Google Calendar Slack And Calendly,https://n8n.io/workflows/6377-automate-real-estate-property-tours-with-google-calendar-slack-and-calendly/
6332,Qualify Real Estate Leads Via Sms With Gpt 4O Twilio And Google Sheets,https://n8n.io/workflows/6332-qualify-real-estate-leads-via-sms-with-gpt-4o-twilio-and-google-sheets/
6280,Revive Expired Real Estate Listings With Openai And Gmail Follow Ups,https://n8n.io/workflows/6280-revive-expired-real-estate-listings-with-openai-and-gmail-follow-ups/
6219,Multi Channel Campaign Messaging With Gpt 4 And Salesforce,https://n8n.io/workflows/6219-multi-channel-campaign-messaging-with-gpt-4-and-salesforce/
6213,Reactivate Solar Leads With Ai Powered Sms Email And Google Sheets Automation,https://n8n.io/workflows/6213-reactivate-solar-leads-with-ai-powered-sms-email-and-google-sheets-automation/
6174,Automate Personalized Upwork Proposals With Gpt 4 Google Docs And Mermaid Diagrams,https://n8n.io/workflows/6174-automate-personalized-upwork-proposals-with-gpt-4-google-docs-and-mermaid-diagrams/
6163,Multi Channel Ai Appointment Confirmation With Gpt 4 Elevenlabs And Twilio,https://n8n.io/workflows/6163-multi-channel-ai-appointment-confirmation-with-gpt-4-elevenlabs-and-twilio/
6162,Real Estate Lead Qualification Chatbot With Gpt 4O Mini,https://n8n.io/workflows/6162-real-estate-lead-qualification-chatbot-with-gpt-4o-mini/
6124,Send Postcards To Contacts Automatically Using Centralstationcrm And Echtpost,https://n8n.io/workflows/6124-send-postcards-to-contacts-automatically-using-centralstationcrm-and-echtpost/
6113,Generate Job Application Icebreakers With Gpt 4 And Indeed Data From Google Sheets,https://n8n.io/workflows/6113-generate-job-application-icebreakers-with-gpt-4-and-indeed-data-from-google-sheets/
6111,Automated Abandoned Cart Recovery Emails For Shopify Stores,https://n8n.io/workflows/6111-automated-abandoned-cart-recovery-emails-for-shopify-stores/
6099,Personalized Lead Nurturing With Gpt 41 Based On Commitment Scoring Via Google Sheets,https://n8n.io/workflows/6099-personalized-lead-nurturing-with-gpt-41-based-on-commitment-scoring-via-google-sheets/
6098,Generate Personalized Cold Outreach Emails With Apify Openai And Google Sheets,https://n8n.io/workflows/6098-generate-personalized-cold-outreach-emails-with-apify-openai-and-google-sheets/
6089,Automate Cold Outreach With Email Personalization Using Gemini And Google Sheets,https://n8n.io/workflows/6089-automate-cold-outreach-with-email-personalization-using-gemini-and-google-sheets/
6088,Automate Outbound Voice Calls From Go High Level Opportunities With Vapi,https://n8n.io/workflows/6088-automate-outbound-voice-calls-from-go-high-level-opportunities-with-vapi/
6087,Automated Form Response System With Google Sheets Slack Gmail And Contacts,https://n8n.io/workflows/6087-automated-form-response-system-with-google-sheets-slack-gmail-and-contacts/
6083,Lead Outreach Automation With Google Sheets Gmail And N8N Workflow,https://n8n.io/workflows/6083-lead-outreach-automation-with-google-sheets-gmail-and-n8n-workflow/
6082,Human In The Loop Email Response System Ai Imap,https://n8n.io/workflows/6082-human-in-the-loop-email-response-system-ai-imap/
6080,Automated Lead Capture And Business Qanda With Gpt 4O Pinecone And Google Sheets,https://n8n.io/workflows/6080-automated-lead-capture-and-business-qanda-with-gpt-4o-pinecone-and-google-sheets/
6048,Auto Bidder For Freelancercom With Telegram Approval And Ai Proposals,https://n8n.io/workflows/6048-auto-bidder-for-freelancercom-with-telegram-approval-and-ai-proposals/
6039,Outreach For Your Product Using Apollo Linkedin Gpt 41 And Sendgrid,https://n8n.io/workflows/6039-outreach-for-your-product-using-apollo-linkedin-gpt-41-and-sendgrid/
6005,Automated Bulk Cold Email Sender Using Gmail Smtp And Google Sheets,https://n8n.io/workflows/6005-automated-bulk-cold-email-sender-using-gmail-smtp-and-google-sheets/
6001,Automate Restaurant Orders With Ai Dish Recommendations Using Gemini And Telegram,https://n8n.io/workflows/6001-automate-restaurant-orders-with-ai-dish-recommendations-using-gemini-and-telegram/
5940,Automated Website Audit And Personalized Outreach With Lighthouse And Gpt 4,https://n8n.io/workflows/5940-automated-website-audit-and-personalized-outreach-with-lighthouse-and-gpt-4/
5938,Ai Powered Lead Research And Personalized Email Generation With Groq And Google Sheets,https://n8n.io/workflows/5938-ai-powered-lead-research-and-personalized-email-generation-with-groq-and-google-sheets/
5907,Automate Lead Capture With Ai Personalized Whatsapp Messages Via Unipile And Google Sheets Crm,https://n8n.io/workflows/5907-automate-lead-capture-with-ai-personalized-whatsapp-messages-via-unipile-and-google-sheets-crm/
5890,Automate Restaurant Marketing And Booking With Excel Vapi Voice Agent And Calendar,https://n8n.io/workflows/5890-automate-restaurant-marketing-and-booking-with-excel-vapi-voice-agent-and-calendar/
5856,Generate Personalized Cold Email Openers From Linkedin Posts With Gpt 4O,https://n8n.io/workflows/5856-generate-personalized-cold-email-openers-from-linkedin-posts-with-gpt-4o/
5700,Automatically Reply To Cold Emails With Gpt 4 And Instantlyai,https://n8n.io/workflows/5700-automatically-reply-to-cold-emails-with-gpt-4-and-instantlyai/
5691,Generate Personalized Sales Emails With Linkedin Data And Claude 37 Via Openrouter,https://n8n.io/workflows/5691-generate-personalized-sales-emails-with-linkedin-data-and-claude-37-via-openrouter/
5665,Book Calcom Meetings From Elevenlabs Voice Agent Conversations,https://n8n.io/workflows/5665-book-calcom-meetings-from-elevenlabs-voice-agent-conversations/
5656,Auto Generate Whatsapp Proposals From Voice Or Text Using Gpt And Apitemplate,https://n8n.io/workflows/5656-auto-generate-whatsapp-proposals-from-voice-or-text-using-gpt-and-apitemplate/
5580,Ebay Negotiation Api Mcp Server,https://n8n.io/workflows/5580-ebay-negotiation-api-mcp-server/
5479,Ai Powered Automated Outreach With Scheduling Gemini Gmail And Google Sheets,https://n8n.io/workflows/5479-ai-powered-automated-outreach-with-scheduling-gemini-gmail-and-google-sheets/
5449,Automate Sales Cold Calling Pipeline With Apify Gpt 4O And Whatsapp,https://n8n.io/workflows/5449-automate-sales-cold-calling-pipeline-with-apify-gpt-4o-and-whatsapp/
5422,Pt Clinic Ai Cold Email Sequence Generator With Gpt4,https://n8n.io/workflows/5422-pt-clinic-ai-cold-email-sequence-generator-with-gpt4/
5133,Smart Lead Outreach With Explorium Mcp Using Google Sheets And Telegram,https://n8n.io/workflows/5133-smart-lead-outreach-with-explorium-mcp-using-google-sheets-and-telegram/
5121,Mocean Tool Mcp Server Both Operations,https://n8n.io/workflows/5121-mocean-tool-mcp-server-both-operations/
5086,Generate Personalized Tour Itineraries Via Email With Gpt 4O And Pinecone,https://n8n.io/workflows/5086-generate-personalized-tour-itineraries-via-email-with-gpt-4o-and-pinecone/
5074,Ai Sales Agent With Telegram Approvals And Google Sheets Sync,https://n8n.io/workflows/5074-ai-sales-agent-with-telegram-approvals-and-google-sheets-sync/
5008,Ai Powered Cold Calling Automation With Vapiai Gpt 4O And Google Sheets,https://n8n.io/workflows/5008-ai-powered-cold-calling-automation-with-vapiai-gpt-4o-and-google-sheets/
4940,Automated Ai Cold Calling System With Vapiai Airtable And Smart Follow Ups,https://n8n.io/workflows/4940-automated-ai-cold-calling-system-with-vapiai-airtable-and-smart-follow-ups/
4896,Automated Cold Email Outreach With Gmail And Google Sheets,https://n8n.io/workflows/4896-automated-cold-email-outreach-with-gmail-and-google-sheets/
4891,Personalized Linkedin Responses With Openai Gpt And Notion Based Routing,https://n8n.io/workflows/4891-personalized-linkedin-responses-with-openai-gpt-and-notion-based-routing/
4872,Find Your Home With Real Estate Agent And Bright Data,https://n8n.io/workflows/4872-find-your-home-with-real-estate-agent-and-bright-data/
4841,Generate Sales Emails Based On Business Events With Explorium Mcp And Claude,https://n8n.io/workflows/4841-generate-sales-emails-based-on-business-events-with-explorium-mcp-and-claude/
4834,Automate Gym Lead Nurturing With Facebook Ads Whatsapp And Google Sheets Tracking,https://n8n.io/workflows/4834-automate-gym-lead-nurturing-with-facebook-ads-whatsapp-and-google-sheets-tracking/
4790,Personalized Crunchbase Lead Outreach With Ai Generated Summaries And Gmail,https://n8n.io/workflows/4790-personalized-crunchbase-lead-outreach-with-ai-generated-summaries-and-gmail/
4508,Multi Platform Ai Sales Agent With Rag Crm Calendar And Stripe,https://n8n.io/workflows/4508-multi-platform-ai-sales-agent-with-rag-crm-calendar-and-stripe/
4455,Shopify Multi Module Automation With Gpt 4O Langchain Agents And Integrations,https://n8n.io/workflows/4455-shopify-multi-module-automation-with-gpt-4o-langchain-agents-and-integrations/
4448,Ai Client Onboarding Agent Auto Welcome Email Generator,https://n8n.io/workflows/4448-ai-client-onboarding-agent-auto-welcome-email-generator/
4396,Smart Shopify Agent Ai Powered Abandoned Cart Recovery,https://n8n.io/workflows/4396-smart-shopify-agent-ai-powered-abandoned-cart-recovery/
4377,Ai Client Onboarding Agent Auto Welcome Email Generator,https://n8n.io/workflows/4377-ai-client-onboarding-agent-auto-welcome-email-generator/
4368,Ai Real Estate Agent End To End Ops Automation Web Data Voice,https://n8n.io/workflows/4368-ai-real-estate-agent-end-to-end-ops-automation-web-data-voice/
4253,Send Linkedin Connection Request With Airtop,https://n8n.io/workflows/4253-send-linkedin-connection-request-with-airtop/
4214,Cold Email Outreach With Gmail And Google Sheets Status Tracking,https://n8n.io/workflows/4214-cold-email-outreach-with-gmail-and-google-sheets-status-tracking/
4152,Automate Outbound Sales Calls To Qualified Leads With Vapiai And Google Sheets,https://n8n.io/workflows/4152-automate-outbound-sales-calls-to-qualified-leads-with-vapiai-and-google-sheets/
4083,Ai Sales Agent Whatsapp Fb Ig Openai Airtable Supabase Auto Booking,https://n8n.io/workflows/4083-ai-sales-agent-whatsapp-fb-ig-openai-airtable-supabase-auto-booking/
4031,Cold Outreach Automation Scrape Local Leads With Dumpling Ai And Call Via Vapi,https://n8n.io/workflows/4031-cold-outreach-automation-scrape-local-leads-with-dumpling-ai-and-call-via-vapi/
3808,Youtube To Whatsapp Sales Automation With Wordpress Fluentcrm And Whinta,https://n8n.io/workflows/3808-youtube-to-whatsapp-sales-automation-with-wordpress-fluentcrm-and-whinta/
3803,Connect Airtable Contacts To Telli For Automated Ai Voice Call Scheduling,https://n8n.io/workflows/3803-connect-airtable-contacts-to-telli-for-automated-ai-voice-call-scheduling/
3759,Automate Ai Phone Booking And Crm Updates With Gpt 4 Vapiai And Ghl,https://n8n.io/workflows/3759-automate-ai-phone-booking-and-crm-updates-with-gpt-4-vapiai-and-ghl/
3758,Ai Personalized Multi Product Email Outreach With Smtp Rotation Gpt 4Oo3 Mini,https://n8n.io/workflows/3758-ai-personalized-multi-product-email-outreach-with-smtp-rotation-gpt-4oo3-mini/
3652,Whatsapp Product Catalog Bot With Postgresql Database,https://n8n.io/workflows/3652-whatsapp-product-catalog-bot-with-postgresql-database/
3415,Abandoned Cart Recovery For Shopify Via Gmail Google Sheets And Twilio No Code,https://n8n.io/workflows/3415-abandoned-cart-recovery-for-shopify-via-gmail-google-sheets-and-twilio-no-code/
3397,Personalise Outreach Emails Using Customer Data And Ai,https://n8n.io/workflows/3397-personalise-outreach-emails-using-customer-data-and-ai/
3350,Telegram Ai Bot To Human Handoff For Sales Calls,https://n8n.io/workflows/3350-telegram-ai-bot-to-human-handoff-for-sales-calls/
3345,Automate Linkedin Requests And Icebreaker With Browserflow And Google Sheets,https://n8n.io/workflows/3345-automate-linkedin-requests-and-icebreaker-with-browserflow-and-google-sheets/
3342,Automate Sales For Digital Products And Saas With Ai Gpt 4O,https://n8n.io/workflows/3342-automate-sales-for-digital-products-and-saas-with-ai-gpt-4o/
3277,Smart Email Auto Responder Template Using Ai,https://n8n.io/workflows/3277-smart-email-auto-responder-template-using-ai/
3258,Automate Linkedin Contact Requests And Icebreaker With Unipile And Google Sheets,https://n8n.io/workflows/3258-automate-linkedin-contact-requests-and-icebreaker-with-unipile-and-google-sheets/
3123,Automatic Reminders For Follow Ups With Ai And Human In The Loop Gmail,https://n8n.io/workflows/3123-automatic-reminders-for-follow-ups-with-ai-and-human-in-the-loop-gmail/
3072,Send Voice Calls In Seconds Automate Text To Speech Using Clicksend Api,https://n8n.io/workflows/3072-send-voice-calls-in-seconds-automate-text-to-speech-using-clicksend-api/
2833,Smart Email Outreach Sequence Ai Powered And Customizable,https://n8n.io/workflows/2833-smart-email-outreach-sequence-ai-powered-and-customizable/
2823,Social Media Analysis And Automated Email Generation,https://n8n.io/workflows/2823-social-media-analysis-and-automated-email-generation/
2718,Ai Agent For Instagram Dminbox Manychat Open Ai Integration,https://n8n.io/workflows/2718-ai-agent-for-instagram-dminbox-manychat-open-ai-integration/
2580,Qualifying Appointment Requests With Ai And N8N Forms,https://n8n.io/workflows/2580-qualifying-appointment-requests-with-ai-and-n8n-forms/
2465,Building Your First Whatsapp Chatbot,https://n8n.io/workflows/2465-building-your-first-whatsapp-chatbot/
2342,Handling Appointment Leads And Follow Up With Twilio Calcom And Ai,https://n8n.io/workflows/2342-handling-appointment-leads-and-follow-up-with-twilio-calcom-and-ai/
2137,Gmail Campaign Sender Bulk Send Emails And Follow Up Automatically If No Reply,https://n8n.io/workflows/2137-gmail-campaign-sender-bulk-send-emails-and-follow-up-automatically-if-no-reply/
2122,Automatically Email Great Leads When They Submit A Form And Record In Hubspot,https://n8n.io/workflows/2122-automatically-email-great-leads-when-they-submit-a-form-and-record-in-hubspot/
2118,Send Follow Ups Using Gmail To Hubspot Contacts,https://n8n.io/workflows/2118-send-follow-ups-using-gmail-to-hubspot-contacts/
2112,Send Outreachcold Email Using Gmail To New Hubspot Contacts,https://n8n.io/workflows/2112-send-outreachcold-email-using-gmail-to-new-hubspot-contacts/
2106,Reach Out Via Email To New Form Submissions That Meet A Certain Criteria,https://n8n.io/workflows/2106-reach-out-via-email-to-new-form-submissions-that-meet-a-certain-criteria/
1954,Ai Agent Chat,https://n8n.io/workflows/1954-ai-agent-chat/
1951,Scrape And Summarize Webpages With Ai,https://n8n.io/workflows/1951-scrape-and-summarize-webpages-with-ai/
1934,Telegram Ai Chatbot,https://n8n.io/workflows/1934-telegram-ai-chatbot/
1862,Openai Gpt 3 Company Enrichment From Website Content,https://n8n.io/workflows/1862-openai-gpt-3-company-enrichment-from-website-content/
1838,Lemlist Lessgreater Gpt 3 Supercharge Your Sales Workflows,https://n8n.io/workflows/1838-lemlist-lessgreater-gpt-3-supercharge-your-sales-workflows/
1750,Creating An Api Endpoint,https://n8n.io/workflows/1750-creating-an-api-endpoint/
1748,Pulling Data From Services That N8N Doesnt Have A Pre Built Integration For,https://n8n.io/workflows/1748-pulling-data-from-services-that-n8n-doesnt-have-a-pre-built-integration-for/
