id,title,url
1747,Joining Different Datasets,https://n8n.io/workflows/1747-joining-different-datasets/
1700,Very Quick Quickstart,https://n8n.io/workflows/1700-very-quick-quickstart/
1534,Back Up Your N8N Workflows To Github,https://n8n.io/workflows/1534-back-up-your-n8n-workflows-to-github/
1511,Send Typeforms Leads Via Whatsapp Twilio,https://n8n.io/workflows/1511-send-typeforms-leads-via-whatsapp-twilio/
1435,Convert Json To An Excel File,https://n8n.io/workflows/1435-convert-json-to-an-excel-file/
1039,Send A Message On Mattermost When You Get A Reply In Emelia,https://n8n.io/workflows/1039-send-a-message-on-mattermost-when-you-get-a-reply-in-emelia/
984,Send A Message On Mattermost When A Lead Replies To Your Lemlist Email,https://n8n.io/workflows/984-send-a-message-on-mattermost-when-a-lead-replies-to-your-lemlist-email/
983,Add New Leads In Lemlist From Airtable,https://n8n.io/workflows/983-add-new-leads-in-lemlist-from-airtable/
