id,title,url
5012,Natural Language Database Queries With Dual Agent Ai And Postgresql Integration,https://n8n.io/workflows/5012-natural-language-database-queries-with-dual-agent-ai-and-postgresql-integration/
4978,Generate Ai Responses With Perplexity Sonar Models Reusable Module,https://n8n.io/workflows/4978-generate-ai-responses-with-perplexity-sonar-models-reusable-module/
4972,Monitor Ai Chat Interactions With Gemini 25 And Langfuse Tracing,https://n8n.io/workflows/4972-monitor-ai-chat-interactions-with-gemini-25-and-langfuse-tracing/
4952,Ai Agent Integration For Bubble Apps With Mcp Protocol Data Access,https://n8n.io/workflows/4952-ai-agent-integration-for-bubble-apps-with-mcp-protocol-data-access/
4932,Sap Service Layer Login,https://n8n.io/workflows/4932-sap-service-layer-login/
4931,Flexible Currency Rate Uploads For Sap B1 With Ai Validation And Multiple Sources,https://n8n.io/workflows/4931-flexible-currency-rate-uploads-for-sap-b1-with-ai-validation-and-multiple-sources/
4853,Automate Gpt 4O Fine Tuning With Google Sheets Or Airtable Data,https://n8n.io/workflows/4853-automate-gpt-4o-fine-tuning-with-google-sheets-or-airtable-data/
4772,Automated Airtable To Postgres Migration With N8N,https://n8n.io/workflows/4772-automated-airtable-to-postgres-migration-with-n8n/
4712,Simple Eval For Legal Benchmarking,https://n8n.io/workflows/4712-simple-eval-for-legal-benchmarking/
4704,Json String Validator Via Webhook,https://n8n.io/workflows/4704-json-string-validator-via-webhook/
4694,Ai Agent That Updates Its Own Rules To Modify Behavior,https://n8n.io/workflows/4694-ai-agent-that-updates-its-own-rules-to-modify-behavior/
4627,Discover Hidden Website Api Endpoints Using Regex And Ai,https://n8n.io/workflows/4627-discover-hidden-website-api-endpoints-using-regex-and-ai/
4623,Unix Timestamp To Iso Date Converter,https://n8n.io/workflows/4623-unix-timestamp-to-iso-date-converter/
4599,Lookup Ip Geolocation Details With Ip Apicom Via Webhook,https://n8n.io/workflows/4599-lookup-ip-geolocation-details-with-ip-apicom-via-webhook/
4593,Geocoding For Logistics With Open Route Api And Google Sheets,https://n8n.io/workflows/4593-geocoding-for-logistics-with-open-route-api-and-google-sheets/
4564,Estimate Driving Time And Distance For Logistics With Open Route Api,https://n8n.io/workflows/4564-estimate-driving-time-and-distance-for-logistics-with-open-route-api/
4559,Intelligent Web And Local Search With Brave Search Api And Google Gemini Mcp Server,https://n8n.io/workflows/4559-intelligent-web-and-local-search-with-brave-search-api-and-google-gemini-mcp-server/
4548,Manage User Authentication With Telegram Redis Cache And Google Sheets,https://n8n.io/workflows/4548-manage-user-authentication-with-telegram-redis-cache-and-google-sheets/
4477,Ai Powered Knowledge Assistant Using Google Sheets Openai And Supabase Vector Search,https://n8n.io/workflows/4477-ai-powered-knowledge-assistant-using-google-sheets-openai-and-supabase-vector-search/
4444,Build Production Ready User Authentication With Airtable And Jwt,https://n8n.io/workflows/4444-build-production-ready-user-authentication-with-airtable-and-jwt/
4428,Evaluation Metric Summarization,https://n8n.io/workflows/4428-evaluation-metric-summarization/
4426,Evaluate Rag Response Accuracy With Openai Document Groundedness Metric,https://n8n.io/workflows/4426-evaluate-rag-response-accuracy-with-openai-document-groundedness-metric/
4425,Evaluate Ai Agent Response Relevance Using Openai And Cosine Similarity,https://n8n.io/workflows/4425-evaluate-ai-agent-response-relevance-using-openai-and-cosine-similarity/
4424,Evaluate Ai Agent Response Correctness With Openai And Ragas Methodology,https://n8n.io/workflows/4424-evaluate-ai-agent-response-correctness-with-openai-and-ragas-methodology/
4423,Evaluations Metric Answer Similarity,https://n8n.io/workflows/4423-evaluations-metric-answer-similarity/
4399,Anthropic Ai Agent Claude Sonnet 4 And Opus 4 With Think And Web Search Tool,https://n8n.io/workflows/4399-anthropic-ai-agent-claude-sonnet-4-and-opus-4-with-think-and-web-search-tool/
4347,Validate Auth0 Jwt Tokens Using Jwks Or Signing Cert,https://n8n.io/workflows/4347-validate-auth0-jwt-tokens-using-jwks-or-signing-cert/
4316,Reliable Ai Agent Output Without Structured Output Parser W Openai And Switch,https://n8n.io/workflows/4316-reliable-ai-agent-output-without-structured-output-parser-w-openai-and-switch/
4274,Evaluation Metric Example String Similarity,https://n8n.io/workflows/4274-evaluation-metric-example-string-similarity/
4273,Evaluation Metric Example Rag Document Relevance,https://n8n.io/workflows/4273-evaluation-metric-example-rag-document-relevance/
4271,Evaluation Metric Example Correctness Judged By Ai,https://n8n.io/workflows/4271-evaluation-metric-example-correctness-judged-by-ai/
4269,Evaluation Metric Example Categorization,https://n8n.io/workflows/4269-evaluation-metric-example-categorization/
4268,Evaluation Metric Example Check If Tool Was Called,https://n8n.io/workflows/4268-evaluation-metric-example-check-if-tool-was-called/
4252,Web Site Scraper For Llms With Airtop,https://n8n.io/workflows/4252-web-site-scraper-for-llms-with-airtop/
4237,Dynamic Ai Model Router For Query Optimization With Openrouter,https://n8n.io/workflows/4237-dynamic-ai-model-router-for-query-optimization-with-openrouter/
4222,Control Your 3D Printer With Gpt 4O And Octoprint Api Conversations,https://n8n.io/workflows/4222-control-your-3d-printer-with-gpt-4o-and-octoprint-api-conversations/
4218,Openai Responses Api Adapter For Llm And Ai Agent Workflows,https://n8n.io/workflows/4218-openai-responses-api-adapter-for-llm-and-ai-agent-workflows/
4217,Create Openai Compatible Api Using Github Models For Free Ai Access,https://n8n.io/workflows/4217-create-openai-compatible-api-using-github-models-for-free-ai-access/
4211,Iot Device Control With Mqtt And Webhook,https://n8n.io/workflows/4211-iot-device-control-with-mqtt-and-webhook/
4197,Improve Ai Agent System Prompts With Gpt 4O Feedback Analysis And Email Delivery,https://n8n.io/workflows/4197-improve-ai-agent-system-prompts-with-gpt-4o-feedback-analysis-and-email-delivery/
4077,Query To Action Automation With Bright Data Mcp And Openai Gpt,https://n8n.io/workflows/4077-query-to-action-automation-with-bright-data-mcp-and-openai-gpt/
4070,Linking Nocodb Records Via Api,https://n8n.io/workflows/4070-linking-nocodb-records-via-api/
4066,Track Hourly Weather Conditions With Openweathermap And Google Sheets,https://n8n.io/workflows/4066-track-hourly-weather-conditions-with-openweathermap-and-google-sheets/
4013,Automatic Jest Test Generation For Github Prs With Dual Ai Review,https://n8n.io/workflows/4013-automatic-jest-test-generation-for-github-prs-with-dual-ai-review/
4004,Remote Iot Sensor Monitoring Via Mqtt And Influxdb,https://n8n.io/workflows/4004-remote-iot-sensor-monitoring-via-mqtt-and-influxdb/
3988,Access Control For Ai Agents Rbac Using Airtable And Telegram,https://n8n.io/workflows/3988-access-control-for-ai-agents-rbac-using-airtable-and-telegram/
3976,Prevent Concurrent Workflow Runs Using Redis,https://n8n.io/workflows/3976-prevent-concurrent-workflow-runs-using-redis/
3970,Secure Api Endpoint With Bearer Token Authentication And Field Validation,https://n8n.io/workflows/3970-secure-api-endpoint-with-bearer-token-authentication-and-field-validation/
3967,Build An On Premises Ai Kaggle Competition Assistant With Qdrant Rag And Ollama,https://n8n.io/workflows/3967-build-an-on-premises-ai-kaggle-competition-assistant-with-qdrant-rag-and-ollama/
3963,Ai Token Tracker For Whatsapp And Telegram Save Ai Usage To Google Sheets,https://n8n.io/workflows/3963-ai-token-tracker-for-whatsapp-and-telegram-save-ai-usage-to-google-sheets/
3961,Convert Llm Output Into Rich Telegram Messages Auto Media And Smart Chunking,https://n8n.io/workflows/3961-convert-llm-output-into-rich-telegram-messages-auto-media-and-smart-chunking/
3903,Conversational Postgresql Agent With Visuals Multi Kpi And Data Editing Mcp,https://n8n.io/workflows/3903-conversational-postgresql-agent-with-visuals-multi-kpi-and-data-editing-mcp/
3892,Postgresql Conversational Agent With Claude And Deepseek Multi Kpi Secure,https://n8n.io/workflows/3892-postgresql-conversational-agent-with-claude-and-deepseek-multi-kpi-secure/
3879,Build An Mcp Server With Airtable,https://n8n.io/workflows/3879-build-an-mcp-server-with-airtable/
3834,Retrieve Nasa Space Weather And Asteroid Data With Gpt 4O Mini And Telegram,https://n8n.io/workflows/3834-retrieve-nasa-space-weather-and-asteroid-data-with-gpt-4o-mini-and-telegram/
3812,Standardize Us Phone Numbers With Multiple Format Options And Validation,https://n8n.io/workflows/3812-standardize-us-phone-numbers-with-multiple-format-options-and-validation/
3770,Build Your Own N8N Workflows Mcp Server,https://n8n.io/workflows/3770-build-your-own-n8n-workflows-mcp-server/
3761,Email Assistant Convert Natural Language To Sql Queries With Phi4 Mini And Postgresql,https://n8n.io/workflows/3761-email-assistant-convert-natural-language-to-sql-queries-with-phi4-mini-and-postgresql/
3718,Check Which Ai Models Are Used In Your Workflows,https://n8n.io/workflows/3718-check-which-ai-models-are-used-in-your-workflows/
3711,Compare Different Llm Responses Side By Side With Google Sheets,https://n8n.io/workflows/3711-compare-different-llm-responses-side-by-side-with-google-sheets/
3641,Mcp Supabase Agent Manage Your Database With Ai,https://n8n.io/workflows/3641-mcp-supabase-agent-manage-your-database-with-ai/
3636,Build Your Own Qdrant Vector Store Mcp Server,https://n8n.io/workflows/3636-build-your-own-qdrant-vector-store-mcp-server/
3632,Build Your Own Sqlite Mcp Server,https://n8n.io/workflows/3632-build-your-own-sqlite-mcp-server/
3631,Build Your Own Postgresql Mcp Server,https://n8n.io/workflows/3631-build-your-own-postgresql-mcp-server/
3592,Automate Web Interactions With Claude 35 Haiku And Airtop Browser Agent,https://n8n.io/workflows/3592-automate-web-interactions-with-claude-35-haiku-and-airtop-browser-agent/
3576,Paul Graham Essay Search And Chat With Milvus Vector Database,https://n8n.io/workflows/3576-paul-graham-essay-search-and-chat-with-milvus-vector-database/
3574,Create A Paul Graham Essay Qanda System With Openai And Milvus Vector Database,https://n8n.io/workflows/3574-create-a-paul-graham-essay-qanda-system-with-openai-and-milvus-vector-database/
3569,Build An Mcp Server With Google Calendar,https://n8n.io/workflows/3569-build-an-mcp-server-with-google-calendar/
3557,Export Wordpress To Pinecone Vector Store,https://n8n.io/workflows/3557-export-wordpress-to-pinecone-vector-store/
3542,Create Ai Ready Vector Datasets For Llms With Bright Data Gemini And Pinecone,https://n8n.io/workflows/3542-create-ai-ready-vector-datasets-for-llms-with-bright-data-gemini-and-pinecone/
3537,Process Multiple Prompts In Parallel With Azure Openai Batch Api,https://n8n.io/workflows/3537-process-multiple-prompts-in-parallel-with-azure-openai-batch-api/
3529,Token Estim8R Ui Visualize Token Usage Analytics Dashboard In N8N,https://n8n.io/workflows/3529-token-estim8r-ui-visualize-token-usage-analytics-dashboard-in-n8n/
3527,Compare Sequential Agent Based And Parallel Llm Processing With Claude 37,https://n8n.io/workflows/3527-compare-sequential-agent-based-and-parallel-llm-processing-with-claude-37/
3514,Build An Mcp Server With Google Calendar And Custom Functions,https://n8n.io/workflows/3514-build-an-mcp-server-with-google-calendar-and-custom-functions/
3513,Token Estim8R Sub Workflow To Track Ai Model Token Usage And Cost With Jinaai,https://n8n.io/workflows/3513-token-estim8r-sub-workflow-to-track-ai-model-token-usage-and-cost-with-jinaai/
3497,Conversing With Data Transforming Text Into Sql Queries And Visual Curves,https://n8n.io/workflows/3497-conversing-with-data-transforming-text-into-sql-queries-and-visual-curves/
3496,Enhance Ai Prompts With Gpt 4O Mini And Telegram Delivery,https://n8n.io/workflows/3496-enhance-ai-prompts-with-gpt-4o-mini-and-telegram-delivery/
3495,Loading Json Via Ftp To Qdrant Vector Database Embedding Pipeline,https://n8n.io/workflows/3495-loading-json-via-ftp-to-qdrant-vector-database-embedding-pipeline/
3489,Build Ai Agents With Think Plan Act Architecture Using Llama 4 Reasoning,https://n8n.io/workflows/3489-build-ai-agents-with-think-plan-act-architecture-using-llama-4-reasoning/
3473,Scalable Multi Agent Chat Using Mentions,https://n8n.io/workflows/3473-scalable-multi-agent-chat-using-mentions/
3440,Track Llm Token Costs Per Customer Using The Langchain Code Node,https://n8n.io/workflows/3440-track-llm-token-costs-per-customer-using-the-langchain-code-node/
3439,Validate Seatable Webhooks With Hmac Sha256 Authentication,https://n8n.io/workflows/3439-validate-seatable-webhooks-with-hmac-sha256-authentication/
3409,Batch Process Prompts With Anthropic Claude Api,https://n8n.io/workflows/3409-batch-process-prompts-with-anthropic-claude-api/
3394,Airtable Batch Update Insert Rows Send Faster Save Api Call Requests,https://n8n.io/workflows/3394-airtable-batch-update-insert-rows-send-faster-save-api-call-requests/
3365,Convert Parquet Feather Orc And Avro Files With Parquetreader,https://n8n.io/workflows/3365-convert-parquet-feather-orc-and-avro-files-with-parquetreader/
3279,Oauth2 Settings Finder With Openrouter Chat Model And Llama 33,https://n8n.io/workflows/3279-oauth2-settings-finder-with-openrouter-chat-model-and-llama-33/
3139,Private And Local Ollama Self Hosted Dynamic Llm Router,https://n8n.io/workflows/3139-private-and-local-ollama-self-hosted-dynamic-llm-router/
3027,Generate Ai Prompts With Google Gemini And Store Them In Airtable,https://n8n.io/workflows/3027-generate-ai-prompts-with-google-gemini-and-store-them-in-airtable/
3026,Run Apache Airflow Dag And Retrieve Xcom Value,https://n8n.io/workflows/3026-run-apache-airflow-dag-and-retrieve-xcom-value/
3009,New Claude 37 Extended Thinking Ai Agent Unlock Ultimate Intelligence,https://n8n.io/workflows/3009-new-claude-37-extended-thinking-ai-agent-unlock-ultimate-intelligence/
3002,Dynamically Run Suiteql Queries In Netsuite Via Http Webhook In N8N,https://n8n.io/workflows/3002-dynamically-run-suiteql-queries-in-netsuite-via-http-webhook-in-n8n/
2992,Split Test Different Agent Prompts With Supabase And Openai,https://n8n.io/workflows/2992-split-test-different-agent-prompts-with-supabase-and-openai/
2939,N8N Subworkflow Dependency Graph And Auto Tagging,https://n8n.io/workflows/2939-n8n-subworkflow-dependency-graph-and-auto-tagging/
2932,Appsheet Intelligent Query Orchestrator Query Any Data,https://n8n.io/workflows/2932-appsheet-intelligent-query-orchestrator-query-any-data/
2926,Import Csv Files From Filesystem Into Postgres,https://n8n.io/workflows/2926-import-csv-files-from-filesystem-into-postgres/
2897,Use Openrouter In N8N Versions Less178,https://n8n.io/workflows/2897-use-openrouter-in-n8n-versions-less178/
2896,N8N For Beginners Looping Over Items,https://n8n.io/workflows/2896-n8n-for-beginners-looping-over-items/
2893,Fetch Dynamic Prompts From Github And Auto Populate N8N Expressions In Prompt,https://n8n.io/workflows/2893-fetch-dynamic-prompts-from-github-and-auto-populate-n8n-expressions-in-prompt/
2871,Ragcontext Aware Chunking Or Google Drive To Pinecone Via Openrouter And Gemini,https://n8n.io/workflows/2871-ragcontext-aware-chunking-or-google-drive-to-pinecone-via-openrouter-and-gemini/
2869,Test Webhooks In N8N Without Changing Webhookurl Postbin And Bamboohr Example,https://n8n.io/workflows/2869-test-webhooks-in-n8n-without-changing-webhookurl-postbin-and-bamboohr-example/
2857,Pattern For Multiple Triggers Combined To Continue Workflow,https://n8n.io/workflows/2857-pattern-for-multiple-triggers-combined-to-continue-workflow/
2839,Calculate The Centroid Of A Set Of Vectors,https://n8n.io/workflows/2839-calculate-the-centroid-of-a-set-of-vectors/
2831,Batch Airtable Requests To Send Data 9X Faster,https://n8n.io/workflows/2831-batch-airtable-requests-to-send-data-9x-faster/
2824,Query Perplexity Ai From Your N8N Workflows,https://n8n.io/workflows/2824-query-perplexity-ai-from-your-n8n-workflows/
2818,Fetch Scriptures Dynamically From Get Bible Api,https://n8n.io/workflows/2818-fetch-scriptures-dynamically-from-get-bible-api/
2812,Scrape Any Web Page Into Structured Json Data With Scrapeninja And Ai,https://n8n.io/workflows/2812-scrape-any-web-page-into-structured-json-data-with-scrapeninja-and-ai/
2781,Automated End To End Fine Tuning Of Openai Models With Google Drive Integration,https://n8n.io/workflows/2781-automated-end-to-end-fine-tuning-of-openai-models-with-google-drive-integration/
2777,Deepseek V3 Chat And R1 Reasoning Quick Start,https://n8n.io/workflows/2777-deepseek-v3-chat-and-r1-reasoning-quick-start/
2730,Get Daily Weather And Save It In Airtable,https://n8n.io/workflows/2730-get-daily-weather-and-save-it-in-airtable/
2719,Retry On Fail Except For Known Error,https://n8n.io/workflows/2719-retry-on-fail-except-for-known-error/
2713,Using External Workflows As Tools In N8N,https://n8n.io/workflows/2713-using-external-workflows-as-tools-in-n8n/
2693,Make Openai Citation For File Retrieval Rag,https://n8n.io/workflows/2693-make-openai-citation-for-file-retrieval-rag/
2692,Integrating Ai With Open Meteo Api For Enhanced Weather Forecasting,https://n8n.io/workflows/2692-integrating-ai-with-open-meteo-api-for-enhanced-weather-forecasting/
2667,Auto Workflow Positioning,https://n8n.io/workflows/2667-auto-workflow-positioning/
2658,Api Schema Extractor,https://n8n.io/workflows/2658-api-schema-extractor/
2657,Vector Database As A Big Data Analysis Tool For Ai Agents 22 Knn,https://n8n.io/workflows/2657-vector-database-as-a-big-data-analysis-tool-for-ai-agents-22-knn/
2656,Vector Database As A Big Data Analysis Tool For Ai Agents 33 Anomaly,https://n8n.io/workflows/2656-vector-database-as-a-big-data-analysis-tool-for-ai-agents-33-anomaly/
2655,Vector Database As A Big Data Analysis Tool For Ai Agents 23 Anomaly,https://n8n.io/workflows/2655-vector-database-as-a-big-data-analysis-tool-for-ai-agents-23-anomaly/
2654,Vector Database As A Big Data Analysis Tool For Ai Agents 13 Anomaly12 Knn,https://n8n.io/workflows/2654-vector-database-as-a-big-data-analysis-tool-for-ai-agents-13-anomaly12-knn/
2649,Prompt Based Object Detection With Gemini 20,https://n8n.io/workflows/2649-prompt-based-object-detection-with-gemini-20/
2612,Ai Agent To Chat With Supabasepostgresql Db,https://n8n.io/workflows/2612-ai-agent-to-chat-with-supabasepostgresql-db/
2603,Generate N8N Forms From Airtable And Baserow Tables,https://n8n.io/workflows/2603-generate-n8n-forms-from-airtable-and-baserow-tables/
2576,Import Productboard Notes Companies And Features Into Snowflake,https://n8n.io/workflows/2576-import-productboard-notes-companies-and-features-into-snowflake/
2559,Visualize Your Sql Agent Queries With Openai And Quickchartio,https://n8n.io/workflows/2559-visualize-your-sql-agent-queries-with-openai-and-quickchartio/
2556,Exponential Backoff For Google Apis,https://n8n.io/workflows/2556-exponential-backoff-for-google-apis/
2554,Mongodb Ai Agent Intelligent Movie Recommendations,https://n8n.io/workflows/2554-mongodb-ai-agent-intelligent-movie-recommendations/
2538,Demo Workflow How To Use Workflowstaticdata,https://n8n.io/workflows/2538-demo-workflow-how-to-use-workflowstaticdata/
2536,Pattern For Parallel Sub Workflow Execution Followed By Wait For All Loop,https://n8n.io/workflows/2536-pattern-for-parallel-sub-workflow-execution-followed-by-wait-for-all-loop/
2535,Get Long Lived Facebook User Or Page Access Token,https://n8n.io/workflows/2535-get-long-lived-facebook-user-or-page-access-token/
2508,Generate Sql Queries From Schema Only Ai Powered,https://n8n.io/workflows/2508-generate-sql-queries-from-schema-only-ai-powered/
2490,Build An Endpoint To Perform Crud Operations With Multiple Http Methods,https://n8n.io/workflows/2490-build-an-endpoint-to-perform-crud-operations-with-multiple-http-methods/
2442,Local Multi Llm Testing And Performance Tracker,https://n8n.io/workflows/2442-local-multi-llm-testing-and-performance-tracker/
2440,Building Rag Chatbot For Movie Recommendations With Qdrant And Open Ai,https://n8n.io/workflows/2440-building-rag-chatbot-for-movie-recommendations-with-qdrant-and-open-ai/
2419,Visual Regression Testing With Apify And Ai Vision Model,https://n8n.io/workflows/2419-visual-regression-testing-with-apify-and-ai-vision-model/
2400,Ai Agent With Charts Capabilities Using Openai Structured Output And Quickchart,https://n8n.io/workflows/2400-ai-agent-with-charts-capabilities-using-openai-structured-output-and-quickchart/
2384,Chat With Local Llms Using N8N And Ollama,https://n8n.io/workflows/2384-chat-with-local-llms-using-n8n-and-ollama/
2378,Visualize Your N8N Workflows With Mermaidjs,https://n8n.io/workflows/2378-visualize-your-n8n-workflows-with-mermaidjs/
2368,Preconfigured Nodes For Systemeio Api Requests,https://n8n.io/workflows/2368-preconfigured-nodes-for-systemeio-api-requests/
2344,Generating Image Embeddings Via Textual Summarisation,https://n8n.io/workflows/2344-generating-image-embeddings-via-textual-summarisation/
2343,Introduction To The Http Tool,https://n8n.io/workflows/2343-introduction-to-the-http-tool/
2331,Build Your Own Image Search Using Ai Object Detection Cdn And Elasticsearch,https://n8n.io/workflows/2331-build-your-own-image-search-using-ai-object-detection-cdn-and-elasticsearch/
2319,Better Oauth20 Workflow For Pipedrive Crm With Supabase,https://n8n.io/workflows/2319-better-oauth20-workflow-for-pipedrive-crm-with-supabase/
2284,Provide Real Time Updates For Notion Databases Via Webhooks With Supabase,https://n8n.io/workflows/2284-provide-real-time-updates-for-notion-databases-via-webhooks-with-supabase/
2274,Low Code Api For Flutterflow Apps,https://n8n.io/workflows/2274-low-code-api-for-flutterflow-apps/
2167,Chatgpt Automatic Code Review In Gitlab Mr,https://n8n.io/workflows/2167-chatgpt-automatic-code-review-in-gitlab-mr/
2094,Allow Your Ai To Call An Api To Fetch Data,https://n8n.io/workflows/2094-allow-your-ai-to-call-an-api-to-fetch-data/
2082,Use Any Langchain Module In N8N With The Langchain Code Node,https://n8n.io/workflows/2082-use-any-langchain-module-in-n8n-with-the-langchain-code-node/
2081,Synchronize Your Google Sheets With Postgres,https://n8n.io/workflows/2081-synchronize-your-google-sheets-with-postgres/
2025,Openai Assistant With Custom Tools,https://n8n.io/workflows/2025-openai-assistant-with-custom-tools/
2007,Telegram Echo Bot,https://n8n.io/workflows/2007-telegram-echo-bot/
2006,Ai Agent That Can Scrape Webpages,https://n8n.io/workflows/2006-ai-agent-that-can-scrape-webpages/
1997,Authenticate A User In A Workflow With Openid Connect,https://n8n.io/workflows/1997-authenticate-a-user-in-a-workflow-with-openid-connect/
1980,Use An Open Source Llm Via Huggingface,https://n8n.io/workflows/1980-use-an-open-source-llm-via-huggingface/
1966,Itemmatching Usage Example,https://n8n.io/workflows/1966-itemmatching-usage-example/
1964,Sync Google Sheets Data With Mysql,https://n8n.io/workflows/1964-sync-google-sheets-data-with-mysql/
1963,Ai Conversational Agent With Custom Tool Written In Javascript,https://n8n.io/workflows/1963-ai-conversational-agent-with-custom-tool-written-in-javascript/
1957,Force Ai To Use A Specific Output Format,https://n8n.io/workflows/1957-force-ai-to-use-a-specific-output-format/
1955,Custom Langchain Agent Written In Javascript,https://n8n.io/workflows/1955-custom-langchain-agent-written-in-javascript/
1954,Ai Agent Chat,https://n8n.io/workflows/1954-ai-agent-chat/
1951,Scrape And Summarize Webpages With Ai,https://n8n.io/workflows/1951-scrape-and-summarize-webpages-with-ai/
1948,Xml To Sql Database Import,https://n8n.io/workflows/1948-xml-to-sql-database-import/
1944,Compare Sql Datasets,https://n8n.io/workflows/1944-compare-sql-datasets/
1934,Telegram Ai Chatbot,https://n8n.io/workflows/1934-telegram-ai-chatbot/
1929,V1 Helper Find Params With Affected Expressions,https://n8n.io/workflows/1929-v1-helper-find-params-with-affected-expressions/
1918,Load Data Into Snowflake,https://n8n.io/workflows/1918-load-data-into-snowflake/
1913,Count The Items Returned By A Node,https://n8n.io/workflows/1913-count-the-items-returned-by-a-node/
1900,Openai Examples Chatgpt Dalle 2 Whisper 1 5 In 1,https://n8n.io/workflows/1900-openai-examples-chatgpt-dalle-2-whisper-1-5-in-1/
1862,Openai Gpt 3 Company Enrichment From Website Content,https://n8n.io/workflows/1862-openai-gpt-3-company-enrichment-from-website-content/
1839,Import Csv Into Mysql,https://n8n.io/workflows/1839-import-csv-into-mysql/
1814,Merge Multiple Runs Into One,https://n8n.io/workflows/1814-merge-multiple-runs-into-one/
1753,Import Data From Mysql Into Google Sheets,https://n8n.io/workflows/1753-import-data-from-mysql-into-google-sheets/
1752,Import Data From Google Sheets Into Mysql,https://n8n.io/workflows/1752-import-data-from-google-sheets-into-mysql/
1751,Preparing Data To Be Sent To A Service,https://n8n.io/workflows/1751-preparing-data-to-be-sent-to-a-service/
1750,Creating An Api Endpoint,https://n8n.io/workflows/1750-creating-an-api-endpoint/
1749,Rate Limiting And Waiting For External Events,https://n8n.io/workflows/1749-rate-limiting-and-waiting-for-external-events/
1748,Pulling Data From Services That N8N Doesnt Have A Pre Built Integration For,https://n8n.io/workflows/1748-pulling-data-from-services-that-n8n-doesnt-have-a-pre-built-integration-for/
1747,Joining Different Datasets,https://n8n.io/workflows/1747-joining-different-datasets/
1746,Filtering And Branching Data,https://n8n.io/workflows/1746-filtering-and-branching-data/
1744,Working With Dates And Times,https://n8n.io/workflows/1744-working-with-dates-and-times/
1700,Very Quick Quickstart,https://n8n.io/workflows/1700-very-quick-quickstart/
