id,title,url
1534,Back Up Your N8N Workflows To Github,https://n8n.io/workflows/1534-back-up-your-n8n-workflows-to-github/
1497,Sum Or Aggregate A Column Of Spreadsheet Or Table Data,https://n8n.io/workflows/1497-sum-or-aggregate-a-column-of-spreadsheet-or-table-data/
1440,Handle Verification For Twitter Webhook,https://n8n.io/workflows/1440-handle-verification-for-twitter-webhook/
1435,Convert Json To An Excel File,https://n8n.io/workflows/1435-convert-json-to-an-excel-file/
1401,Collect And Label Images And Send To Google Sheets,https://n8n.io/workflows/1401-collect-and-label-images-and-send-to-google-sheets/
1363,Join Data From Postgres And Mysql,https://n8n.io/workflows/1363-join-data-from-postgres-and-mysql/
1306,Serve A Static Html Page When A Link Is Accessed,https://n8n.io/workflows/1306-serve-a-static-html-page-when-a-link-is-accessed/
1243,Avoid Rate Limiting By Batching Http Requests,https://n8n.io/workflows/1243-avoid-rate-limiting-by-batching-http-requests/
1169,Handle Pagination In Http Requests,https://n8n.io/workflows/1169-handle-pagination-in-http-requests/
1160,Merge Data For Multiple Executions,https://n8n.io/workflows/1160-merge-data-for-multiple-executions/
1073,Scrape And Store Data From Multiple Website Pages,https://n8n.io/workflows/1073-scrape-and-store-data-from-multiple-website-pages/
1069,Send Location Updates Of The Iss To A Topic In Mqtt,https://n8n.io/workflows/1069-send-location-updates-of-the-iss-to-a-topic-in-mqtt/
1049,Send Location Updates Of The Iss Every Minute To A Table In Google Bigquery,https://n8n.io/workflows/1049-send-location-updates-of-the-iss-every-minute-to-a-table-in-google-bigquery/
1047,Send Location Updates Of The Iss Every Minute To A Queue In Aws Sqs,https://n8n.io/workflows/1047-send-location-updates-of-the-iss-every-minute-to-a-queue-in-aws-sqs/
995,Split In Batches Node Noitemsleft Example,https://n8n.io/workflows/995-split-in-batches-node-noitemsleft-example/
980,Load Data Into Spreadsheet Or Database,https://n8n.io/workflows/980-load-data-into-spreadsheet-or-database/
917,Receive Updates Of The Position Of The Iss And Add It To A Table In Timescaledb,https://n8n.io/workflows/917-receive-updates-of-the-position-of-the-iss-and-add-it-to-a-table-in-timescaledb/
879,Access Data From Bubble Application,https://n8n.io/workflows/879-access-data-from-bubble-application/
844,Send Updates About The Position Of The Iss Every Minute To A Topic In Rabbitmq,https://n8n.io/workflows/844-send-updates-about-the-position-of-the-iss-every-minute-to-a-topic-in-rabbitmq/
839,Create Update And Get A Document In Google Cloud Firestore,https://n8n.io/workflows/839-create-update-and-get-a-document-in-google-cloud-firestore/
824,Create A Table And Insert And Update Data In The Table In Snowflake,https://n8n.io/workflows/824-create-a-table-and-insert-and-update-data-in-the-table-in-snowflake/
787,Receive Updates For The Position Of The Iss And Push It To A Firbase,https://n8n.io/workflows/787-receive-updates-for-the-position-of-the-iss-and-push-it-to-a-firbase/
767,Create An Array Of Objects,https://n8n.io/workflows/767-create-an-array-of-objects/
763,Convert An Array Into An Array Of Objects,https://n8n.io/workflows/763-convert-an-array-into-an-array-of-objects/
762,Send Updates About The Position Of The Iss Every Minute To A Topic In Activemq,https://n8n.io/workflows/762-send-updates-about-the-position-of-the-iss-every-minute-to-a-topic-in-activemq/
750,Send Updates About The Position Of The Iss Every Minute To A Topic In Kafka,https://n8n.io/workflows/750-send-updates-about-the-position-of-the-iss-every-minute-to-a-topic-in-kafka/
695,Get Local Datetime Into Function Node Using Momentjs,https://n8n.io/workflows/695-get-local-datetime-into-function-node-using-momentjs/
657,Receive Messages For A Mqtt Queue,https://n8n.io/workflows/657-receive-messages-for-a-mqtt-queue/
655,Merge Greetings With The Users Based On The Language,https://n8n.io/workflows/655-merge-greetings-with-the-users-based-on-the-language/
639,Receive Server Sent Events,https://n8n.io/workflows/639-receive-server-sent-events/
609,Manage Incident Reporting In Pagerduty And Cratedb,https://n8n.io/workflows/609-manage-incident-reporting-in-pagerduty-and-cratedb/
608,Generate And Queue Factory Sensor Data In Amqp,https://n8n.io/workflows/608-generate-and-queue-factory-sensor-data-in-amqp/
602,Manage Users Automatically In Reqresin,https://n8n.io/workflows/602-manage-users-automatically-in-reqresin/
599,Create A Table In Postgres And Insert Data,https://n8n.io/workflows/599-create-a-table-in-postgres-and-insert-data/
598,Create A Table In Mysql And Insert Data,https://n8n.io/workflows/598-create-a-table-in-mysql-and-insert-data/
597,Create A Table In Cratedb And Insert Data,https://n8n.io/workflows/597-create-a-table-in-cratedb-and-insert-data/
592,Create A Table In Quest Db And Insert Data,https://n8n.io/workflows/592-create-a-table-in-quest-db-and-insert-data/
582,Rename A Key In N8N,https://n8n.io/workflows/582-rename-a-key-in-n8n/
575,Convert A Date From One Format To Another,https://n8n.io/workflows/575-convert-a-date-from-one-format-to-another/
563,Get Contributors Information From Github In Slack,https://n8n.io/workflows/563-get-contributors-information-from-github-in-slack/
558,Get The Last Five Spacex Launches From The Spacexland Api Using Graphql,https://n8n.io/workflows/558-get-the-last-five-spacex-launches-from-the-spacexland-api-using-graphql/
557,Get The Value Of A Key From Redis,https://n8n.io/workflows/557-get-the-value-of-a-key-from-redis/
518,Get Entries From A Cockpit Collection,https://n8n.io/workflows/518-get-entries-from-a-cockpit-collection/
513,Receive Messages For An Activemq Queue,https://n8n.io/workflows/513-receive-messages-for-an-activemq-queue/
503,Insert A Document In Mongodb,https://n8n.io/workflows/503-insert-a-document-in-mongodb/
495,Track An Event In Segment,https://n8n.io/workflows/495-track-an-event-in-segment/
479,Execute An Sql Query In Microsoft Sql,https://n8n.io/workflows/479-execute-an-sql-query-in-microsoft-sql/
458,Run A Sql Query On Postgres,https://n8n.io/workflows/458-run-a-sql-query-on-postgres/
450,Get The Community Profile Of A Repository,https://n8n.io/workflows/450-get-the-community-profile-of-a-repository/
356,Generate And Insert Data Into A Postgres Database,https://n8n.io/workflows/356-generate-and-insert-data-into-a-postgres-database/
216,Api Queries Data From Graphql,https://n8n.io/workflows/216-api-queries-data-from-graphql/
156,Get Execute Command Data And Transfer To Json,https://n8n.io/workflows/156-get-execute-command-data-and-transfer-to-json/
119,Webhook Returning Xml,https://n8n.io/workflows/119-webhook-returning-xml/
100,Using The Merge Node Merge By Key,https://n8n.io/workflows/100-using-the-merge-node-merge-by-key/
1,Insert Excel Data To Postgres,https://n8n.io/workflows/1-insert-excel-data-to-postgres/
