id,title,url
5199,E Commerce Product Fine Tuning With Bright Data And Openai,https://n8n.io/workflows/5199-e-commerce-product-fine-tuning-with-bright-data-and-openai/
5196,Smart Email Draft Generator,https://n8n.io/workflows/5196-smart-email-draft-generator/
5195,Ai Powered Product Research And Seo Content Automation,https://n8n.io/workflows/5195-ai-powered-product-research-and-seo-content-automation/
5169,Extract Product Info From Website Screenshots With Dumpling Ai Sheets,https://n8n.io/workflows/5169-extract-product-info-from-website-screenshots-with-dumpling-ai-sheets/
5168,Auto Generate Facebook Posts From Video Insights Using Dumpling Ai Gpt 4O,https://n8n.io/workflows/5168-auto-generate-facebook-posts-from-video-insights-using-dumpling-ai-gpt-4o/
5164,Linkedin Engagement Automator With Gpt 4Oclaude Human Review And Multilingual Comments,https://n8n.io/workflows/5164-linkedin-engagement-automator-with-gpt-4oclaude-human-review-and-multilingual-comments/
5162,Ai Powered Linkedin Content Engine N8N Openai Perplexity Replicate,https://n8n.io/workflows/5162-ai-powered-linkedin-content-engine-n8n-openai-perplexity-replicate/
5159,Ai Content Creation And Auto Wordpress Publishing With Pexels Api Image Workflow,https://n8n.io/workflows/5159-ai-content-creation-and-auto-wordpress-publishing-with-pexels-api-image-workflow/
5158,Generate Realistic Sound Effects With Cassetteai And Save To Google Drive,https://n8n.io/workflows/5158-generate-realistic-sound-effects-with-cassetteai-and-save-to-google-drive/
5156,Transform Books Into 100 Social Media Posts With Deepseek Ai And Google Drive,https://n8n.io/workflows/5156-transform-books-into-100-social-media-posts-with-deepseek-ai-and-google-drive/
5150,Translate Rss Feed Content To Hindi And Publish To Wordpress With Openai,https://n8n.io/workflows/5150-translate-rss-feed-content-to-hindi-and-publish-to-wordpress-with-openai/
5141,Auto Icon And Cover For New Notion Pages,https://n8n.io/workflows/5141-auto-icon-and-cover-for-new-notion-pages/
5139,Automated Instagram Reels Workflow,https://n8n.io/workflows/5139-automated-instagram-reels-workflow/
5128,Auto Publish Web Articles As Social Posts For X Linkedin Reddit And Threads With Gemini Ai,https://n8n.io/workflows/5128-auto-publish-web-articles-as-social-posts-for-x-linkedin-reddit-and-threads-with-gemini-ai/
5110,Create And Upload Ai Generated Asmr Youtube Shorts With Seedance Fal Ai And Gpt 4,https://n8n.io/workflows/5110-create-and-upload-ai-generated-asmr-youtube-shorts-with-seedance-fal-ai-and-gpt-4/
5107,Auto Generate Problem Focused Blog Posts For Shopify Products With Ai,https://n8n.io/workflows/5107-auto-generate-problem-focused-blog-posts-for-shopify-products-with-ai/
5100,Gpt 4O Runwayml Elevenlabs For Social Media,https://n8n.io/workflows/5100-gpt-4o-runwayml-elevenlabs-for-social-media/
5097,Midjourney Image Generator Via Telegram And Goapi,https://n8n.io/workflows/5097-midjourney-image-generator-via-telegram-and-goapi/
5087,Get An Automated Curated Newsletter Everyday Using Perplexity And Gmail,https://n8n.io/workflows/5087-get-an-automated-curated-newsletter-everyday-using-perplexity-and-gmail/
5084,Ai Podcast Generator With Rss Feed And Elevenlabs Voice,https://n8n.io/workflows/5084-ai-podcast-generator-with-rss-feed-and-elevenlabs-voice/
5083,Medical Records Automation With Mistral Ocr And Google Sheets,https://n8n.io/workflows/5083-medical-records-automation-with-mistral-ocr-and-google-sheets/
5082,Ai Powered Proposal Automation Using Google Slides,https://n8n.io/workflows/5082-ai-powered-proposal-automation-using-google-slides/
5068,Daily Ai News Digest To Linkedin Posts With Openai Gpt And Rss Feeds,https://n8n.io/workflows/5068-daily-ai-news-digest-to-linkedin-posts-with-openai-gpt-and-rss-feeds/
5045,Ai Prompt Generator Workflow,https://n8n.io/workflows/5045-ai-prompt-generator-workflow/
5035,Generate And Auto Post Ai Videos To Social Media With Veo3 And Blotato,https://n8n.io/workflows/5035-generate-and-auto-post-ai-videos-to-social-media-with-veo3-and-blotato/
5034,Create Ai Generated Videos 4X Cheaper Than Veo3 With Google Sheets And Falai,https://n8n.io/workflows/5034-create-ai-generated-videos-4x-cheaper-than-veo3-with-google-sheets-and-falai/
5031,Ai Text To Image For Telegram Gemini Hugging Face Flux,https://n8n.io/workflows/5031-ai-text-to-image-for-telegram-gemini-hugging-face-flux/
5027,Generate Ai Avatar Videos With Heygen And Google Sheets Integration,https://n8n.io/workflows/5027-generate-ai-avatar-videos-with-heygen-and-google-sheets-integration/
5017,Place Products On Ai Generated Backgrounds With Google Imagen Ideogram And Placid,https://n8n.io/workflows/5017-place-products-on-ai-generated-backgrounds-with-google-imagen-ideogram-and-placid/
5015,Find And Email Anyone On Linkedin With Openai Hunter And Gmail,https://n8n.io/workflows/5015-find-and-email-anyone-on-linkedin-with-openai-hunter-and-gmail/
5002,Generate Ai Powered Linkedin Posts With Google Gemini And Gen Imager,https://n8n.io/workflows/5002-generate-ai-powered-linkedin-posts-with-google-gemini-and-gen-imager/
5001,Interview Scheduling Automation With Google Sheets Calendar Gmail And Gpt 4O,https://n8n.io/workflows/5001-interview-scheduling-automation-with-google-sheets-calendar-gmail-and-gpt-4o/
4987,3D Product Video Generator From 2D Image For E Commerce Stores,https://n8n.io/workflows/4987-3d-product-video-generator-from-2d-image-for-e-commerce-stores/
4978,Generate Ai Responses With Perplexity Sonar Models Reusable Module,https://n8n.io/workflows/4978-generate-ai-responses-with-perplexity-sonar-models-reusable-module/
4974,Youtube Videos To Viral X Threads By Keywords Using Gemini And Claude,https://n8n.io/workflows/4974-youtube-videos-to-viral-x-threads-by-keywords-using-gemini-and-claude/
4971,Automated Breaking News Headlines With Llama3 Google Search And X Posting,https://n8n.io/workflows/4971-automated-breaking-news-headlines-with-llama3-google-search-and-x-posting/
4969,Automated Tiktok Video Creation Pipeline With Gpt 4O Mini And Sisifai,https://n8n.io/workflows/4969-automated-tiktok-video-creation-pipeline-with-gpt-4o-mini-and-sisifai/
4968,Automated Linkedin Content Creation With Gpt 4 And Dall E For Scheduled Posts,https://n8n.io/workflows/4968-automated-linkedin-content-creation-with-gpt-4-and-dall-e-for-scheduled-posts/
4967,Create Viral Instagram Reel Scenarios From Ideas With Gpt 4O And Telegram,https://n8n.io/workflows/4967-create-viral-instagram-reel-scenarios-from-ideas-with-gpt-4o-and-telegram/
4944,Transcribe And Summarize Telegram Voice Notes With Openai And Deepseek Chat To Google Docs,https://n8n.io/workflows/4944-transcribe-and-summarize-telegram-voice-notes-with-openai-and-deepseek-chat-to-google-docs/
4938,Transcribe Telegram Voice Notes To Google Docs With Openai And Deepseek Summaries,https://n8n.io/workflows/4938-transcribe-telegram-voice-notes-to-google-docs-with-openai-and-deepseek-summaries/
4936,Veo 3 Ad Script Builder Gpt 4 Google Docs Integration,https://n8n.io/workflows/4936-veo-3-ad-script-builder-gpt-4-google-docs-integration/
4935,Amazon Affiliate Links To Mastodon With Ai Descriptions And Shlink Tracking,https://n8n.io/workflows/4935-amazon-affiliate-links-to-mastodon-with-ai-descriptions-and-shlink-tracking/
4927,Complete Lesson Automation For Modern Uk Teachers,https://n8n.io/workflows/4927-complete-lesson-automation-for-modern-uk-teachers/
4921,Generate Trend Based Video Marketing Ideas With Gpt 4 Tavily And Veo 3,https://n8n.io/workflows/4921-generate-trend-based-video-marketing-ideas-with-gpt-4-tavily-and-veo-3/
4918,Ai Powered Restaurant Newsletter Creator With Mailchimp And Telegram Approval,https://n8n.io/workflows/4918-ai-powered-restaurant-newsletter-creator-with-mailchimp-and-telegram-approval/
4916,Transform Images With Ai Prompts Using Flux Kontext Google Sheets And Drive,https://n8n.io/workflows/4916-transform-images-with-ai-prompts-using-flux-kontext-google-sheets-and-drive/
4912,Lead Workflow Yelp And Trustpilot Scraping Openai Analysis Via Brightdata,https://n8n.io/workflows/4912-lead-workflow-yelp-and-trustpilot-scraping-openai-analysis-via-brightdata/
4905,Generate And Publish Seo Optimized Blog Posts To Blogger With Openai And Dall E,https://n8n.io/workflows/4905-generate-and-publish-seo-optimized-blog-posts-to-blogger-with-openai-and-dall-e/
4904,Pyragogy Ai Driven Handbook Generator With Multi Agent Orchestration,https://n8n.io/workflows/4904-pyragogy-ai-driven-handbook-generator-with-multi-agent-orchestration/
4892,Analyze Stock Charts With Gpt 4 Vision And Send Results Via Telegram,https://n8n.io/workflows/4892-analyze-stock-charts-with-gpt-4-vision-and-send-results-via-telegram/
4891,Personalized Linkedin Responses With Openai Gpt And Notion Based Routing,https://n8n.io/workflows/4891-personalized-linkedin-responses-with-openai-gpt-and-notion-based-routing/
4887,Auto Create Podcast From Youtube Transcript Using Dumpling Ai And Gpt 4O,https://n8n.io/workflows/4887-auto-create-podcast-from-youtube-transcript-using-dumpling-ai-and-gpt-4o/
4885,Ai Icebreaker Builder Scrape Sites With Dumpling Ai And Save To Airtable,https://n8n.io/workflows/4885-ai-icebreaker-builder-scrape-sites-with-dumpling-ai-and-save-to-airtable/
4884,Auto Generate Ai News Commentary With Dumpling Ai And Gpt 4O,https://n8n.io/workflows/4884-auto-generate-ai-news-commentary-with-dumpling-ai-and-gpt-4o/
4883,Convert Pdf Documents To Ai Podcasts With Google Gemini And Text To Speech,https://n8n.io/workflows/4883-convert-pdf-documents-to-ai-podcasts-with-google-gemini-and-text-to-speech/
4881,Turn Google Sheets Ideas Into Ai Videos With Gpt 4O And Falai Veo 3,https://n8n.io/workflows/4881-turn-google-sheets-ideas-into-ai-videos-with-gpt-4o-and-falai-veo-3/
4879,Personalized Outreach For Lawyers With Linkedin Scraping Gpt 4O Google Sheets,https://n8n.io/workflows/4879-personalized-outreach-for-lawyers-with-linkedin-scraping-gpt-4o-google-sheets/
4877,Automated Video Creation Using Google Veo3 And N8N Workflow,https://n8n.io/workflows/4877-automated-video-creation-using-google-veo3-and-n8n-workflow/
4874,Transform Voice Transcripts To Linkedin Posts With Claude Ai And Email Automation,https://n8n.io/workflows/4874-transform-voice-transcripts-to-linkedin-posts-with-claude-ai-and-email-automation/
4870,Automated Multilingual Gmail Draft Reply With Openai Gpt 4O,https://n8n.io/workflows/4870-automated-multilingual-gmail-draft-reply-with-openai-gpt-4o/
4853,Automate Gpt 4O Fine Tuning With Google Sheets Or Airtable Data,https://n8n.io/workflows/4853-automate-gpt-4o-fine-tuning-with-google-sheets-or-airtable-data/
4851,Find Relevant X Tweets Based On Your Profile And Suggest Responses,https://n8n.io/workflows/4851-find-relevant-x-tweets-based-on-your-profile-and-suggest-responses/
4848,Automated Music Video Creation And Youtube Publishing With Ai Generated Metadata From Google Drive,https://n8n.io/workflows/4848-automated-music-video-creation-and-youtube-publishing-with-ai-generated-metadata-from-google-drive/
4847,Generate And Send Ai News Newsletters Automatically With Gpt And Gmail,https://n8n.io/workflows/4847-generate-and-send-ai-news-newsletters-automatically-with-gpt-and-gmail/
4846,Generate Ai Videos With Google Veo3 Save To Google Drive And Upload To Youtube,https://n8n.io/workflows/4846-generate-ai-videos-with-google-veo3-save-to-google-drive-and-upload-to-youtube/
4841,Generate Sales Emails Based On Business Events With Explorium Mcp And Claude,https://n8n.io/workflows/4841-generate-sales-emails-based-on-business-events-with-explorium-mcp-and-claude/
4828,Generate Seo Arabic Articles And Save To Notion,https://n8n.io/workflows/4828-generate-seo-arabic-articles-and-save-to-notion/
4817,Composestitch Separate Images Together Using N8N And Gemini Ai Image Editing,https://n8n.io/workflows/4817-composestitch-separate-images-together-using-n8n-and-gemini-ai-image-editing/
4815,Build An Image Restoration Service With N8N And Gemini Ai Image Editing,https://n8n.io/workflows/4815-build-an-image-restoration-service-with-n8n-and-gemini-ai-image-editing/
4808,Convert Documents To Markdown With Mineru Api And Gpt 4O Mini,https://n8n.io/workflows/4808-convert-documents-to-markdown-with-mineru-api-and-gpt-4o-mini/
4807,Smart Email Responder Workflow Using Ai,https://n8n.io/workflows/4807-smart-email-responder-workflow-using-ai/
4804,Ai Premium Proposal Generator With Openai Google Slides And Pandadoc,https://n8n.io/workflows/4804-ai-premium-proposal-generator-with-openai-google-slides-and-pandadoc/
4803,Personalized Linkedin Connection Requests With Apollo Gpt 4 Apify And Phantombuster,https://n8n.io/workflows/4803-personalized-linkedin-connection-requests-with-apollo-gpt-4-apify-and-phantombuster/
4798,Create Character Consistent Images With Flux Kontext And Post To Social Via Upload Post,https://n8n.io/workflows/4798-create-character-consistent-images-with-flux-kontext-and-post-to-social-via-upload-post/
4790,Personalized Crunchbase Lead Outreach With Ai Generated Summaries And Gmail,https://n8n.io/workflows/4790-personalized-crunchbase-lead-outreach-with-ai-generated-summaries-and-gmail/
4777,Transform Documents Into Engaging Linkedin Posts With Gpt 41 And Email Approval,https://n8n.io/workflows/4777-transform-documents-into-engaging-linkedin-posts-with-gpt-41-and-email-approval/
4767,Veo3 Video Generator With Ai Optimization And Google Drive Storage,https://n8n.io/workflows/4767-veo3-video-generator-with-ai-optimization-and-google-drive-storage/
4766,Automate Linkedin Posts With Claude Ai Dall E Images And Google Sheets Approval,https://n8n.io/workflows/4766-automate-linkedin-posts-with-claude-ai-dall-e-images-and-google-sheets-approval/
4765,Generate And Optimize Brand Stories With Ollama Llms And Google Sheets,https://n8n.io/workflows/4765-generate-and-optimize-brand-stories-with-ollama-llms-and-google-sheets/
4762,Automate Sleep Meditation Content Creation With Elevenlabs V3 And Deepseek Ai,https://n8n.io/workflows/4762-automate-sleep-meditation-content-creation-with-elevenlabs-v3-and-deepseek-ai/
4761,Ai Powered Interview Preparation System Using Local Llm For Campus Placements,https://n8n.io/workflows/4761-ai-powered-interview-preparation-system-using-local-llm-for-campus-placements/
4754,Post Ai Videos To Youtube With Fal Ai Veo3 Google Sheets And Youtube Api,https://n8n.io/workflows/4754-post-ai-videos-to-youtube-with-fal-ai-veo3-google-sheets-and-youtube-api/
4751,Automated Video Translation And Distribution With Dublab To Multiple Platforms,https://n8n.io/workflows/4751-automated-video-translation-and-distribution-with-dublab-to-multiple-platforms/
4738,Generate A Legal Website Accessibility Statement With Ai And Wave,https://n8n.io/workflows/4738-generate-a-legal-website-accessibility-statement-with-ai-and-wave/
4736,Generate Personalized Strava Ride Titles And Descriptions With Deepseek Ai,https://n8n.io/workflows/4736-generate-personalized-strava-ride-titles-and-descriptions-with-deepseek-ai/
4735,Ai Blog Generator For Shopify Product Listings Using Gpt 4O And Google Sheets,https://n8n.io/workflows/4735-ai-blog-generator-for-shopify-product-listings-using-gpt-4o-and-google-sheets/
4729,Startup Founder Discovery And Ai Powered Outreach With Crunchbase And Gmail,https://n8n.io/workflows/4729-startup-founder-discovery-and-ai-powered-outreach-with-crunchbase-and-gmail/
4717,Generate Landing Page Layouts From Competitor Analysis With Gpt 4,https://n8n.io/workflows/4717-generate-landing-page-layouts-from-competitor-analysis-with-gpt-4/
4684,Ai Powered Meta Ads Analysis And Creation With Gemini Gpt 41 Mini And Ads Manager,https://n8n.io/workflows/4684-ai-powered-meta-ads-analysis-and-creation-with-gemini-gpt-41-mini-and-ads-manager/
4682,Create An Image Enhancement Api Endpoint With Nero Ai Business Api,https://n8n.io/workflows/4682-create-an-image-enhancement-api-endpoint-with-nero-ai-business-api/
4674,Generate Ai Powered Linkedin Posts With Ollama Image Creation And Gmail Delivery,https://n8n.io/workflows/4674-generate-ai-powered-linkedin-posts-with-ollama-image-creation-and-gmail-delivery/
4672,Voice Creation Tts Sound Effects Voicechanger And More Elevenlabs Mcp Server,https://n8n.io/workflows/4672-voice-creation-tts-sound-effects-voicechanger-and-more-elevenlabs-mcp-server/
4658,Automate Instagram Content Discovery And Repurposing W Apify Gpt 4O And Perplexity,https://n8n.io/workflows/4658-automate-instagram-content-discovery-and-repurposing-w-apify-gpt-4o-and-perplexity/
4652,Ai Agent Creates Content To Be Picked By Chatgpt Gemini Google,https://n8n.io/workflows/4652-ai-agent-creates-content-to-be-picked-by-chatgpt-gemini-google/
4650,Clone Linkedin Writing Styles With Ai Analysis And Prompt Generation To Airtable,https://n8n.io/workflows/4650-clone-linkedin-writing-styles-with-ai-analysis-and-prompt-generation-to-airtable/
4646,Rank Math Bulk Title And Description Optimizer For Wordpress,https://n8n.io/workflows/4646-rank-math-bulk-title-and-description-optimizer-for-wordpress/
4637,Automate Social Media Content With Ai For Instagram Facebook Linkedin And X,https://n8n.io/workflows/4637-automate-social-media-content-with-ai-for-instagram-facebook-linkedin-and-x/
4633,Generate Captions From Autocomplete Ideas Using Dumpling Ai Gpt 4O,https://n8n.io/workflows/4633-generate-captions-from-autocomplete-ideas-using-dumpling-ai-gpt-4o/
4631,Auto Generate Linkedin Posts From Articles With Dumpling Ai And Gpt 4O,https://n8n.io/workflows/4631-auto-generate-linkedin-posts-from-articles-with-dumpling-ai-and-gpt-4o/
4630,Generate Videos With Ai Elevenlabspiapi Shotstackcreatomate And Post To Youtube,https://n8n.io/workflows/4630-generate-videos-with-ai-elevenlabspiapi-shotstackcreatomate-and-post-to-youtube/
4622,Generate Custom Ai Videos With Digital Avatars Using Heygen Api,https://n8n.io/workflows/4622-generate-custom-ai-videos-with-digital-avatars-using-heygen-api/
4606,Automate Travel Agent Outreach With Web Scraping Openai And Google Sheets,https://n8n.io/workflows/4606-automate-travel-agent-outreach-with-web-scraping-openai-and-google-sheets/
4600,Ai Content Generation For Auto Service Automate Your Social Media,https://n8n.io/workflows/4600-ai-content-generation-for-auto-service-automate-your-social-media/
4586,Automate Linkedin Engagement With Phantombuster Openai Gpt And Google Sheets Tracking,https://n8n.io/workflows/4586-automate-linkedin-engagement-with-phantombuster-openai-gpt-and-google-sheets-tracking/
4580,Generate Contextual Youtube Comments Automatically With Gpt 4O,https://n8n.io/workflows/4580-generate-contextual-youtube-comments-automatically-with-gpt-4o/
4569,Create Ai Videos With Scripts Images And Heygen Avatars Limited Time Offer,https://n8n.io/workflows/4569-create-ai-videos-with-scripts-images-and-heygen-avatars-limited-time-offer/
4568,Transform Podcasts Into Viral Tiktok Clips With Gemini Multi Platform Posting,https://n8n.io/workflows/4568-transform-podcasts-into-viral-tiktok-clips-with-gemini-multi-platform-posting/
4558,Generate Complete Business Plans With Customizable Ai Models And Specialized Agents,https://n8n.io/workflows/4558-generate-complete-business-plans-with-customizable-ai-models-and-specialized-agents/
4556,Auto Publish Latest News On X With Ai Content Generation Using Keywords And Bright Data,https://n8n.io/workflows/4556-auto-publish-latest-news-on-x-with-ai-content-generation-using-keywords-and-bright-data/
4553,Generate Guerrilla Marketing Campaign Plans With Ai Swarm Intelligence,https://n8n.io/workflows/4553-generate-guerrilla-marketing-campaign-plans-with-ai-swarm-intelligence/
4546,Auto Generate And Publish Seo Blog Posts To Wordpress With Openrouter And Runware,https://n8n.io/workflows/4546-auto-generate-and-publish-seo-blog-posts-to-wordpress-with-openrouter-and-runware/
4539,Automate Lead Generation With Apollo Ai Scoring And Brevo Email Outreach,https://n8n.io/workflows/4539-automate-lead-generation-with-apollo-ai-scoring-and-brevo-email-outreach/
4532,Real Time Chat Translation With Deepl,https://n8n.io/workflows/4532-real-time-chat-translation-with-deepl/
4528,Transcribe Voice Messages From Telegram Using Openai Whisper 1,https://n8n.io/workflows/4528-transcribe-voice-messages-from-telegram-using-openai-whisper-1/
4510,Sprint Cycle Announcements With Form Input Gpt 4 And Slack,https://n8n.io/workflows/4510-sprint-cycle-announcements-with-form-input-gpt-4-and-slack/
4506,Generate Youtube Video Metadata Timestamps Tags Description,https://n8n.io/workflows/4506-generate-youtube-video-metadata-timestamps-tags-description/
4504,Automate Viral Youtube Titles And Thumbnails Creation Flux1 Apify,https://n8n.io/workflows/4504-automate-viral-youtube-titles-and-thumbnails-creation-flux1-apify/
4496,Wikipedia Podcast Generator Ai Powered Voice Content Creator Via Telegram,https://n8n.io/workflows/4496-wikipedia-podcast-generator-ai-powered-voice-content-creator-via-telegram/
4492,Learn Anything Write A Book Design A Curriculum,https://n8n.io/workflows/4492-learn-anything-write-a-book-design-a-curriculum/
4488,Automate Woocommerce Image Product Background Removal Using Api And Google Sheet,https://n8n.io/workflows/4488-automate-woocommerce-image-product-background-removal-using-api-and-google-sheet/
4487,Automate Linkedin Content From Twitter Ai Posts With Gpt 4 And Google Sheets,https://n8n.io/workflows/4487-automate-linkedin-content-from-twitter-ai-posts-with-gpt-4-and-google-sheets/
4483,Linkedin Post Automation With Ai Gpt 4O Generation And Slack Approval,https://n8n.io/workflows/4483-linkedin-post-automation-with-ai-gpt-4o-generation-and-slack-approval/
4478,Auto Publish Youtube Videos To Facebook And Instagram With Ai Generated Captions,https://n8n.io/workflows/4478-auto-publish-youtube-videos-to-facebook-and-instagram-with-ai-generated-captions/
4472,Ai Powered Loom Video Qanda With Gemini 25 And Slack Notifications,https://n8n.io/workflows/4472-ai-powered-loom-video-qanda-with-gemini-25-and-slack-notifications/
4470,Jobs Newsletter Automation System N8N Boltnew Rapidapi Mailsso And Chatgpt,https://n8n.io/workflows/4470-jobs-newsletter-automation-system-n8n-boltnew-rapidapi-mailsso-and-chatgpt/
4468,Generate Ai Media With Comfyui Images Video 3D And Audio Bridge,https://n8n.io/workflows/4468-generate-ai-media-with-comfyui-images-video-3d-and-audio-bridge/
4467,Generate Enhanced Ai Images Via Telegram With Dall E And Gpt,https://n8n.io/workflows/4467-generate-enhanced-ai-images-via-telegram-with-dall-e-and-gpt/
4450,Automate Face Swapping For Gifs With Falrun Ai And Google Services,https://n8n.io/workflows/4450-automate-face-swapping-for-gifs-with-falrun-ai-and-google-services/
4448,Ai Client Onboarding Agent Auto Welcome Email Generator,https://n8n.io/workflows/4448-ai-client-onboarding-agent-auto-welcome-email-generator/
4445,Generate Ai Stock Images With Flux1 Schnell Metadata Tagging And Google Integration,https://n8n.io/workflows/4445-generate-ai-stock-images-with-flux1-schnell-metadata-tagging-and-google-integration/
4433,Promote Youtube Videos On Reddit With Ai Generated Comments And Email Digest,https://n8n.io/workflows/4433-promote-youtube-videos-on-reddit-with-ai-generated-comments-and-email-digest/
4432,Generate Content Ideas With Gemini Pro And Store In Google Sheets,https://n8n.io/workflows/4432-generate-content-ideas-with-gemini-pro-and-store-in-google-sheets/
4419,Generate Linkedin Posts With Gpt 4 Preview On Whatsapp And Auto Publish,https://n8n.io/workflows/4419-generate-linkedin-posts-with-gpt-4-preview-on-whatsapp-and-auto-publish/
4398,Automate Photo Background Removal With Photoroom Api And Google Drive,https://n8n.io/workflows/4398-automate-photo-background-removal-with-photoroom-api-and-google-drive/
4396,Smart Shopify Agent Ai Powered Abandoned Cart Recovery,https://n8n.io/workflows/4396-smart-shopify-agent-ai-powered-abandoned-cart-recovery/
4391,Generate And Edit Images With Openai Gpt Image 1 And Share Via Telegram,https://n8n.io/workflows/4391-generate-and-edit-images-with-openai-gpt-image-1-and-share-via-telegram/
4379,Website Downtime Alert Via Line Supabase Log,https://n8n.io/workflows/4379-website-downtime-alert-via-line-supabase-log/
4377,Ai Client Onboarding Agent Auto Welcome Email Generator,https://n8n.io/workflows/4377-ai-client-onboarding-agent-auto-welcome-email-generator/
4374,Auto Generate And Distribute Linkedin Posts With Gpt 4 To Profile And Groups,https://n8n.io/workflows/4374-auto-generate-and-distribute-linkedin-posts-with-gpt-4-to-profile-and-groups/
4372,Generate Product Ad Copy And Ctas With Gpt 4 For Slack And Airtable,https://n8n.io/workflows/4372-generate-product-ad-copy-and-ctas-with-gpt-4-for-slack-and-airtable/
4371,Automate Blog Content Creation With Openai Google Sheets And Email Approval Flow,https://n8n.io/workflows/4371-automate-blog-content-creation-with-openai-google-sheets-and-email-approval-flow/
4362,Generate And Publish Seo Optimized Blog Posts To Wordpress,https://n8n.io/workflows/4362-generate-and-publish-seo-optimized-blog-posts-to-wordpress/
4359,Ai Powered Post Sales Call Automated Proposal Generator,https://n8n.io/workflows/4359-ai-powered-post-sales-call-automated-proposal-generator/
4357,Automate Your Linkedin Engagement With Ai Powered Comments,https://n8n.io/workflows/4357-automate-your-linkedin-engagement-with-ai-powered-comments/
4352,Ai Powered Multi Social Media Post Automation Google Trends And Perplexity Ai,https://n8n.io/workflows/4352-ai-powered-multi-social-media-post-automation-google-trends-and-perplexity-ai/
4344,Auto Post Linkedin Updates From Spreadsheet Topics Using Gpt 4O,https://n8n.io/workflows/4344-auto-post-linkedin-updates-from-spreadsheet-topics-using-gpt-4o/
4328,Scrape Tiktok Profile And Transcript With Dumpling Ai And Save To Google Sheets,https://n8n.io/workflows/4328-scrape-tiktok-profile-and-transcript-with-dumpling-ai-and-save-to-google-sheets/
