id,title,url
8258,Learn Secure Webhook Apis With Authentication And Supabase Integration,https://n8n.io/workflows/8258-learn-secure-webhook-apis-with-authentication-and-supabase-integration/
8244,Log E Commerce Orders In Google Sheets With Monthly Tabs And Status Tracking,https://n8n.io/workflows/8244-log-e-commerce-orders-in-google-sheets-with-monthly-tabs-and-status-tracking/
8213,Generate Ai Videos From Text Or Images With Veo 3 Api And Vietvidcom,https://n8n.io/workflows/8213-generate-ai-videos-from-text-or-images-with-veo-3-api-and-vietvidcom/
8210,Summarize Content From Urls Text And Pdfs Using Openai,https://n8n.io/workflows/8210-summarize-content-from-urls-text-and-pdfs-using-openai/
8194,Generate Product Mockups With Nano Banana Gemini 25 Flash Image,https://n8n.io/workflows/8194-generate-product-mockups-with-nano-banana-gemini-25-flash-image/
8189,Generate Ai Videos From Telegram Messages With Nano Banana And Veo 3,https://n8n.io/workflows/8189-generate-ai-videos-from-telegram-messages-with-nano-banana-and-veo-3/
8142,Extract Amazon Book Data And Generate Purchase Reports With Decodo Scraper,https://n8n.io/workflows/8142-extract-amazon-book-data-and-generate-purchase-reports-with-decodo-scraper/
8111,Analyze Google Business Reviews And Send Sentiment Reports To Slack With Gemini,https://n8n.io/workflows/8111-analyze-google-business-reviews-and-send-sentiment-reports-to-slack-with-gemini/
8095,Email New Leads From Google Sheets Via Outlook On A Schedule,https://n8n.io/workflows/8095-email-new-leads-from-google-sheets-via-outlook-on-a-schedule/
8093,Ai Powered Degree Audit System With Google Sheets And Gpt 5,https://n8n.io/workflows/8093-ai-powered-degree-audit-system-with-google-sheets-and-gpt-5/
8090,Generate Student Course Schedules Based On Prerequisites With Gpt And Google Sheets,https://n8n.io/workflows/8090-generate-student-course-schedules-based-on-prerequisites-with-gpt-and-google-sheets/
8077,Service Scheduling And Route Planner For Deliveries With Notion Telegram And Maps,https://n8n.io/workflows/8077-service-scheduling-and-route-planner-for-deliveries-with-notion-telegram-and-maps/
8067,Personalized Evening Wind Down System With Mood Tracking Via Telegram Notion And Email,https://n8n.io/workflows/8067-personalized-evening-wind-down-system-with-mood-tracking-via-telegram-notion-and-email/
8061,Generate Daily Business Digest With Notion Gmail Stripe Calendar And Gpt 4O,https://n8n.io/workflows/8061-generate-daily-business-digest-with-notion-gmail-stripe-calendar-and-gpt-4o/
8055,Automate Client Communications And Management With Notion Gmail And Gpt 4O,https://n8n.io/workflows/8055-automate-client-communications-and-management-with-notion-gmail-and-gpt-4o/
8051,Customer Personality Bazi Disc Numerology With Gemini And Google Sheets,https://n8n.io/workflows/8051-customer-personality-bazi-disc-numerology-with-gemini-and-google-sheets/
8044,Automate Token Purchases With Dollar Cost Averaging On Uniswap V3 And 1Shot Api,https://n8n.io/workflows/8044-automate-token-purchases-with-dollar-cost-averaging-on-uniswap-v3-and-1shot-api/
8042,Version Control N8N Workflows In Gitlab With Customer Tag Organization,https://n8n.io/workflows/8042-version-control-n8n-workflows-in-gitlab-with-customer-tag-organization/
8034,Automate Hs Code Lookup And Enrichment With Google Sheets And Customs Api Beta,https://n8n.io/workflows/8034-automate-hs-code-lookup-and-enrichment-with-google-sheets-and-customs-api-beta/
8022,Auto Generate Virtual Ai Try On Images For Woocommerce With Gemini Nano Banana,https://n8n.io/workflows/8022-auto-generate-virtual-ai-try-on-images-for-woocommerce-with-gemini-nano-banana/
8020,Client Nurture And Testimonial Auto Pilot For Gumroad With Notion And Email,https://n8n.io/workflows/8020-client-nurture-and-testimonial-auto-pilot-for-gumroad-with-notion-and-email/
8018,Leadchat Booker Conversational Lead Capture That Schedules,https://n8n.io/workflows/8018-leadchat-booker-conversational-lead-capture-that-schedules/
8015,Automate Ai Upwork Proposal Generation With Apify Google Gemini And Sheets,https://n8n.io/workflows/8015-automate-ai-upwork-proposal-generation-with-apify-google-gemini-and-sheets/
8008,Smarter Rag Agents With Enriched Retrieval And Modular Workflows,https://n8n.io/workflows/8008-smarter-rag-agents-with-enriched-retrieval-and-modular-workflows/
8004,Generate And Publish Ai Cinematic Videos To Youtube Shorts Using Veo3 And Gemini,https://n8n.io/workflows/8004-generate-and-publish-ai-cinematic-videos-to-youtube-shorts-using-veo3-and-gemini/
8003,Google Maps To Airtable Lead Scraper With Gpt Contact Extraction From Impressum,https://n8n.io/workflows/8003-google-maps-to-airtable-lead-scraper-with-gpt-contact-extraction-from-impressum/
8000,Generate Ai Sales Pitches From Website Urls With Gpt 4O And Google Sheets,https://n8n.io/workflows/8000-generate-ai-sales-pitches-from-website-urls-with-gpt-4o-and-google-sheets/
7982,Generate And Email Pdf Invoices From Tally Forms With Google Docs,https://n8n.io/workflows/7982-generate-and-email-pdf-invoices-from-tally-forms-with-google-docs/
7980,Automate Gmail Organization Weekly Newsletter Archiving And Receipt Labeling,https://n8n.io/workflows/7980-automate-gmail-organization-weekly-newsletter-archiving-and-receipt-labeling/
7979,Chat With Google Drive Documents Using Gpt Pinecone And Rag,https://n8n.io/workflows/7979-chat-with-google-drive-documents-using-gpt-pinecone-and-rag/
7972,Create Structured Notion Workspaces From Notes And Voice Using Gemini And Gpt,https://n8n.io/workflows/7972-create-structured-notion-workspaces-from-notes-and-voice-using-gemini-and-gpt/
7957,Conversational Meta Ads Reporting And Management With Gpt 5,https://n8n.io/workflows/7957-conversational-meta-ads-reporting-and-management-with-gpt-5/
7950,Automate Blog Updates Via Discord With Github And Gemini Ai,https://n8n.io/workflows/7950-automate-blog-updates-via-discord-with-github-and-gemini-ai/
7946,Evaluate Hybrid Search For Legal Question Answering Using Qdrant And Bm25Mxbai,https://n8n.io/workflows/7946-evaluate-hybrid-search-for-legal-question-answering-using-qdrant-and-bm25mxbai/
7945,Index Legal Documents For Hybrid Search With Qdrant Openai And Bm25,https://n8n.io/workflows/7945-index-legal-documents-for-hybrid-search-with-qdrant-openai-and-bm25/
7918,Automatic Pantry Inventory Management With Notion And Email Notifications,https://n8n.io/workflows/7918-automatic-pantry-inventory-management-with-notion-and-email-notifications/
7886,Monitor Tp Link Omada Network Disconnections With Gmail And Pushover,https://n8n.io/workflows/7886-monitor-tp-link-omada-network-disconnections-with-gmail-and-pushover/
7883,Create Multi Speaker Podcasts With Google Sheets Elevenlabs V3 And Drive,https://n8n.io/workflows/7883-create-multi-speaker-podcasts-with-google-sheets-elevenlabs-v3-and-drive/
7876,Workflow Error Logging And Alerts With Google Sheets And Gmail,https://n8n.io/workflows/7876-workflow-error-logging-and-alerts-with-google-sheets-and-gmail/
7860,Cyberpulse Ai Grc Vendor Risk Evaluator,https://n8n.io/workflows/7860-cyberpulse-ai-grc-vendor-risk-evaluator/
7851,Cheaper Faster Accurate Answers With Memory Summarization And Dynamic Routing,https://n8n.io/workflows/7851-cheaper-faster-accurate-answers-with-memory-summarization-and-dynamic-routing/
7849,Extract And Process Healthcare Claims With Vlm Run Google Drive And Sheets,https://n8n.io/workflows/7849-extract-and-process-healthcare-claims-with-vlm-run-google-drive-and-sheets/
7848,Generate Ai Newsletter Drafts From Google Sheets To Notion With Gpt 5 Mini,https://n8n.io/workflows/7848-generate-ai-newsletter-drafts-from-google-sheets-to-notion-with-gpt-5-mini/
7842,Chat With Quickbooks Online Customer Data Via Mcp Server And Gpt 41 Mini,https://n8n.io/workflows/7842-chat-with-quickbooks-online-customer-data-via-mcp-server-and-gpt-41-mini/
7815,Daily Weather Forecast Emails With Meteosource And Gmail,https://n8n.io/workflows/7815-daily-weather-forecast-emails-with-meteosource-and-gmail/
7792,7 Day Pinterest Content Planner With Notion Integration And Email Delivery,https://n8n.io/workflows/7792-7-day-pinterest-content-planner-with-notion-integration-and-email-delivery/
7791,Curate Rss Feeds Into Daily Content Ideas Via Email With Notion And Telegram Options,https://n8n.io/workflows/7791-curate-rss-feeds-into-daily-content-ideas-via-email-with-notion-and-telegram-options/
7789,Weekly Business And Home Task Planner With Notion Email Digests And Telegram,https://n8n.io/workflows/7789-weekly-business-and-home-task-planner-with-notion-email-digests-and-telegram/
7784,Unify Multiple Triggers Into A Single Workflow,https://n8n.io/workflows/7784-unify-multiple-triggers-into-a-single-workflow/
7781,Automated Client Onboarding System With Notion Email And Crm Integration,https://n8n.io/workflows/7781-automated-client-onboarding-system-with-notion-email-and-crm-integration/
7756,Nutrition Tracker And Meal Logger With Telegram Gemini Ai And Google Sheets,https://n8n.io/workflows/7756-nutrition-tracker-and-meal-logger-with-telegram-gemini-ai-and-google-sheets/
7754,Extract Specific Website Data With Form Input Gemini 25 Flash And Gmail,https://n8n.io/workflows/7754-extract-specific-website-data-with-form-input-gemini-25-flash-and-gmail/
7751,Repurpose One Idea Into A Week Of Social Content With Notion And Gpt 4O,https://n8n.io/workflows/7751-repurpose-one-idea-into-a-week-of-social-content-with-notion-and-gpt-4o/
7718,Create A Data Analyst Chatbot For Real Time Google Sheets Analysis With Gpt 5,https://n8n.io/workflows/7718-create-a-data-analyst-chatbot-for-real-time-google-sheets-analysis-with-gpt-5/
7701,Real Time Stock Monitor With Smart Alerts For Indian And Us Markets,https://n8n.io/workflows/7701-real-time-stock-monitor-with-smart-alerts-for-indian-and-us-markets/
7697,Automate Lead Gen From Linkedin Jobs With Apify Apolloio And Google Gemini,https://n8n.io/workflows/7697-automate-lead-gen-from-linkedin-jobs-with-apify-apolloio-and-google-gemini/
7684,Automate Lead Gen And Email Outreach With Apify Apolloio Gpt 4 And Google Sheets,https://n8n.io/workflows/7684-automate-lead-gen-and-email-outreach-with-apify-apolloio-gpt-4-and-google-sheets/
7678,Create Dynamic Crypto Market Monitors With Gemini Ai And Telegram Bot,https://n8n.io/workflows/7678-create-dynamic-crypto-market-monitors-with-gemini-ai-and-telegram-bot/
7673,Daily Trello Task Tracker With Google Sheets History Log,https://n8n.io/workflows/7673-daily-trello-task-tracker-with-google-sheets-history-log/
7672,Generate Daily Pipedrive Deal Summaries With Gpt 4O Mini,https://n8n.io/workflows/7672-generate-daily-pipedrive-deal-summaries-with-gpt-4o-mini/
7671,Blog Writer And Editor With Google Sheets Memory Gpt 4,https://n8n.io/workflows/7671-blog-writer-and-editor-with-google-sheets-memory-gpt-4/
7666,Ai Guest Post Generator With Openai And Google Sheets Automation,https://n8n.io/workflows/7666-ai-guest-post-generator-with-openai-and-google-sheets-automation/
7654,Etl Extract And Parse Revit Model Data To Structured Excel,https://n8n.io/workflows/7654-etl-extract-and-parse-revit-model-data-to-structured-excel/
7653,Calculate Embodied Carbon Co2 For Revitifc Models Using Ai Classification,https://n8n.io/workflows/7653-calculate-embodied-carbon-co2-for-revitifc-models-using-ai-classification/
7652,Estimate Construction Costs From Revitifc Models With Gpt 4 And Claude,https://n8n.io/workflows/7652-estimate-construction-costs-from-revitifc-models-with-gpt-4-and-claude/
7650,Batch Convert Cadbim Files To Xlsxdae With Validation And Reporting,https://n8n.io/workflows/7650-batch-convert-cadbim-files-to-xlsxdae-with-validation-and-reporting/
7649,Convert Revit Projects To Database With Drawings And Specifications Using Ddc,https://n8n.io/workflows/7649-convert-revit-projects-to-database-with-drawings-and-specifications-using-ddc/
7646,Reliable Reddit Subreddit Search With Oauth2 Api Authentication,https://n8n.io/workflows/7646-reliable-reddit-subreddit-search-with-oauth2-api-authentication/
7643,Auto Categorize Gmail Emails With Ai And Send Prioritized Slack Alerts,https://n8n.io/workflows/7643-auto-categorize-gmail-emails-with-ai-and-send-prioritized-slack-alerts/
7633,Smart Gmail Labeling Automation With Text Classifier And Gpt 5,https://n8n.io/workflows/7633-smart-gmail-labeling-automation-with-text-classifier-and-gpt-5/
7632,Automate Morning Brew Style Reddit Digests And Publish To Dev Using Ai,https://n8n.io/workflows/7632-automate-morning-brew-style-reddit-digests-and-publish-to-dev-using-ai/
7625,Smart Gmail Auto Replies While Out Of Office With Ai,https://n8n.io/workflows/7625-smart-gmail-auto-replies-while-out-of-office-with-ai/
7619,Automatic Trello Board Cleanup By Removing Cards With Specific Labels,https://n8n.io/workflows/7619-automatic-trello-board-cleanup-by-removing-cards-with-specific-labels/
7604,Automatic Ftp File Backup To Google Drive With Scheduled Sync,https://n8n.io/workflows/7604-automatic-ftp-file-backup-to-google-drive-with-scheduled-sync/
7601,Instagram Carousel Posts From Google Drive Via Cloudinary With Telegram Alerts,https://n8n.io/workflows/7601-instagram-carousel-posts-from-google-drive-via-cloudinary-with-telegram-alerts/
7579,Generate Authentic Product Reviews With Openai For Woocommerce,https://n8n.io/workflows/7579-generate-authentic-product-reviews-with-openai-for-woocommerce/
7578,Create Photorealistic Social Media Images With Flux Realism Lora Models And Airtable,https://n8n.io/workflows/7578-create-photorealistic-social-media-images-with-flux-realism-lora-models-and-airtable/
7571,Securely Call Private Google Cloud Run Apis With Jwt Authentication Simplified,https://n8n.io/workflows/7571-securely-call-private-google-cloud-run-apis-with-jwt-authentication-simplified/
7569,Automatic Google Cloud Run Auth With Jwt Token Management Sub Workflow,https://n8n.io/workflows/7569-automatic-google-cloud-run-auth-with-jwt-token-management-sub-workflow/
7568,Securely Call Google Cloud Run Apis With Service Account Auth Main Workflow,https://n8n.io/workflows/7568-securely-call-google-cloud-run-apis-with-service-account-auth-main-workflow/
7555,Daily Affirmations And Weekly Gratitude Digest With Notion Email And Telegram,https://n8n.io/workflows/7555-daily-affirmations-and-weekly-gratitude-digest-with-notion-email-and-telegram/
7548,Generate Accessible Alt Text With Ai From Google Sheets To Wordpress,https://n8n.io/workflows/7548-generate-accessible-alt-text-with-ai-from-google-sheets-to-wordpress/
7548,Generate Accessible Alt Text With Claude Ai From Google Sheets To Wordpress,https://n8n.io/workflows/7548-generate-accessible-alt-text-with-claude-ai-from-google-sheets-to-wordpress/
7529,Transform Cloud Documentation Into Security Baselines With Openai And Gdrive,https://n8n.io/workflows/7529-transform-cloud-documentation-into-security-baselines-with-openai-and-gdrive/
7513,Gmail Auto Reply Generator With Chatgpt,https://n8n.io/workflows/7513-gmail-auto-reply-generator-with-chatgpt/
7512,Automated Workflow Backup To Google Drive With Smart Cleanup,https://n8n.io/workflows/7512-automated-workflow-backup-to-google-drive-with-smart-cleanup/
7477,Auto Label Gmail Messages With Custom Categories Using Gpt 4O Mini,https://n8n.io/workflows/7477-auto-label-gmail-messages-with-custom-categories-using-gpt-4o-mini/
7470,Summarize Pdfs With Groq Ai And Convert To Audio Using Qwen Tts,https://n8n.io/workflows/7470-summarize-pdfs-with-groq-ai-and-convert-to-audio-using-qwen-tts/
7467,Leadbot Autopilot Chat To Lead For Salesforce,https://n8n.io/workflows/7467-leadbot-autopilot-chat-to-lead-for-salesforce/
7456,Automate Cv Screening With Ai Candidate Analysis,https://n8n.io/workflows/7456-automate-cv-screening-with-ai-candidate-analysis/
7455,Process Multiple Media Files In Telegram With Gemini Ai And Postgresql Database,https://n8n.io/workflows/7455-process-multiple-media-files-in-telegram-with-gemini-ai-and-postgresql-database/
7454,Monitor Competitors And Generate Content Ideas With Gpt4 And Gemini To Google Sheets,https://n8n.io/workflows/7454-monitor-competitors-and-generate-content-ideas-with-gpt4-and-gemini-to-google-sheets/
7451,Natural Language To Sql Converter For Google Sheets With Gpt 4O,https://n8n.io/workflows/7451-natural-language-to-sql-converter-for-google-sheets-with-gpt-4o/
7429,Automate Meeting Minutes Distribution With Google Sheets And Gmail,https://n8n.io/workflows/7429-automate-meeting-minutes-distribution-with-google-sheets-and-gmail/
7427,Generate Weekly Grocery Lists In Notion With Automated Email Notifications,https://n8n.io/workflows/7427-generate-weekly-grocery-lists-in-notion-with-automated-email-notifications/
7423,Lead Generation Agent,https://n8n.io/workflows/7423-lead-generation-agent/
7422,Amazon Affiliate Marketing Automation,https://n8n.io/workflows/7422-amazon-affiliate-marketing-automation/
7421,Scheduled Daily Affirmations Via Email And Telegram Using Cron,https://n8n.io/workflows/7421-scheduled-daily-affirmations-via-email-and-telegram-using-cron/
7406,Generate Leads From Google Maps With Email,https://n8n.io/workflows/7406-generate-leads-from-google-maps-with-email/
7405,Ai Powered Whatsapp Support Bot With Ticket Creation For Google Sheets,https://n8n.io/workflows/7405-ai-powered-whatsapp-support-bot-with-ticket-creation-for-google-sheets/
7401,Automated Phone Interview Evaluation With Vapi Gpt 4O And Google Sheets,https://n8n.io/workflows/7401-automated-phone-interview-evaluation-with-vapi-gpt-4o-and-google-sheets/
7390,Automate Markerio Issues To Zendesk Support Tickets With Full Technical Context,https://n8n.io/workflows/7390-automate-markerio-issues-to-zendesk-support-tickets-with-full-technical-context/
7388,Automate Markerio Issues To Intercom Conversations With Full Technical Context,https://n8n.io/workflows/7388-automate-markerio-issues-to-intercom-conversations-with-full-technical-context/
7384,Batch Scrape Website Urls From Google Sheets To Google Docs With Firecrawl,https://n8n.io/workflows/7384-batch-scrape-website-urls-from-google-sheets-to-google-docs-with-firecrawl/
7383,Automated Task Tracking And Notifications With Motion And Airtable,https://n8n.io/workflows/7383-automated-task-tracking-and-notifications-with-motion-and-airtable/
7381,Create A Knowledge Powered Chatbot With Claude Supabase And Postgres,https://n8n.io/workflows/7381-create-a-knowledge-powered-chatbot-with-claude-supabase-and-postgres/
7379,Generate Website Sitemaps And Visual Trees With Firecrawl And Google Sheets,https://n8n.io/workflows/7379-generate-website-sitemaps-and-visual-trees-with-firecrawl-and-google-sheets/
7372,Automated Content Strategy With Google Trends News Firecrawl And Claude Ai,https://n8n.io/workflows/7372-automated-content-strategy-with-google-trends-news-firecrawl-and-claude-ai/
7364,Create A Self Hosted Blockchain Payment Processor With X402 And 1Shot Api,https://n8n.io/workflows/7364-create-a-self-hosted-blockchain-payment-processor-with-x402-and-1shot-api/
7349,Cyberpulse Ai Grc Automate Security Questionnaire Responses,https://n8n.io/workflows/7349-cyberpulse-ai-grc-automate-security-questionnaire-responses/
7324,Automate Expense Reporting From Airtable To Quickbooks,https://n8n.io/workflows/7324-automate-expense-reporting-from-airtable-to-quickbooks/
7311,Automated Linkedin Lead Generation And Dm Outreach With Airtable And Unipile,https://n8n.io/workflows/7311-automated-linkedin-lead-generation-and-dm-outreach-with-airtable-and-unipile/
7291,Full Cycle Invoice Automation Airtable Quickbooks And Stripe,https://n8n.io/workflows/7291-full-cycle-invoice-automation-airtable-quickbooks-and-stripe/
7289,Secure Web Form To Odoo Crm Lead Creation With Utm Tracking,https://n8n.io/workflows/7289-secure-web-form-to-odoo-crm-lead-creation-with-utm-tracking/
7288,Generate And Share Professional Pdfs With Openai Google Docs And Slack,https://n8n.io/workflows/7288-generate-and-share-professional-pdfs-with-openai-google-docs-and-slack/
7284,Automated Aws S3 Azure Google To Local Minio Object Backup With Scheduling,https://n8n.io/workflows/7284-automated-aws-s3-azure-google-to-local-minio-object-backup-with-scheduling/
7279,Seo Writer Content Generator 2500 Keywords With Perplexity And Auto Publish,https://n8n.io/workflows/7279-seo-writer-content-generator-2500-keywords-with-perplexity-and-auto-publish/
7273,Automate Quickbooks Customer And Estimate Creation From Google Sheets,https://n8n.io/workflows/7273-automate-quickbooks-customer-and-estimate-creation-from-google-sheets/
7260,Smart Knowledge Base Builder Auto Convert Websites Into Ai Training Data,https://n8n.io/workflows/7260-smart-knowledge-base-builder-auto-convert-websites-into-ai-training-data/
7251,Flag Bounced Emails In Google Sheets From Gmail Delivery Error Messages,https://n8n.io/workflows/7251-flag-bounced-emails-in-google-sheets-from-gmail-delivery-error-messages/
7232,Automatically Save Quickbooks Invoice Pdfs To Google Drive,https://n8n.io/workflows/7232-automatically-save-quickbooks-invoice-pdfs-to-google-drive/
7230,Automate Real Time Quickbooks Invoice Alerts In Slack,https://n8n.io/workflows/7230-automate-real-time-quickbooks-invoice-alerts-in-slack/
7229,Automate Real Time Quickbooks Invoice Sync To Google Sheets,https://n8n.io/workflows/7229-automate-real-time-quickbooks-invoice-sync-to-google-sheets/
7217,Auto Comment On Reddit Posts With Ai Brand Mentions And Baserow Tracking,https://n8n.io/workflows/7217-auto-comment-on-reddit-posts-with-ai-brand-mentions-and-baserow-tracking/
7215,Personal Knowledgebase Ai Agent,https://n8n.io/workflows/7215-personal-knowledgebase-ai-agent/
7210,Smartlead Email Campaign Analytics Dashboard With Google Sheets Integration,https://n8n.io/workflows/7210-smartlead-email-campaign-analytics-dashboard-with-google-sheets-integration/
7207,Automate Wordpress Category Mapping With Gpt 5 Mini Azure Openai,https://n8n.io/workflows/7207-automate-wordpress-category-mapping-with-gpt-5-mini-azure-openai/
7177,Pharmacy Inventory Alerts For Low Stock And Expiring Medicine With Google Sheets,https://n8n.io/workflows/7177-pharmacy-inventory-alerts-for-low-stock-and-expiring-medicine-with-google-sheets/
7168,Ai Powered Elementor Blog Post Automation System For Agencies With Gemini,https://n8n.io/workflows/7168-ai-powered-elementor-blog-post-automation-system-for-agencies-with-gemini/
7163,Automate Hyper Personalized Email Outreach With Ai Gmail And Google Sheets,https://n8n.io/workflows/7163-automate-hyper-personalized-email-outreach-with-ai-gmail-and-google-sheets/
7157,Beginner Outlook Calendar Summary With Openai,https://n8n.io/workflows/7157-beginner-outlook-calendar-summary-with-openai/
7156,Get Started With Google Sheets In N8N,https://n8n.io/workflows/7156-get-started-with-google-sheets-in-n8n/
7155,Beginner Lead Finder Using Serpapi Search,https://n8n.io/workflows/7155-beginner-lead-finder-using-serpapi-search/
7154,Beginner Ai Dataset Generator Using Openai Langchain In N8N,https://n8n.io/workflows/7154-beginner-ai-dataset-generator-using-openai-langchain-in-n8n/
7145,Send Real Time Kuberneteseksgkeaks Cpu Spike Alerts From Prometheus To Slack,https://n8n.io/workflows/7145-send-real-time-kuberneteseksgkeaks-cpu-spike-alerts-from-prometheus-to-slack/
7143,Expense Organizer With Google Drive Routing And Gemini Ai Entity Detection,https://n8n.io/workflows/7143-expense-organizer-with-google-drive-routing-and-gemini-ai-entity-detection/
7142,Voice To Podcast Script Generator With Openai And Notion Via Telegram,https://n8n.io/workflows/7142-voice-to-podcast-script-generator-with-openai-and-notion-via-telegram/
7140,Ai Powered Cold Call Machine With Linkedin Openai And Sales Navigator,https://n8n.io/workflows/7140-ai-powered-cold-call-machine-with-linkedin-openai-and-sales-navigator/
7113,Generate Images With Realistic Inpainting Using Simbrams Ri Ai,https://n8n.io/workflows/7113-generate-images-with-realistic-inpainting-using-simbrams-ri-ai/
7111,Generate 3D Models And Textures From Images With Hunyuan3D Ai,https://n8n.io/workflows/7111-generate-3d-models-and-textures-from-images-with-hunyuan3d-ai/
7098,Generate Text To Video And Image To Video Content With Seedance 1 Lite Ai,https://n8n.io/workflows/7098-generate-text-to-video-and-image-to-video-content-with-seedance-1-lite-ai/
7067,Ai Powered Prompt Enhancement Assistant,https://n8n.io/workflows/7067-ai-powered-prompt-enhancement-assistant/
7041,Send A Voice Note On Telegram To Generate A Professional Email With Chatgpt,https://n8n.io/workflows/7041-send-a-voice-note-on-telegram-to-generate-a-professional-email-with-chatgpt/
7012,Generate Images From Text With Ibm Granite Vision 33 2B Ai Model,https://n8n.io/workflows/7012-generate-images-from-text-with-ibm-granite-vision-33-2b-ai-model/
6993,Scrape Google Maps By Area And Generate Outreach Messages For Lead Generation,https://n8n.io/workflows/6993-scrape-google-maps-by-area-and-generate-outreach-messages-for-lead-generation/
6990,Daily Ad Spend Monitoring With Google Sheets And Slack Threshold Alerts,https://n8n.io/workflows/6990-daily-ad-spend-monitoring-with-google-sheets-and-slack-threshold-alerts/
6966,Generate Videos From Images With Wan 22 I2V A14B Ai Model,https://n8n.io/workflows/6966-generate-videos-from-images-with-wan-22-i2v-a14b-ai-model/
6943,Enhance Your Workflow With 2Ndmoisesgenerator Ai,https://n8n.io/workflows/6943-enhance-your-workflow-with-2ndmoisesgenerator-ai/
6916,Create Viral Linkedin Content With O3 And Gpt 41 Mini Multi Agent Team,https://n8n.io/workflows/6916-create-viral-linkedin-content-with-o3-and-gpt-41-mini-multi-agent-team/
6915,Amplify Social Media Presence With O3 And Gpt 4 Multi Agent Team,https://n8n.io/workflows/6915-amplify-social-media-presence-with-o3-and-gpt-4-multi-agent-team/
6910,Create Multi Channel Content With O3 Director And Gpt 4 Specialist Agents,https://n8n.io/workflows/6910-create-multi-channel-content-with-o3-director-and-gpt-4-specialist-agents/
