id,title,url
4327,Auto Generate Blog And Ai Image From Youtube Videos With Dumpling Ai And Gpt 4O,https://n8n.io/workflows/4327-auto-generate-blog-and-ai-image-from-youtube-videos-with-dumpling-ai-and-gpt-4o/
4288,Convert Rss News To Ai Avatar Videos With Heygen And Gpt 4O,https://n8n.io/workflows/4288-convert-rss-news-to-ai-avatar-videos-with-heygen-and-gpt-4o/
4275,Convert Boring Images To Stunning Photos And Videos,https://n8n.io/workflows/4275-convert-boring-images-to-stunning-photos-and-videos/
4241,Generate Audio From Text Scripts Using Self Hosted Bark Model And Google Drive,https://n8n.io/workflows/4241-generate-audio-from-text-scripts-using-self-hosted-bark-model-and-google-drive/
4233,Translate And Repost Twitter Threads In Multiple Languages With Openai,https://n8n.io/workflows/4233-translate-and-repost-twitter-threads-in-multiple-languages-with-openai/
4227,Multi Platform Video Publishing From Google Sheets To 9 Social Networks Via Blotato Api,https://n8n.io/workflows/4227-multi-platform-video-publishing-from-google-sheets-to-9-social-networks-via-blotato-api/
4226,Automate Rss Content To Blog Posts With Gpt 4O Wordpress And Linkedin Publishing,https://n8n.io/workflows/4226-automate-rss-content-to-blog-posts-with-gpt-4o-wordpress-and-linkedin-publishing/
4210,Personalized Taiwan Indie Music Recommendations With Ai Star Sign And Weather Via Spotify,https://n8n.io/workflows/4210-personalized-taiwan-indie-music-recommendations-with-ai-star-sign-and-weather-via-spotify/
4197,Improve Ai Agent System Prompts With Gpt 4O Feedback Analysis And Email Delivery,https://n8n.io/workflows/4197-improve-ai-agent-system-prompts-with-gpt-4o-feedback-analysis-and-email-delivery/
4191,Automated Lead Research From Linkedin To Ready To Send Report,https://n8n.io/workflows/4191-automated-lead-research-from-linkedin-to-ready-to-send-report/
4110,Clone Viral Tiktoks With Ai Avatars And Auto Post To 9 Platforms Using Perplexity And Blotato,https://n8n.io/workflows/4110-clone-viral-tiktoks-with-ai-avatars-and-auto-post-to-9-platforms-using-perplexity-and-blotato/
4108,Ai Image Generator From Text Built On Falai,https://n8n.io/workflows/4108-ai-image-generator-from-text-built-on-falai/
4107,Create Ai Videos With Openai Scripts Leonardo Images And Heygen Avatars,https://n8n.io/workflows/4107-create-ai-videos-with-openai-scripts-leonardo-images-and-heygen-avatars/
4087,Ai Content Creation And Publishing Engine With Mistral Creatomate And Youtube,https://n8n.io/workflows/4087-ai-content-creation-and-publishing-engine-with-mistral-creatomate-and-youtube/
4082,Automate Seo Blog Creation Social Media With Gpt 4 Perplexity And Wordpress,https://n8n.io/workflows/4082-automate-seo-blog-creation-social-media-with-gpt-4-perplexity-and-wordpress/
4080,Automate Ai News Videos With Gpt 4O Heygen Avatars And Blotato,https://n8n.io/workflows/4080-automate-ai-news-videos-with-gpt-4o-heygen-avatars-and-blotato/
4078,Convert Markdown Content To Contentful Rich Text With Ai Formatting,https://n8n.io/workflows/4078-convert-markdown-content-to-contentful-rich-text-with-ai-formatting/
4075,Automated Tweet Generator And Publisher With Gpt 4 Discord And Google Sheets,https://n8n.io/workflows/4075-automated-tweet-generator-and-publisher-with-gpt-4-discord-and-google-sheets/
4068,Find Reddit Prospects And Generate Personalized Responses With Llama3 Ai And Google Sheets,https://n8n.io/workflows/4068-find-reddit-prospects-and-generate-personalized-responses-with-llama3-ai-and-google-sheets/
4056,Generate Images And Convert To Video Using Flux Kraken And Runway,https://n8n.io/workflows/4056-generate-images-and-convert-to-video-using-flux-kraken-and-runway/
4044,Ai Chatbot Call Center Telegram Call In Production Ready Part 1A,https://n8n.io/workflows/4044-ai-chatbot-call-center-telegram-call-in-production-ready-part-1a/
4033,Ai Powered Blog Post Promoter For Instagram Facebook And X With Gpt,https://n8n.io/workflows/4033-ai-powered-blog-post-promoter-for-instagram-facebook-and-x-with-gpt/
4029,Create And Approve Pov Videos With Ai Elevenlabs And Multi Posting Tiktokigyt,https://n8n.io/workflows/4029-create-and-approve-pov-videos-with-ai-elevenlabs-and-multi-posting-tiktokigyt/
4028,Generate And Publish Carousels For Tiktok And Instagram With Gpt Image 1,https://n8n.io/workflows/4028-generate-and-publish-carousels-for-tiktok-and-instagram-with-gpt-image-1/
4024,Generate And Publish Seo Optimized Wordpress Blog Posts With Ai,https://n8n.io/workflows/4024-generate-and-publish-seo-optimized-wordpress-blog-posts-with-ai/
4022,Ai Optimized Content Posting To X Discord And Linkedin With Openrouter,https://n8n.io/workflows/4022-ai-optimized-content-posting-to-x-discord-and-linkedin-with-openrouter/
4013,Automatic Jest Test Generation For Github Prs With Dual Ai Review,https://n8n.io/workflows/4013-automatic-jest-test-generation-for-github-prs-with-dual-ai-review/
4012,Generate Knowledge Base Articles With Gpt And Perplexity Ai For Contentful Cms,https://n8n.io/workflows/4012-generate-knowledge-base-articles-with-gpt-and-perplexity-ai-for-contentful-cms/
4007,Generate Recipes From Ingredients With Ollama Ai Chef Agent,https://n8n.io/workflows/4007-generate-recipes-from-ingredients-with-ollama-ai-chef-agent/
4005,Ai Generated Linkedin Posts With Openai Google Sheets And Email Approval Workflow,https://n8n.io/workflows/4005-ai-generated-linkedin-posts-with-openai-google-sheets-and-email-approval-workflow/
4001,Automated Daily Customer Win Back Campaign With Ai Offers,https://n8n.io/workflows/4001-automated-daily-customer-win-back-campaign-with-ai-offers/
3980,Audit And Generate Json Ld Schema Markup For Seo With Gpt 41 Mini Gmail,https://n8n.io/workflows/3980-audit-and-generate-json-ld-schema-markup-for-seo-with-gpt-41-mini-gmail/
3978,Auto Generate And Post Tweet Threads Based On Google Trends Using Gemini Ai,https://n8n.io/workflows/3978-auto-generate-and-post-tweet-threads-based-on-google-trends-using-gemini-ai/
3959,Redesign T Shirt Mockups To Print Ready Files With Gpt 4 Vision And Imagen 4,https://n8n.io/workflows/3959-redesign-t-shirt-mockups-to-print-ready-files-with-gpt-4-vision-and-imagen-4/
3958,Automate New Customer Onboarding With Hubspot Google Calendar And Ai Powered Gmail,https://n8n.io/workflows/3958-automate-new-customer-onboarding-with-hubspot-google-calendar-and-ai-powered-gmail/
3954,Generate Logos And Images With Consistent Visual Styles Using Imagen 30,https://n8n.io/workflows/3954-generate-logos-and-images-with-consistent-visual-styles-using-imagen-30/
3930,Voice To Email Response System With Telegram Openai Whisper And Gmail,https://n8n.io/workflows/3930-voice-to-email-response-system-with-telegram-openai-whisper-and-gmail/
3908,Comprehensive Seo Keyword Research With Openai And Dataforseo Analytics To Nocodb,https://n8n.io/workflows/3908-comprehensive-seo-keyword-research-with-openai-and-dataforseo-analytics-to-nocodb/
3906,Automate Youtube Uploads With Ai Generated Metadata From Google Drive,https://n8n.io/workflows/3906-automate-youtube-uploads-with-ai-generated-metadata-from-google-drive/
3900,Automated Youtube Video Scheduling And Ai Metadata Generation,https://n8n.io/workflows/3900-automated-youtube-video-scheduling-and-ai-metadata-generation/
3894,Convert Images To 3D Models With Fal Ai Trellis And Store In Google Drive,https://n8n.io/workflows/3894-convert-images-to-3d-models-with-fal-ai-trellis-and-store-in-google-drive/
3887,Auto Generate And Publish Seo Articles To Wordpress With Gpt 4 Postgres Tracking,https://n8n.io/workflows/3887-auto-generate-and-publish-seo-articles-to-wordpress-with-gpt-4-postgres-tracking/
3874,Automate Seo Blog Content Creation With Gpt 4 Perplexity Ai And Wordpress,https://n8n.io/workflows/3874-automate-seo-blog-content-creation-with-gpt-4-perplexity-ai-and-wordpress/
3862,Automate Research Based Newsletters With Perplexity Gpt 4 And Image Generation,https://n8n.io/workflows/3862-automate-research-based-newsletters-with-perplexity-gpt-4-and-image-generation/
3858,Openai Imagegen1 Via Http Request Edit Image,https://n8n.io/workflows/3858-openai-imagegen1-via-http-request-edit-image/
3852,Multi Level Wordpress Blog Generator With Perplexityai Research And Openai Content,https://n8n.io/workflows/3852-multi-level-wordpress-blog-generator-with-perplexityai-research-and-openai-content/
3840,Automated Ai Content Creation And Instagram Publishing From Google Sheets,https://n8n.io/workflows/3840-automated-ai-content-creation-and-instagram-publishing-from-google-sheets/
3824,Auto Generate Mvp Startup Ideas From Reddit With Ai And Excel Storage,https://n8n.io/workflows/3824-auto-generate-mvp-startup-ideas-from-reddit-with-ai-and-excel-storage/
3822,Auto Post Breaking News Content Using Perplexity Ai To X Twitter,https://n8n.io/workflows/3822-auto-post-breaking-news-content-using-perplexity-ai-to-x-twitter/
3816,Multi Platform Social Media Publisher With Blotato Gpt 4 Mini And Airtable,https://n8n.io/workflows/3816-multi-platform-social-media-publisher-with-blotato-gpt-4-mini-and-airtable/
3814,Generate Ai Songs Music Videos Using Suno Api Flux Runway And Creatomate,https://n8n.io/workflows/3814-generate-ai-songs-music-videos-using-suno-api-flux-runway-and-creatomate/
3788,Ai Powered Youtube Meta Generator With Gpt 4O Gemini And Content Enrichment,https://n8n.io/workflows/3788-ai-powered-youtube-meta-generator-with-gpt-4o-gemini-and-content-enrichment/
3776,Turn Youtube Rss Videos Into Social Posts With Dumpling Ai And Airtable,https://n8n.io/workflows/3776-turn-youtube-rss-videos-into-social-posts-with-dumpling-ai-and-airtable/
3775,Gemini Ai Video Analysis,https://n8n.io/workflows/3775-gemini-ai-video-analysis/
3758,Ai Personalized Multi Product Email Outreach With Smtp Rotation Gpt 4Oo3 Mini,https://n8n.io/workflows/3758-ai-personalized-multi-product-email-outreach-with-smtp-rotation-gpt-4oo3-mini/
3741,The Ultimate Instagram Automation For High Quality Images And Text With Gpt Image,https://n8n.io/workflows/3741-the-ultimate-instagram-automation-for-high-quality-images-and-text-with-gpt-image/
3725,Wordpress Content Automation Machine With Human In The Loop And Deep Research,https://n8n.io/workflows/3725-wordpress-content-automation-machine-with-human-in-the-loop-and-deep-research/
3724,Smart Job Search Resume Scoring And Tailoring With Openai Apify And Airtable,https://n8n.io/workflows/3724-smart-job-search-resume-scoring-and-tailoring-with-openai-apify-and-airtable/
3716,Convert 3 View Drawings To 360 Videos With Gpt 4O Image And Kling Api,https://n8n.io/workflows/3716-convert-3-view-drawings-to-360-videos-with-gpt-4o-image-and-kling-api/
3714,Youtube Video To Wordpress Blog Automation With Gemini Ai And Affiliate Integration,https://n8n.io/workflows/3714-youtube-video-to-wordpress-blog-automation-with-gemini-ai-and-affiliate-integration/
3710,Generate Images With Gpt Image 1 And Store In Google Drive With Cost Tracking,https://n8n.io/workflows/3710-generate-images-with-gpt-image-1-and-store-in-google-drive-with-cost-tracking/
3705,Generate Custom Ai Images With Openai Gpt Image 1 Model,https://n8n.io/workflows/3705-generate-custom-ai-images-with-openai-gpt-image-1-model/
3700,Automated Generation Of Ai Advertising Photos For Product Marketing,https://n8n.io/workflows/3700-automated-generation-of-ai-advertising-photos-for-product-marketing/
3696,Generate And Edit Images With Openais Gpt Image 1 Model,https://n8n.io/workflows/3696-generate-and-edit-images-with-openais-gpt-image-1-model/
3691,Generate Ai News Linkedin Posts With Gpt 4O Mini Newsapi And Qdrant,https://n8n.io/workflows/3691-generate-ai-news-linkedin-posts-with-gpt-4o-mini-newsapi-and-qdrant/
3688,Generate Images With Openai New Gpt Image 1 Model Via User Friendly Form,https://n8n.io/workflows/3688-generate-images-with-openai-new-gpt-image-1-model-via-user-friendly-form/
3672,Seo Blog Generator With Gpt 4O Perplexity And Telegram Integration,https://n8n.io/workflows/3672-seo-blog-generator-with-gpt-4o-perplexity-and-telegram-integration/
3668,Altcoin News To Linkedin Posts With Deepseek Ai And Google Sheets,https://n8n.io/workflows/3668-altcoin-news-to-linkedin-posts-with-deepseek-ai-and-google-sheets/
3663,Business Model Canvas Ai Powered Generator Llm Flexible,https://n8n.io/workflows/3663-business-model-canvas-ai-powered-generator-llm-flexible/
3655,Create Animated Stories Using Gpt 4O Mini Midjourney Kling And Creatomate Api,https://n8n.io/workflows/3655-create-animated-stories-using-gpt-4o-mini-midjourney-kling-and-creatomate-api/
3654,Auto Create And Publish Ai Social Videos With Telegram Gpt 4 And Blotato,https://n8n.io/workflows/3654-auto-create-and-publish-ai-social-videos-with-telegram-gpt-4-and-blotato/
3640,Improve Your Website Accessibility With Gpt 4O And Google Sheet,https://n8n.io/workflows/3640-improve-your-website-accessibility-with-gpt-4o-and-google-sheet/
3627,Generate Graphic Wallpaper With Midjourney Gpt 4O Mini And Canvas Apis,https://n8n.io/workflows/3627-generate-graphic-wallpaper-with-midjourney-gpt-4o-mini-and-canvas-apis/
3626,Create Animated Illustrations From Text Prompts With Midjourney And Kling Api,https://n8n.io/workflows/3626-create-animated-illustrations-from-text-prompts-with-midjourney-and-kling-api/
3624,Scrape Competitor Reviews And Generate Ad Creatives With Bright Data And Openai,https://n8n.io/workflows/3624-scrape-competitor-reviews-and-generate-ad-creatives-with-bright-data-and-openai/
3623,Ai Powered Gmail Mcp Server,https://n8n.io/workflows/3623-ai-powered-gmail-mcp-server/
3616,Automated Lead Generation And Contact Enrichment With Hunterio And Perplexity Ai,https://n8n.io/workflows/3616-automated-lead-generation-and-contact-enrichment-with-hunterio-and-perplexity-ai/
3607,Find High Intent Sales Leads By Scraping Glassdoor With Bright Data And Gpt,https://n8n.io/workflows/3607-find-high-intent-sales-leads-by-scraping-glassdoor-with-bright-data-and-gpt/
3583,High Level Service Page Seo Blueprint Report Generator,https://n8n.io/workflows/3583-high-level-service-page-seo-blueprint-report-generator/
3567,Automate Pdf Image Extraction And Analysis With Gpt 4O And Google Drive,https://n8n.io/workflows/3567-automate-pdf-image-extraction-and-analysis-with-gpt-4o-and-google-drive/
3561,Automate Hyper Personalized Outreach At Scale With Bright Data And Llms,https://n8n.io/workflows/3561-automate-hyper-personalized-outreach-at-scale-with-bright-data-and-llms/
3560,Extract Trends Auto Generate Social Content With Ai Reddit Google And Post,https://n8n.io/workflows/3560-extract-trends-auto-generate-social-content-with-ai-reddit-google-and-post/
3553,Ai Powered Youtube Shorts Automation Create And Publish With Openai And Elevenlabs,https://n8n.io/workflows/3553-ai-powered-youtube-shorts-automation-create-and-publish-with-openai-and-elevenlabs/
3547,Convert Text To Speech With Local Kokoro Tts,https://n8n.io/workflows/3547-convert-text-to-speech-with-local-kokoro-tts/
3544,Generate Seo Keywords With Ai Topic To Keyword List In Seconds,https://n8n.io/workflows/3544-generate-seo-keywords-with-ai-topic-to-keyword-list-in-seconds/
3538,Create Ai News Videos With Heygen Avatars And Auto Post To Social Media,https://n8n.io/workflows/3538-create-ai-news-videos-with-heygen-avatars-and-auto-post-to-social-media/
3531,Convert Youtube Videos Into Seo Blog Posts With Gpt 4O Dumpling Ai And Flux,https://n8n.io/workflows/3531-convert-youtube-videos-into-seo-blog-posts-with-gpt-4o-dumpling-ai-and-flux/
3527,Compare Sequential Agent Based And Parallel Llm Processing With Claude 37,https://n8n.io/workflows/3527-compare-sequential-agent-based-and-parallel-llm-processing-with-claude-37/
3510,Ai Driven Woocommerce Product Importer From Google Sheet With Yoast Seo Meta,https://n8n.io/workflows/3510-ai-driven-woocommerce-product-importer-from-google-sheet-with-yoast-seo-meta/
3509,Transform Gmail Newsletters Into Insightful Linkedin Posts Using Openai,https://n8n.io/workflows/3509-transform-gmail-newsletters-into-insightful-linkedin-posts-using-openai/
3503,Generate Written Content With Gpt Recursive Writing And Editing Agents,https://n8n.io/workflows/3503-generate-written-content-with-gpt-recursive-writing-and-editing-agents/
3501,Generate And Auto Post Social Videos To Multiple Platforms With Gpt 4 And Kling Ai,https://n8n.io/workflows/3501-generate-and-auto-post-social-videos-to-multiple-platforms-with-gpt-4-and-kling-ai/
3500,Ai Agent To Create Linkedin Posts For Blog Promotion With Gpt 4O,https://n8n.io/workflows/3500-ai-agent-to-create-linkedin-posts-for-blog-promotion-with-gpt-4o/
3478,Automate Instagram Posts With Google Drive Ai Captions And Facebook Api,https://n8n.io/workflows/3478-automate-instagram-posts-with-google-drive-ai-captions-and-facebook-api/
3472,Automate Wordpress Contact Form Cf7 Responses And Classification With Gemini,https://n8n.io/workflows/3472-automate-wordpress-contact-form-cf7-responses-and-classification-with-gemini/
3460,Ai Design Team Generate And Review Ai Images With Ideogram And Openai,https://n8n.io/workflows/3460-ai-design-team-generate-and-review-ai-images-with-ideogram-and-openai/
3442,Fully Automated Ai Video Generation And Multi Platform Publishing,https://n8n.io/workflows/3442-fully-automated-ai-video-generation-and-multi-platform-publishing/
3438,Automatically Create Cinematic Quote Videos With Ai And Upload To Youtube,https://n8n.io/workflows/3438-automatically-create-cinematic-quote-videos-with-ai-and-upload-to-youtube/
3416,Generate Ai Youtube Shorts With Flux Runway Eleven Labs And Creatomate,https://n8n.io/workflows/3416-generate-ai-youtube-shorts-with-flux-runway-eleven-labs-and-creatomate/
3411,Generate 360 Virtual Try On Videos For Clothing With Kling Api Unofficial,https://n8n.io/workflows/3411-generate-360-virtual-try-on-videos-for-clothing-with-kling-api-unofficial/
3407,Convert Reddit Threads Into Short Vertical Videos With Ai,https://n8n.io/workflows/3407-convert-reddit-threads-into-short-vertical-videos-with-ai/
3397,Personalise Outreach Emails Using Customer Data And Ai,https://n8n.io/workflows/3397-personalise-outreach-emails-using-customer-data-and-ai/
3388,Transcribe Audio Files With Google Gemini And Telegram,https://n8n.io/workflows/3388-transcribe-audio-files-with-google-gemini-and-telegram/
3381,Transcribe Youtube Videos With Ai Enhancement Via Chat Interface,https://n8n.io/workflows/3381-transcribe-youtube-videos-with-ai-enhancement-via-chat-interface/
3367,Instagram Reels Automation Turn Youtube Videos Into Viral Instagram Reels,https://n8n.io/workflows/3367-instagram-reels-automation-turn-youtube-videos-into-viral-instagram-reels/
3348,Automate Blog Content Creation With Notion Mcp Deepseek Ai And Wordpress,https://n8n.io/workflows/3348-automate-blog-content-creation-with-notion-mcp-deepseek-ai-and-wordpress/
3342,Automate Sales For Digital Products And Saas With Ai Gpt 4O,https://n8n.io/workflows/3342-automate-sales-for-digital-products-and-saas-with-ai-gpt-4o/
3336,Automate Blog Content Creation With Gpt 4 Perplexity And Wordpress,https://n8n.io/workflows/3336-automate-blog-content-creation-with-gpt-4-perplexity-and-wordpress/
3335,Linkedin Profile Finder Via Form Using Bright Data And Gpt 4O Mini,https://n8n.io/workflows/3335-linkedin-profile-finder-via-form-using-bright-data-and-gpt-4o-mini/
3302,Transform Press Releases Pdf And Word Into Polished Articles With Gmail And Openai,https://n8n.io/workflows/3302-transform-press-releases-pdf-and-word-into-polished-articles-with-gmail-and-openai/
3291,Generate Seo Optimized Wordpress Content With Ai Powered Perplexity Research,https://n8n.io/workflows/3291-generate-seo-optimized-wordpress-content-with-ai-powered-perplexity-research/
3259,Automate Linkedin Candidates Sourcing With Google X Ray Boolean Search,https://n8n.io/workflows/3259-automate-linkedin-candidates-sourcing-with-google-x-ray-boolean-search/
3200,Automate Video Creation With Luma Ai Dream Machine And Airtable Part 1,https://n8n.io/workflows/3200-automate-video-creation-with-luma-ai-dream-machine-and-airtable-part-1/
3195,Generate Anki Flash Cards For Language Learning With Google Translate And Gpt,https://n8n.io/workflows/3195-generate-anki-flash-cards-for-language-learning-with-google-translate-and-gpt/
3194,Automated Voice Appointment Reminders With Google Calendar Gpt Elevenlabs Gmail,https://n8n.io/workflows/3194-automated-voice-appointment-reminders-with-google-calendar-gpt-elevenlabs-gmail/
3185,Compare Local Ollama Vision Models For Image Analysis Using Google Docs,https://n8n.io/workflows/3185-compare-local-ollama-vision-models-for-image-analysis-using-google-docs/
3161,Generate Content From Google Sheets To X With Gpt 4,https://n8n.io/workflows/3161-generate-content-from-google-sheets-to-x-with-gpt-4/
3155,Automatic Weekly Digital Pr Stories Suggestions With Reddit And Anthropic,https://n8n.io/workflows/3155-automatic-weekly-digital-pr-stories-suggestions-with-reddit-and-anthropic/
3149,Image Based Data Extraction Api Using Gemini Ai,https://n8n.io/workflows/3149-image-based-data-extraction-api-using-gemini-ai/
3121,Ai Powered Short Form Video Generator With Openai Flux Kling And Elevenlabs,https://n8n.io/workflows/3121-ai-powered-short-form-video-generator-with-openai-flux-kling-and-elevenlabs/
3105,Automate Audiovideo Transcription In Any Language With The New Elevenlabs Model,https://n8n.io/workflows/3105-automate-audiovideo-transcription-in-any-language-with-the-new-elevenlabs-model/
3102,Parse And Extract Data From Documentsimages With Mistral Ocr,https://n8n.io/workflows/3102-parse-and-extract-data-from-documentsimages-with-mistral-ocr/
3088,Generate Ai Powered Video From Image And Upload It On Google Drive,https://n8n.io/workflows/3088-generate-ai-powered-video-from-image-and-upload-it-on-google-drive/
3086,Publish Wordpress Posts To Social Media X Facebook Linkedin Instagram With Ai,https://n8n.io/workflows/3086-publish-wordpress-posts-to-social-media-x-facebook-linkedin-instagram-with-ai/
3085,Automate Seo Optimized Wordpress Posts With Ai And Google Sheets,https://n8n.io/workflows/3085-automate-seo-optimized-wordpress-posts-with-ai-and-google-sheets/
3082,Social Media Content Generator And Publisher Or X Linkedin,https://n8n.io/workflows/3082-social-media-content-generator-and-publisher-or-x-linkedin/
3078,5 Ways To Process Images And Pdfs With Gemini Ai In N8N,https://n8n.io/workflows/3078-5-ways-to-process-images-and-pdfs-with-gemini-ai-in-n8n/
3076,Use Openai To Transcribe Audio Summarize With Ai Save To Google Drive,https://n8n.io/workflows/3076-use-openai-to-transcribe-audio-summarize-with-ai-save-to-google-drive/
3066,Automate Multi Platform Social Media Content Creation With Ai,https://n8n.io/workflows/3066-automate-multi-platform-social-media-content-creation-with-ai/
3057,Create Social Media Content From Telegram With Ai,https://n8n.io/workflows/3057-create-social-media-content-from-telegram-with-ai/
3054,Generate Ai Videos From Text With Heygen And Voice Cloning,https://n8n.io/workflows/3054-generate-ai-videos-from-text-with-heygen-and-voice-cloning/
3044,Automatically Generate Burn In Video Captions With Json2Video,https://n8n.io/workflows/3044-automatically-generate-burn-in-video-captions-with-json2video/
3018,Automated Content Generation And Publishing Wordpress,https://n8n.io/workflows/3018-automated-content-generation-and-publishing-wordpress/
3010,Easy Wordpress Content Creation From Pdf Docs Human In The Loop Gmail,https://n8n.io/workflows/3010-easy-wordpress-content-creation-from-pdf-docs-human-in-the-loop-gmail/
3004,Tiktok Video Automation Tool Highly Optimized With Openai And Replicate,https://n8n.io/workflows/3004-tiktok-video-automation-tool-highly-optimized-with-openai-and-replicate/
3003,Monitor Favorite Youtube Channels Through Rss Feeds And Receive Notifications,https://n8n.io/workflows/3003-monitor-favorite-youtube-channels-through-rss-feeds-and-receive-notifications/
2981,Your First Wordpress Ai Content Creator Quick Start,https://n8n.io/workflows/2981-your-first-wordpress-ai-content-creator-quick-start/
2976,Automatically Create Youtube Metadata With Ai,https://n8n.io/workflows/2976-automatically-create-youtube-metadata-with-ai/
2972,Turn Bbc News Articles Into Podcasts Using Hugging Face And Google Gemini,https://n8n.io/workflows/2972-turn-bbc-news-articles-into-podcasts-using-hugging-face-and-google-gemini/
2971,Automated Faceless Youtube Video Generator Using Leonardo Ai And Creatomate,https://n8n.io/workflows/2971-automated-faceless-youtube-video-generator-using-leonardo-ai-and-creatomate/
2963,Automate Woocommerce Seo With Yoast And Ai Powered Meta Tag Generation For Free,https://n8n.io/workflows/2963-automate-woocommerce-seo-with-yoast-and-ai-powered-meta-tag-generation-for-free/
2957,Essential Multipage Website Scraper With Jinaai,https://n8n.io/workflows/2957-essential-multipage-website-scraper-with-jinaai/
2950,Ai Powered Social Media Content Generator And Publisher,https://n8n.io/workflows/2950-ai-powered-social-media-content-generator-and-publisher/
2941,Youtube Shorts Automation Tool,https://n8n.io/workflows/2941-youtube-shorts-automation-tool/
2907,A Very Simple Human In The Loop Email Response System Using Ai And Imap,https://n8n.io/workflows/2907-a-very-simple-human-in-the-loop-email-response-system-using-ai-and-imap/
2894,Upload To Instagram Tiktok And Youtube From Google Drive,https://n8n.io/workflows/2894-upload-to-instagram-tiktok-and-youtube-from-google-drive/
2873,Author And Publish Blog Posts From Google Sheets,https://n8n.io/workflows/2873-author-and-publish-blog-posts-from-google-sheets/
2861,Ai Powered Email Processing Autoresponder And Response Approval Yesno,https://n8n.io/workflows/2861-ai-powered-email-processing-autoresponder-and-response-approval-yesno/
2856,Automatic Youtube Shorts Generator,https://n8n.io/workflows/2856-automatic-youtube-shorts-generator/
