id,title,url
6909,Multi Agent Cold Email Campaign Generator With O3 Director And Gpt 41 Specialists,https://n8n.io/workflows/6909-multi-agent-cold-email-campaign-generator-with-o3-director-and-gpt-41-specialists/
6890,Generate High Quality Audio With Voxtral Small 24B 2507,https://n8n.io/workflows/6890-generate-high-quality-audio-with-voxtral-small-24b-2507/
6876,Generate Animated Human Videos From Images And Audio With Bytedance Omni Human,https://n8n.io/workflows/6876-generate-animated-human-videos-from-images-and-audio-with-bytedance-omni-human/
6840,Extract Contacts From Business Cards To Google Sheets With Gpt4O,https://n8n.io/workflows/6840-extract-contacts-from-business-cards-to-google-sheets-with-gpt4o/
6827,Ai Generated Linkedin Posts With Human Approval Using Gpt 4 Gotohuman And Blotato,https://n8n.io/workflows/6827-ai-generated-linkedin-posts-with-human-approval-using-gpt-4-gotohuman-and-blotato/
6768,Auto Comment On Instagram Posts With Gpt 4O Phantombuster And Sharepoint,https://n8n.io/workflows/6768-auto-comment-on-instagram-posts-with-gpt-4o-phantombuster-and-sharepoint/
6765,Scheduled Instagram Auto Liker With Phantombuster Gpt 4O And Cookie Rotation,https://n8n.io/workflows/6765-scheduled-instagram-auto-liker-with-phantombuster-gpt-4o-and-cookie-rotation/
6764,Automatic Linkedin Engagement With Ai Comments Using Gpt 4O And Phantombuster,https://n8n.io/workflows/6764-automatic-linkedin-engagement-with-ai-comments-using-gpt-4o-and-phantombuster/
6734,Ai Blog Automation Publish Hourly Seo Articles To Wordpress And Twitter V3,https://n8n.io/workflows/6734-ai-blog-automation-publish-hourly-seo-articles-to-wordpress-and-twitter-v3/
6534,Ai Proposal Generator,https://n8n.io/workflows/6534-ai-proposal-generator/
6533,Personalized Thank You Emails With Website Scraping Gpt 4O And Gmail,https://n8n.io/workflows/6533-personalized-thank-you-emails-with-website-scraping-gpt-4o-and-gmail/
6531,Linkedin Content Creator System,https://n8n.io/workflows/6531-linkedin-content-creator-system/
6530,Generate Personalized Icebreakers,https://n8n.io/workflows/6530-generate-personalized-icebreakers/
6524,Automate Ai News Videos To Social Media With Gpt 4O And Heygen And Postiz,https://n8n.io/workflows/6524-automate-ai-news-videos-to-social-media-with-gpt-4o-and-heygen-and-postiz/
6518,Automatic Job Listings Extraction And Publishing Template,https://n8n.io/workflows/6518-automatic-job-listings-extraction-and-publishing-template/
6517,Automate Patient Journey With Gpt 4 Twilio And Slack Notifications,https://n8n.io/workflows/6517-automate-patient-journey-with-gpt-4-twilio-and-slack-notifications/
6386,Auto Follow Up For Canceled Calendly Meetings With Gpt 4 Loom And Asana,https://n8n.io/workflows/6386-auto-follow-up-for-canceled-calendly-meetings-with-gpt-4-loom-and-asana/
6363,Generate And Upload Images With Leonardo Ai Wordpress And Twitter,https://n8n.io/workflows/6363-generate-and-upload-images-with-leonardo-ai-wordpress-and-twitter/
6278,Auto Generate Seo Content From Trends With Gpt 4O Fal Ai And Multi Storage,https://n8n.io/workflows/6278-auto-generate-seo-content-from-trends-with-gpt-4o-fal-ai-and-multi-storage/
6247,Optimize Speed Critical Workflows Using Parallel Processing Fan Outfan In,https://n8n.io/workflows/6247-optimize-speed-critical-workflows-using-parallel-processing-fan-outfan-in/
6165,Automate Google Business Profile Posts With Gpt 4 And Google Sheets,https://n8n.io/workflows/6165-automate-google-business-profile-posts-with-gpt-4-and-google-sheets/
6151,Make Every Product Photo Look Like A Luxury Ad Fully Automated Ai Google Drive,https://n8n.io/workflows/6151-make-every-product-photo-look-like-a-luxury-ad-fully-automated-ai-google-drive/
6150,Auto Germany Apartment Search And Apply With Immobilienscout24 And Google Services,https://n8n.io/workflows/6150-auto-germany-apartment-search-and-apply-with-immobilienscout24-and-google-services/
6117,End To End Blog Generation For Wordpress With Llm Agentsandimage Gpt 5 Optimized,https://n8n.io/workflows/6117-end-to-end-blog-generation-for-wordpress-with-llm-agentsandimage-gpt-5-optimized/
6102,Salesforce Lead Capture With Gpt 4 Personalized Email And Sms Follow Up,https://n8n.io/workflows/6102-salesforce-lead-capture-with-gpt-4-personalized-email-and-sms-follow-up/
6090,Weekly Financial Markets Report Generate With Gemini Ai For Telegram And Discord,https://n8n.io/workflows/6090-weekly-financial-markets-report-generate-with-gemini-ai-for-telegram-and-discord/
6089,Automate Cold Outreach With Email Personalization Using Gemini And Google Sheets,https://n8n.io/workflows/6089-automate-cold-outreach-with-email-personalization-using-gemini-and-google-sheets/
6084,Viral Video Generator Heygen To Tiktok And Instagram Auto Post Any Content,https://n8n.io/workflows/6084-viral-video-generator-heygen-to-tiktok-and-instagram-auto-post-any-content/
6081,Generate And Auto Evaluate Facebook Ad Headlines Using Gpt 4O Mini,https://n8n.io/workflows/6081-generate-and-auto-evaluate-facebook-ad-headlines-using-gpt-4o-mini/
6067,Auto Generate Seo Blog Posts With Perplexity Gpt Leonardo And Wordpress,https://n8n.io/workflows/6067-auto-generate-seo-blog-posts-with-perplexity-gpt-leonardo-and-wordpress/
6048,Auto Bidder For Freelancercom With Telegram Approval And Ai Proposals,https://n8n.io/workflows/6048-auto-bidder-for-freelancercom-with-telegram-approval-and-ai-proposals/
6047,Ai Video Generator With Google Veo3 Api Veo 3 Fast,https://n8n.io/workflows/6047-ai-video-generator-with-google-veo3-api-veo-3-fast/
6046,Suno Ai Music Generator Using Suno Api Suno V45,https://n8n.io/workflows/6046-suno-ai-music-generator-using-suno-api-suno-v45/
6039,Outreach For Your Product Using Apollo Linkedin Gpt 41 And Sendgrid,https://n8n.io/workflows/6039-outreach-for-your-product-using-apollo-linkedin-gpt-41-and-sendgrid/
6027,Ai Powered Lead Generation System With Email Personalization And Linkedin,https://n8n.io/workflows/6027-ai-powered-lead-generation-system-with-email-personalization-and-linkedin/
5988,Bilingual Newsletters With Gpt 4O Ai Images And Videos For Hubspot And Sp,https://n8n.io/workflows/5988-bilingual-newsletters-with-gpt-4o-ai-images-and-videos-for-hubspot-and-sp/
5979,Automated Content Marketing Intelligence With Openai Ahrefs And Multi Platform Integration,https://n8n.io/workflows/5979-automated-content-marketing-intelligence-with-openai-ahrefs-and-multi-platform-integration/
5942,Generate Social Media Content From Video Transcripts With Gemini Ai And Airtable,https://n8n.io/workflows/5942-generate-social-media-content-from-video-transcripts-with-gemini-ai-and-airtable/
5938,Ai Powered Lead Research And Personalized Email Generation With Groq And Google Sheets,https://n8n.io/workflows/5938-ai-powered-lead-research-and-personalized-email-generation-with-groq-and-google-sheets/
5936,Personalized Hotel Reward Emails For High Spenders With Salesforce Gemini Ai And Brevo,https://n8n.io/workflows/5936-personalized-hotel-reward-emails-for-high-spenders-with-salesforce-gemini-ai-and-brevo/
5934,Automated Blog Post Generation With Gpt 4 And Publishing To Ghost Cms,https://n8n.io/workflows/5934-automated-blog-post-generation-with-gpt-4-and-publishing-to-ghost-cms/
5932,Generate And Store Ai Images With Sora Gpt Google Drive And Sheets,https://n8n.io/workflows/5932-generate-and-store-ai-images-with-sora-gpt-google-drive-and-sheets/
5929,Text To Image Generation With Flux Ai Google Drive Storage And Sheets Logging,https://n8n.io/workflows/5929-text-to-image-generation-with-flux-ai-google-drive-storage-and-sheets-logging/
5925,Create A Speech To Text Api With Openai Gpt4O Mini Transcribe,https://n8n.io/workflows/5925-create-a-speech-to-text-api-with-openai-gpt4o-mini-transcribe/
5922,Create Food Emoji Icons With Openai Gpt And Image Generation,https://n8n.io/workflows/5922-create-food-emoji-icons-with-openai-gpt-and-image-generation/
5919,Generate Social Media Content Across Platforms With Gpt 4 And Auto Scheduler,https://n8n.io/workflows/5919-generate-social-media-content-across-platforms-with-gpt-4-and-auto-scheduler/
5916,Viral Video Creator Falai Ai Videos Tiktok Youtube And Instagram Automation,https://n8n.io/workflows/5916-viral-video-creator-falai-ai-videos-tiktok-youtube-and-instagram-automation/
5913,Generate And Schedule Social Posts With Geminiopenai For X And Linkedin,https://n8n.io/workflows/5913-generate-and-schedule-social-posts-with-geminiopenai-for-x-and-linkedin/
5910,Auto Generate And Post Instagram Reels With Veo3 Openai And Blotato,https://n8n.io/workflows/5910-auto-generate-and-post-instagram-reels-with-veo3-openai-and-blotato/
5909,Automate Daily Hindu Festival Posts On X With Google Gemini And Gpt 4O Mini,https://n8n.io/workflows/5909-automate-daily-hindu-festival-posts-on-x-with-google-gemini-and-gpt-4o-mini/
5907,Automate Lead Capture With Ai Personalized Whatsapp Messages Via Unipile And Google Sheets Crm,https://n8n.io/workflows/5907-automate-lead-capture-with-ai-personalized-whatsapp-messages-via-unipile-and-google-sheets-crm/
5906,Automated Job Applications And Status Tracking With Linkedin Indeed And Google Sheets,https://n8n.io/workflows/5906-automated-job-applications-and-status-tracking-with-linkedin-indeed-and-google-sheets/
5902,Multilingual Youtube Metadata Translator With Gemini Ai And Google Sheets,https://n8n.io/workflows/5902-multilingual-youtube-metadata-translator-with-gemini-ai-and-google-sheets/
5900,Text To Image Generator With Google Sheets And Drive Integration Using Flux Ai,https://n8n.io/workflows/5900-text-to-image-generator-with-google-sheets-and-drive-integration-using-flux-ai/
5882,Automate Tiktok Video Transcription With Rapidapi And Google Sheets,https://n8n.io/workflows/5882-automate-tiktok-video-transcription-with-rapidapi-and-google-sheets/
5880,Generate Lead Magnet Ideas From Google Sheets Using Rapidapi Ai,https://n8n.io/workflows/5880-generate-lead-magnet-ideas-from-google-sheets-using-rapidapi-ai/
5877,Food Menu Update Notifier,https://n8n.io/workflows/5877-food-menu-update-notifier/
5875,Generate Personalized Marketing Emails From Google Sheets With Llama Ai,https://n8n.io/workflows/5875-generate-personalized-marketing-emails-from-google-sheets-with-llama-ai/
5871,Generate Food Recipes From Gmail And Form Requests With Ollama And Llama 32,https://n8n.io/workflows/5871-generate-food-recipes-from-gmail-and-form-requests-with-ollama-and-llama-32/
5864,Extract Text From Images With Telegram Bot And Gemini 20 Flash Ocr,https://n8n.io/workflows/5864-extract-text-from-images-with-telegram-bot-and-gemini-20-flash-ocr/
5856,Generate Personalized Cold Email Openers From Linkedin Posts With Gpt 4O,https://n8n.io/workflows/5856-generate-personalized-cold-email-openers-from-linkedin-posts-with-gpt-4o/
5849,Generate Instagram Reels With Veo3 And Gpt For Ai Powered Ad Creation,https://n8n.io/workflows/5849-generate-instagram-reels-with-veo3-and-gpt-for-ai-powered-ad-creation/
5843,Auto Generate Product Comparison Pages With Openai And Google Sheets,https://n8n.io/workflows/5843-auto-generate-product-comparison-pages-with-openai-and-google-sheets/
5842,Transform Reddit Questions Into Seo Blog Posts With Openai And Google Sheets,https://n8n.io/workflows/5842-transform-reddit-questions-into-seo-blog-posts-with-openai-and-google-sheets/
5841,Automate Social Media Posts With Ai Content And Images Across Twitter Linkedin And Facebook,https://n8n.io/workflows/5841-automate-social-media-posts-with-ai-content-and-images-across-twitter-linkedin-and-facebook/
5840,Automate Linkedin Post Creation With Image Using Google Gemini And Dall E,https://n8n.io/workflows/5840-automate-linkedin-post-creation-with-image-using-google-gemini-and-dall-e/
5835,Create Low Cost Ai Videos With Veo3 Fast And Upload To Youtube And Tiktok,https://n8n.io/workflows/5835-create-low-cost-ai-videos-with-veo3-fast-and-upload-to-youtube-and-tiktok/
5832,Qualify And Reach Out To B2B Leads With Groq Ai Apollo Gmail And Sheets,https://n8n.io/workflows/5832-qualify-and-reach-out-to-b2b-leads-with-groq-ai-apollo-gmail-and-sheets/
5829,Generate Dynamic Json Output Formats For Ai Agents With Mistral,https://n8n.io/workflows/5829-generate-dynamic-json-output-formats-for-ai-agents-with-mistral/
5818,Automated Thai Content Creation And Publishing With Ollama Gemini And Telegram,https://n8n.io/workflows/5818-automated-thai-content-creation-and-publishing-with-ollama-gemini-and-telegram/
5805,Create Youtube Shorts Scripts From Video Links With Gemini Ai And Telegram,https://n8n.io/workflows/5805-create-youtube-shorts-scripts-from-video-links-with-gemini-ai-and-telegram/
5799,Generate Ad Image Variations Using Gpt 4 Dumpling Ai And Google Drive,https://n8n.io/workflows/5799-generate-ad-image-variations-using-gpt-4-dumpling-ai-and-google-drive/
5798,Turn Youtube Transcripts Into Newsletter Drafts Using Dumpling Ai Gpt 4O,https://n8n.io/workflows/5798-turn-youtube-transcripts-into-newsletter-drafts-using-dumpling-ai-gpt-4o/
5796,Create Ai News Avatar Videos With Dumpling Ai Gpt 4O And Heygen,https://n8n.io/workflows/5796-create-ai-news-avatar-videos-with-dumpling-ai-gpt-4o-and-heygen/
5792,Create Literary Englishgerman To Chinese Dictionary With Gpt 4O Mini And Supabase,https://n8n.io/workflows/5792-create-literary-englishgerman-to-chinese-dictionary-with-gpt-4o-mini-and-supabase/
5787,From Google Drive To Instagram Tiktok And Youtube With Ai Descriptions And Airtable Tracking,https://n8n.io/workflows/5787-from-google-drive-to-instagram-tiktok-and-youtube-with-ai-descriptions-and-airtable-tracking/
5779,Generate Natural Voices With Google Text To Speech Drive And Airtable,https://n8n.io/workflows/5779-generate-natural-voices-with-google-text-to-speech-drive-and-airtable/
5777,Text To Image Generation With Google Gemini And Enhanced Prompts Via Telegram Bot,https://n8n.io/workflows/5777-text-to-image-generation-with-google-gemini-and-enhanced-prompts-via-telegram-bot/
5774,Generate Linkedin Posts And Ai Images From Web Pages With Airtop And Gpt 4,https://n8n.io/workflows/5774-generate-linkedin-posts-and-ai-images-from-web-pages-with-airtop-and-gpt-4/
5755,Transform Old Photos Into Animated Videos With Flux And Kling Ai For Social Media,https://n8n.io/workflows/5755-transform-old-photos-into-animated-videos-with-flux-and-kling-ai-for-social-media/
5741,Generate Cinematic Videos From Text Prompts With Gpt 4O Falai Seedance And Audio,https://n8n.io/workflows/5741-generate-cinematic-videos-from-text-prompts-with-gpt-4o-falai-seedance-and-audio/
5707,Create Structured Ebooks In Minutes With Google Gemini Flash 20 To Google Docs,https://n8n.io/workflows/5707-create-structured-ebooks-in-minutes-with-google-gemini-flash-20-to-google-docs/
5698,Auto Extract And Distribute Video Clips To Multiple Social Platforms With Klap Ai,https://n8n.io/workflows/5698-auto-extract-and-distribute-video-clips-to-multiple-social-platforms-with-klap-ai/
5694,Automate Newsletter Creation And Client Delivery With Gpt 4O Google Sheets,https://n8n.io/workflows/5694-automate-newsletter-creation-and-client-delivery-with-gpt-4o-google-sheets/
5691,Generate Personalized Sales Emails With Linkedin Data And Claude 37 Via Openrouter,https://n8n.io/workflows/5691-generate-personalized-sales-emails-with-linkedin-data-and-claude-37-via-openrouter/
5683,One Click Youtube Shorts Generator With Leonardo Ai Gpt And Elevenlabs,https://n8n.io/workflows/5683-one-click-youtube-shorts-generator-with-leonardo-ai-gpt-and-elevenlabs/
5674,Generate Trend Based Marketing Videos With Seedance Ai Perplexity And Gpt,https://n8n.io/workflows/5674-generate-trend-based-marketing-videos-with-seedance-ai-perplexity-and-gpt/
5671,Youtube To Multilingual Blogs Convert Videos To Seo Friendly Google Doc Articles,https://n8n.io/workflows/5671-youtube-to-multilingual-blogs-convert-videos-to-seo-friendly-google-doc-articles/
5666,Transform Text Into Ai Videos With Google Veo3 Leonardoai And Claude 4,https://n8n.io/workflows/5666-transform-text-into-ai-videos-with-google-veo3-leonardoai-and-claude-4/
5662,Transform Voice Memos Into Daily Journals And Tasks With Omime And Gemini Ai,https://n8n.io/workflows/5662-transform-voice-memos-into-daily-journals-and-tasks-with-omime-and-gemini-ai/
5660,Generate Personalized Language Learning News Digests With Llama 31 And Deepseek Ai,https://n8n.io/workflows/5660-generate-personalized-language-learning-news-digests-with-llama-31-and-deepseek-ai/
5640,Background Removal Api Mcp Server,https://n8n.io/workflows/5640-background-removal-api-mcp-server/
5633,Transform Images Into Ai Videos With Minimax Hailuo 02 And Upload To Youtubetiktok,https://n8n.io/workflows/5633-transform-images-into-ai-videos-with-minimax-hailuo-02-and-upload-to-youtubetiktok/
5631,Transform Youtube Videos Into Interactive Mcq Quizzes With Google Forms And Gemini Ai,https://n8n.io/workflows/5631-transform-youtube-videos-into-interactive-mcq-quizzes-with-google-forms-and-gemini-ai/
5626,Free Ai Image Generator N8N Automation Workflow With Geminichatgpt,https://n8n.io/workflows/5626-free-ai-image-generator-n8n-automation-workflow-with-geminichatgpt/
5622,Generate Swot Analysis Reports With Openai Google Sheets And Apitemplate Pdf Export,https://n8n.io/workflows/5622-generate-swot-analysis-reports-with-openai-google-sheets-and-apitemplate-pdf-export/
5619,Generate And Publish Professional Coe Blogs With Gemini Ai And Google Drive,https://n8n.io/workflows/5619-generate-and-publish-professional-coe-blogs-with-gemini-ai-and-google-drive/
5617,Generating Seo Optimized Product Descriptions For Shopify And Google Shopping Using Ai,https://n8n.io/workflows/5617-generating-seo-optimized-product-descriptions-for-shopify-and-google-shopping-using-ai/
5615,Email Based Book Recommendations With Ollama Llm And Openlibrary Api,https://n8n.io/workflows/5615-email-based-book-recommendations-with-ollama-llm-and-openlibrary-api/
5608,Convert Youtube Videos To Shorts With Klap And Auto Post To Multiple Social Platforms,https://n8n.io/workflows/5608-convert-youtube-videos-to-shorts-with-klap-and-auto-post-to-multiple-social-platforms/
5598,Seo Blog Publishing For Jekyll With Gpt 4 Github And Social Sharing,https://n8n.io/workflows/5598-seo-blog-publishing-for-jekyll-with-gpt-4-github-and-social-sharing/
5597,Iterative Content Refinement With Gpt 4 Multi Agent Feedback System,https://n8n.io/workflows/5597-iterative-content-refinement-with-gpt-4-multi-agent-feedback-system/
5596,Generate Brand Marketing Shorts With Gpt 4 Fal Ai And Elevenlabs For Social Media,https://n8n.io/workflows/5596-generate-brand-marketing-shorts-with-gpt-4-fal-ai-and-elevenlabs-for-social-media/
5553,Automate Asmr Video Creation And Distribution With Falai And Social Media Integration,https://n8n.io/workflows/5553-automate-asmr-video-creation-and-distribution-with-falai-and-social-media-integration/
5531,Auto Generate And Post Linkedin Content For Amazon Sellers With Gpt 4O And Apify,https://n8n.io/workflows/5531-auto-generate-and-post-linkedin-content-for-amazon-sellers-with-gpt-4o-and-apify/
5525,Generate And Email Personalized Jokes With Gpt 4O Mini And Gmail,https://n8n.io/workflows/5525-generate-and-email-personalized-jokes-with-gpt-4o-mini-and-gmail/
5507,Analyze Images From Forms Using Gpt 4O Mini Vision And Deliver To Telegram,https://n8n.io/workflows/5507-analyze-images-from-forms-using-gpt-4o-mini-vision-and-deliver-to-telegram/
5504,Generate Blogs With Gpt 4O Prompt Chaining Outline Evaluate And Publish To Sheets,https://n8n.io/workflows/5504-generate-blogs-with-gpt-4o-prompt-chaining-outline-evaluate-and-publish-to-sheets/
5492,Generate And Send Spare Parts Price Quotes With Gmail Sheets And Gemini Ai,https://n8n.io/workflows/5492-generate-and-send-spare-parts-price-quotes-with-gmail-sheets-and-gemini-ai/
5486,Auto Generate And Post Ai Images To Facebook Using Gemini And Pollinations Ai,https://n8n.io/workflows/5486-auto-generate-and-post-ai-images-to-facebook-using-gemini-and-pollinations-ai/
5479,Ai Powered Automated Outreach With Scheduling Gemini Gmail And Google Sheets,https://n8n.io/workflows/5479-ai-powered-automated-outreach-with-scheduling-gemini-gmail-and-google-sheets/
5462,Generate Images With Openai Dall E Via Telegram And Log To Google Sheets,https://n8n.io/workflows/5462-generate-images-with-openai-dall-e-via-telegram-and-log-to-google-sheets/
5450,Send Ai Enhanced Economic Calendar Alerts To Telegram With Gemini 20 Flash,https://n8n.io/workflows/5450-send-ai-enhanced-economic-calendar-alerts-to-telegram-with-gemini-20-flash/
5448,Clone Voices From Text To Speech With Zyphra Zonos Api,https://n8n.io/workflows/5448-clone-voices-from-text-to-speech-with-zyphra-zonos-api/
5430,Market Research And Business Case Generator With Gpt 4O Perplexity And Claude,https://n8n.io/workflows/5430-market-research-and-business-case-generator-with-gpt-4o-perplexity-and-claude/
5422,Pt Clinic Ai Cold Email Sequence Generator With Gpt4,https://n8n.io/workflows/5422-pt-clinic-ai-cold-email-sequence-generator-with-gpt4/
5421,Ai Powered Lead Enrichment With Explorium Mcp And Telegram,https://n8n.io/workflows/5421-ai-powered-lead-enrichment-with-explorium-mcp-and-telegram/
5420,Edit And Deliver Images With Dall E 2 Google Drive And Telegram Messaging,https://n8n.io/workflows/5420-edit-and-deliver-images-with-dall-e-2-google-drive-and-telegram-messaging/
5417,Ai Facebook Ad Spy Tool With Apify Openai Gemini And Google Sheets,https://n8n.io/workflows/5417-ai-facebook-ad-spy-tool-with-apify-openai-gemini-and-google-sheets/
5416,Scrape Ai News From Multiple Sources To Markdown And Google Drive With Rssapp,https://n8n.io/workflows/5416-scrape-ai-news-from-multiple-sources-to-markdown-and-google-drive-with-rssapp/
5413,Extract Text From Images With Telegram Bot And Ocr Tesseractjs,https://n8n.io/workflows/5413-extract-text-from-images-with-telegram-bot-and-ocr-tesseractjs/
5409,Transform Images With Ai Image Editor Using Flux1 Kontext,https://n8n.io/workflows/5409-transform-images-with-ai-image-editor-using-flux1-kontext/
5400,The Title Is Very Good Clearly Conveying The Templates Purpose While Mentioning Key Technologies,https://n8n.io/workflows/5400-the-title-is-very-good-clearly-conveying-the-templates-purpose-while-mentioning-key-technologies/
5397,Auto Generate And Approve Social Media Posts From Rss Feeds With Openai And Telegram,https://n8n.io/workflows/5397-auto-generate-and-approve-social-media-posts-from-rss-feeds-with-openai-and-telegram/
5394,Turns Reddit Pain Points Into Comic Ads Using Dumpling Ai And Gpt 4O,https://n8n.io/workflows/5394-turns-reddit-pain-points-into-comic-ads-using-dumpling-ai-and-gpt-4o/
5393,Convert Form Inputs To Cinematic Videos With Gpt 4 Dumpling Ai And Elevenlabs Audio,https://n8n.io/workflows/5393-convert-form-inputs-to-cinematic-videos-with-gpt-4-dumpling-ai-and-elevenlabs-audio/
5391,Smart Invoice Collection System With Gpt 41 Gmail And Google Sheets,https://n8n.io/workflows/5391-smart-invoice-collection-system-with-gpt-41-gmail-and-google-sheets/
5383,Automate Viral Content Creation With Openai Elevenlabs And Falai For Videos Podcasts And Asmr,https://n8n.io/workflows/5383-automate-viral-content-creation-with-openai-elevenlabs-and-falai-for-videos-podcasts-and-asmr/
5379,Create Ai Generated Music Playlists For Youtube Using Suno Gpt 4 Runway And Creatomate,https://n8n.io/workflows/5379-create-ai-generated-music-playlists-for-youtube-using-suno-gpt-4-runway-and-creatomate/
5374,Generate And Publish Seo Articles With Claude Ai Webflow And Image Generation,https://n8n.io/workflows/5374-generate-and-publish-seo-articles-with-claude-ai-webflow-and-image-generation/
5372,Auto Reply To Google Play Store Reviews With Gpt 4O And Sentiment Analysis,https://n8n.io/workflows/5372-auto-reply-to-google-play-store-reviews-with-gpt-4o-and-sentiment-analysis/
5338,Generate Ai Viral Videos With Seedance And Upload To Tiktok Youtube And Instagram,https://n8n.io/workflows/5338-generate-ai-viral-videos-with-seedance-and-upload-to-tiktok-youtube-and-instagram/
5324,Viral Asmr Video Factory Automatically Generate Viral Videos On Autopilot,https://n8n.io/workflows/5324-viral-asmr-video-factory-automatically-generate-viral-videos-on-autopilot/
5312,Generate Viral Bigfoot Vlog Videos With Veo 3,https://n8n.io/workflows/5312-generate-viral-bigfoot-vlog-videos-with-veo-3/
5308,Create Animated Baby Podcast Videos With Gpt Dall E Elevenlabs And Hedra,https://n8n.io/workflows/5308-create-animated-baby-podcast-videos-with-gpt-dall-e-elevenlabs-and-hedra/
5307,Ai Audio Transcription And Google Docs Report Generator With Vlm Run,https://n8n.io/workflows/5307-ai-audio-transcription-and-google-docs-report-generator-with-vlm-run/
5293,Audio To Trello Task Bot,https://n8n.io/workflows/5293-audio-to-trello-task-bot/
5289,Ai Prompt Maker,https://n8n.io/workflows/5289-ai-prompt-maker/
5287,Generate Multiple Languange Blogpost With Openai Support Yoast And Polylang,https://n8n.io/workflows/5287-generate-multiple-languange-blogpost-with-openai-support-yoast-and-polylang/
5230,Content Farming Ai Powered Blog Automation For Wordpress,https://n8n.io/workflows/5230-content-farming-ai-powered-blog-automation-for-wordpress/
5229,Youtube Optimization Automation Google Sheets Deepseek Integration,https://n8n.io/workflows/5229-youtube-optimization-automation-google-sheets-deepseek-integration/
5228,Generate Video From Prompt Using Vertex Ai Veo 3 And Upload To Google Drive,https://n8n.io/workflows/5228-generate-video-from-prompt-using-vertex-ai-veo-3-and-upload-to-google-drive/
5202,Ai Blog Post Journalist Perplexity For Research Anthropic Claude For Blog,https://n8n.io/workflows/5202-ai-blog-post-journalist-perplexity-for-research-anthropic-claude-for-blog/
5200,Ai Powered One Click Virtual Fitting Room For Woocommerce Shopify Prestashop,https://n8n.io/workflows/5200-ai-powered-one-click-virtual-fitting-room-for-woocommerce-shopify-prestashop/
