id,title,url
8388,Automate Pdf Purchase Orders To Sales Orders In Adobe Commerce With Ai,https://n8n.io/workflows/8388-automate-pdf-purchase-orders-to-sales-orders-in-adobe-commerce-with-ai/
8331,Convert Markdown To Formatted Notion Pages With Mark2Notion,https://n8n.io/workflows/8331-convert-markdown-to-formatted-notion-pages-with-mark2notion/
8185,Analyze Images And Extract Text With Gpt 4O Vision And Telegram,https://n8n.io/workflows/8185-analyze-images-and-extract-text-with-gpt-4o-vision-and-telegram/
8174,Automate Document Approvals With Multi Level Workflows Using Supabase And Gmail,https://n8n.io/workflows/8174-automate-document-approvals-with-multi-level-workflows-using-supabase-and-gmail/
8132,Remove Duplicate Entries And Update Google Sheets Based On Profile Urls,https://n8n.io/workflows/8132-remove-duplicate-entries-and-update-google-sheets-based-on-profile-urls/
8113,Automated Monthly Energy Reports With Postgresql Pdfco And Email Delivery,https://n8n.io/workflows/8113-automated-monthly-energy-reports-with-postgresql-pdfco-and-email-delivery/
8104,Generate Ai Powered Sales Proposals From Jotform Leads With Openai And Google Docs,https://n8n.io/workflows/8104-generate-ai-powered-sales-proposals-from-jotform-leads-with-openai-and-google-docs/
8090,Generate Student Course Schedules Based On Prerequisites With Gpt And Google Sheets,https://n8n.io/workflows/8090-generate-student-course-schedules-based-on-prerequisites-with-gpt-and-google-sheets/
8073,Generate Prds And Test Scenarios With Gptclaude And Pdf Export,https://n8n.io/workflows/8073-generate-prds-and-test-scenarios-with-gptclaude-and-pdf-export/
8069,Aggregate Marketing Spend Data With Custom Pivots And Vlookups In Google Sheets,https://n8n.io/workflows/8069-aggregate-marketing-spend-data-with-custom-pivots-and-vlookups-in-google-sheets/
8054,Clean And Standardize Csv Uploads For Google Sheets And Drive Import,https://n8n.io/workflows/8054-clean-and-standardize-csv-uploads-for-google-sheets-and-drive-import/
8034,Automate Hs Code Lookup And Enrichment With Google Sheets And Customs Api Beta,https://n8n.io/workflows/8034-automate-hs-code-lookup-and-enrichment-with-google-sheets-and-customs-api-beta/
7955,Create Multi Sheet Excel Workbooks By Merging Datasets With Google Drive And Sheets,https://n8n.io/workflows/7955-create-multi-sheet-excel-workbooks-by-merging-datasets-with-google-drive-and-sheets/
7887,Convert Pdf Doc And Images To Markdown Using Datalabto Api,https://n8n.io/workflows/7887-convert-pdf-doc-and-images-to-markdown-using-datalabto-api/
7863,Automated Pdf Form Filling For W 9 And More With Pdfco,https://n8n.io/workflows/7863-automated-pdf-form-filling-for-w-9-and-more-with-pdfco/
7861,Generate Marketing Reports From Google Sheets With Gpt 4 Insights And Pdfco,https://n8n.io/workflows/7861-generate-marketing-reports-from-google-sheets-with-gpt-4-insights-and-pdfco/
7706,Generate Self Documenting Api Portal For Webhooks With N8N Api And Bootstrap,https://n8n.io/workflows/7706-generate-self-documenting-api-portal-for-webhooks-with-n8n-api-and-bootstrap/
7698,Generate Automated Gst Reports With Gst Insights Api And Google Docs,https://n8n.io/workflows/7698-generate-automated-gst-reports-with-gst-insights-api-and-google-docs/
7695,Automate Weekly Meta Ad Reports With Claude Ai Gomarble Mcp And Google Slides,https://n8n.io/workflows/7695-automate-weekly-meta-ad-reports-with-claude-ai-gomarble-mcp-and-google-slides/
7650,Batch Convert Cadbim Files To Xlsxdae With Validation And Reporting,https://n8n.io/workflows/7650-batch-convert-cadbim-files-to-xlsxdae-with-validation-and-reporting/
7639,Talk To Your Google Sheets Using Chatgpt 5,https://n8n.io/workflows/7639-talk-to-your-google-sheets-using-chatgpt-5/
7592,Generate Weekly Energy Consumption Reports With Energidataservice Email And Google Drive,https://n8n.io/workflows/7592-generate-weekly-energy-consumption-reports-with-energidataservice-email-and-google-drive/
7504,Collaborative Sales Planning With Multi Agent Ai Google Docs And Slack,https://n8n.io/workflows/7504-collaborative-sales-planning-with-multi-agent-ai-google-docs-and-slack/
7470,Summarize Pdfs With Groq Ai And Convert To Audio Using Qwen Tts,https://n8n.io/workflows/7470-summarize-pdfs-with-groq-ai-and-convert-to-audio-using-qwen-tts/
7451,Natural Language To Sql Converter For Google Sheets With Gpt 4O,https://n8n.io/workflows/7451-natural-language-to-sql-converter-for-google-sheets-with-gpt-4o/
7450,Natural Language Google Sheets Data Analysis With Gemini Ai,https://n8n.io/workflows/7450-natural-language-google-sheets-data-analysis-with-gemini-ai/
7449,Talk To Your Google Sheets Using Chatgpt 5,https://n8n.io/workflows/7449-talk-to-your-google-sheets-using-chatgpt-5/
7404,Automated Marketing Performance Email Reports With Google Sheets And Outlook,https://n8n.io/workflows/7404-automated-marketing-performance-email-reports-with-google-sheets-and-outlook/
7384,Batch Scrape Website Urls From Google Sheets To Google Docs With Firecrawl,https://n8n.io/workflows/7384-batch-scrape-website-urls-from-google-sheets-to-google-docs-with-firecrawl/
7370,Generate Professional Reports From Excelcsv With Gemini Ai And Google Workspace,https://n8n.io/workflows/7370-generate-professional-reports-from-excelcsv-with-gemini-ai-and-google-workspace/
7357,Extract Data From Documents With Gpt 4 Pdfvector And Postgresql Export,https://n8n.io/workflows/7357-extract-data-from-documents-with-gpt-4-pdfvector-and-postgresql-export/
7356,Build Academic Citation Networks With Pdf Vector Api For Gephi Visualization,https://n8n.io/workflows/7356-build-academic-citation-networks-with-pdf-vector-api-for-gephi-visualization/
7354,Build Comprehensive Literature Reviews With Gpt 4 And Multi Database Search,https://n8n.io/workflows/7354-build-comprehensive-literature-reviews-with-gpt-4-and-multi-database-search/
7351,Parse And Analyze Research Papers With Pdf Vector Gpt 4 And Database Storage,https://n8n.io/workflows/7351-parse-and-analyze-research-papers-with-pdf-vector-gpt-4-and-database-storage/
7339,Build A Pdf Search System With Mistral Ocr And Weaviate Db,https://n8n.io/workflows/7339-build-a-pdf-search-system-with-mistral-ocr-and-weaviate-db/
7296,Smart Shipping Prioritization With Google Gemini And Google Sheets,https://n8n.io/workflows/7296-smart-shipping-prioritization-with-google-gemini-and-google-sheets/
7288,Generate And Share Professional Pdfs With Openai Google Docs And Slack,https://n8n.io/workflows/7288-generate-and-share-professional-pdfs-with-openai-google-docs-and-slack/
7275,Convert Radiology Images To Patient Friendly Reports With Gpt 4 Vision And Pdf Email,https://n8n.io/workflows/7275-convert-radiology-images-to-patient-friendly-reports-with-gpt-4-vision-and-pdf-email/
7274,Simplify Medical Lab Reports With Ollama Ai And Email Delivery System,https://n8n.io/workflows/7274-simplify-medical-lab-reports-with-ollama-ai-and-email-delivery-system/
7260,Smart Knowledge Base Builder Auto Convert Websites Into Ai Training Data,https://n8n.io/workflows/7260-smart-knowledge-base-builder-auto-convert-websites-into-ai-training-data/
7235,Dynamic Search Interface With Elasticsearch And Automated Report Generation,https://n8n.io/workflows/7235-dynamic-search-interface-with-elasticsearch-and-automated-report-generation/
7201,Generate Ai Powered Lease Renewal Offers With Ollama Llm Supabase And Gmail,https://n8n.io/workflows/7201-generate-ai-powered-lease-renewal-offers-with-ollama-llm-supabase-and-gmail/
7197,Chat Based Financial Analysis Of Pandl And Balance Sheets With Gpt 4 And Postgresql,https://n8n.io/workflows/7197-chat-based-financial-analysis-of-pandl-and-balance-sheets-with-gpt-4-and-postgresql/
7181,Create Personalized Diet Plans From Health Reports With Ollama Ai And Email Automation,https://n8n.io/workflows/7181-create-personalized-diet-plans-from-health-reports-with-ollama-ai-and-email-automation/
7178,Template For Google Drive And Google Docs With Clear Structure And Purpose,https://n8n.io/workflows/7178-template-for-google-drive-and-google-docs-with-clear-structure-and-purpose/
7177,Pharmacy Inventory Alerts For Low Stock And Expiring Medicine With Google Sheets,https://n8n.io/workflows/7177-pharmacy-inventory-alerts-for-low-stock-and-expiring-medicine-with-google-sheets/
7170,Document Qanda With Rag Query Pdf Content Using Weaviate And Openai,https://n8n.io/workflows/7170-document-qanda-with-rag-query-pdf-content-using-weaviate-and-openai/
7164,Extract And Convert Pdf Documents To Markdown With Llamaindex Cloud Api,https://n8n.io/workflows/7164-extract-and-convert-pdf-documents-to-markdown-with-llamaindex-cloud-api/
7154,Beginner Ai Dataset Generator Using Openai Langchain In N8N,https://n8n.io/workflows/7154-beginner-ai-dataset-generator-using-openai-langchain-in-n8n/
7150,Email Parser For Rag Agent Powered By Gmail And Mem0,https://n8n.io/workflows/7150-email-parser-for-rag-agent-powered-by-gmail-and-mem0/
7138,Automated Invoice Generator From Google Sheets To Google Docs,https://n8n.io/workflows/7138-automated-invoice-generator-from-google-sheets-to-google-docs/
7132,Automate Commercial Insurance Submissions With Google Suite Pdf And Email,https://n8n.io/workflows/7132-automate-commercial-insurance-submissions-with-google-suite-pdf-and-email/
7129,Monitor Supplier Financial Health With Scrapegraphai And Multi Channel Risk Alerts,https://n8n.io/workflows/7129-monitor-supplier-financial-health-with-scrapegraphai-and-multi-channel-risk-alerts/
7123,Automatically Transcribe Telegram Voice Messages With Openai Whisper And Google Workspace,https://n8n.io/workflows/7123-automatically-transcribe-telegram-voice-messages-with-openai-whisper-and-google-workspace/
7091,Automatically Send Monthly Sales Reports From Square Via Outlook,https://n8n.io/workflows/7091-automatically-send-monthly-sales-reports-from-square-via-outlook/
7079,Cyberpulse Ai Grc Automate Compliance Audit Documentation,https://n8n.io/workflows/7079-cyberpulse-ai-grc-automate-compliance-audit-documentation/
7078,Cyberpulse Ai Grc Automated Iso 42001 Compliance Evaluation,https://n8n.io/workflows/7078-cyberpulse-ai-grc-automated-iso-42001-compliance-evaluation/
7073,Export Dialogflow Intents With Priority Levels To Google Sheets Via Telegram,https://n8n.io/workflows/7073-export-dialogflow-intents-with-priority-levels-to-google-sheets-via-telegram/
7072,Automated Meeting Summaries Google Meet To Slack With Vexaai And Gpt 4O,https://n8n.io/workflows/7072-automated-meeting-summaries-google-meet-to-slack-with-vexaai-and-gpt-4o/
7062,Llama Ai Model For Google Sheets Tracking,https://n8n.io/workflows/7062-llama-ai-model-for-google-sheets-tracking/
7060,Business Ai Command Center Modular Agents For Google Workspace Vector Search And Multi Channel Reports,https://n8n.io/workflows/7060-business-ai-command-center-modular-agents-for-google-workspace-vector-search-and-multi-channel-reports/
7031,Extract Links And Urls From Pdf Documents Using Pdfco,https://n8n.io/workflows/7031-extract-links-and-urls-from-pdf-documents-using-pdfco/
7029,Automate Meeting Intelligence With Vexa Openai And Mem0 For Conversation Insights,https://n8n.io/workflows/7029-automate-meeting-intelligence-with-vexa-openai-and-mem0-for-conversation-insights/
7026,Analyze Images Videos Documents And Audio With Gemini Tools And Qwen Llm Agent,https://n8n.io/workflows/7026-analyze-images-videos-documents-and-audio-with-gemini-tools-and-qwen-llm-agent/
6998,Automated Student Progress Reports From Lms To Parents Via Gmail And Google Sheets,https://n8n.io/workflows/6998-automated-student-progress-reports-from-lms-to-parents-via-gmail-and-google-sheets/
6972,Build Comprehensive Entity Profiles With Gpt 4 Wikipedia And Vector Db For Content,https://n8n.io/workflows/6972-build-comprehensive-entity-profiles-with-gpt-4-wikipedia-and-vector-db-for-content/
6961,Vision Rag And Image Embeddings Using Cohere Command A And Embed V4,https://n8n.io/workflows/6961-vision-rag-and-image-embeddings-using-cohere-command-a-and-embed-v4/
6937,Turn Any Pdf Into A Clean Google Doc With Mistral Ocr,https://n8n.io/workflows/6937-turn-any-pdf-into-a-clean-google-doc-with-mistral-ocr/
6935,Automate Vendor Contract Renewals And Reminders With Gpt 41 Mini Slack And Gmail,https://n8n.io/workflows/6935-automate-vendor-contract-renewals-and-reminders-with-gpt-41-mini-slack-and-gmail/
6906,Automate Financial Operations With O3 Cfo And Gpt 41 Mini Finance Team,https://n8n.io/workflows/6906-automate-financial-operations-with-o3-cfo-and-gpt-41-mini-finance-team/
6904,Comprehensive Legal Department Automation With Openai O3 Clo And Specialist Agents,https://n8n.io/workflows/6904-comprehensive-legal-department-automation-with-openai-o3-clo-and-specialist-agents/
6817,Generate And Send Contract Documents With Typeform Google Docs And Gmail,https://n8n.io/workflows/6817-generate-and-send-contract-documents-with-typeform-google-docs-and-gmail/
6779,Convert Unstructured Contact Data To Json With Gpt 4 For System Integration,https://n8n.io/workflows/6779-convert-unstructured-contact-data-to-json-with-gpt-4-for-system-integration/
6754,Scrape And Analyze Websites With Custom Prompts Using Gemini Apify And Langchain,https://n8n.io/workflows/6754-scrape-and-analyze-websites-with-custom-prompts-using-gemini-apify-and-langchain/
6753,Beginner Data Analysis Merge Filter And Summarize In Google Sheets With Gpt 4O,https://n8n.io/workflows/6753-beginner-data-analysis-merge-filter-and-summarize-in-google-sheets-with-gpt-4o/
6703,Video Transcription Automation With Vlm Run Google Drive And Docs,https://n8n.io/workflows/6703-video-transcription-automation-with-vlm-run-google-drive-and-docs/
6702,Extract Data From Thai Government Letters With Mistral Ocr And Store In Google Sheets,https://n8n.io/workflows/6702-extract-data-from-thai-government-letters-with-mistral-ocr-and-store-in-google-sheets/
6688,Compare Vendor Quotations With Grok Ai And Export To Google Sheets And Email,https://n8n.io/workflows/6688-compare-vendor-quotations-with-grok-ai-and-export-to-google-sheets-and-email/
6679,Generate Multi Period Financial Reports From Google Sheets With Ai Analysis,https://n8n.io/workflows/6679-generate-multi-period-financial-reports-from-google-sheets-with-ai-analysis/
6643,Carbon Footprint Tracker With Scrapegraphai Analysis And Google Drive Esg Reports,https://n8n.io/workflows/6643-carbon-footprint-tracker-with-scrapegraphai-analysis-and-google-drive-esg-reports/
6629,Ai Powered Bank Statement Analysis And Transaction Categorization,https://n8n.io/workflows/6629-ai-powered-bank-statement-analysis-and-transaction-categorization/
6587,Automate Meeting Summaries From Fireflies Transcripts With Gemini And Gmail,https://n8n.io/workflows/6587-automate-meeting-summaries-from-fireflies-transcripts-with-gemini-and-gmail/
6574,Build Document Rag System With Kimi K2 Gemini Embeddings And Qdrant,https://n8n.io/workflows/6574-build-document-rag-system-with-kimi-k2-gemini-embeddings-and-qdrant/
6569,Monitor Supply Chain Risks With Scrapegraphai Alerts Via Slack And Email,https://n8n.io/workflows/6569-monitor-supply-chain-risks-with-scrapegraphai-alerts-via-slack-and-email/
6526,Fetch All Page Content From Website And Store With Gemini Embedding In Pinecone,https://n8n.io/workflows/6526-fetch-all-page-content-from-website-and-store-with-gemini-embedding-in-pinecone/
6501,Automatically Disable Unsold Magento 2 Products After 1 Year With Gmail Approval,https://n8n.io/workflows/6501-automatically-disable-unsold-magento-2-products-after-1-year-with-gmail-approval/
6487,Generate Medical Reports From Emails With Gemini Ai And Google Workspace,https://n8n.io/workflows/6487-generate-medical-reports-from-emails-with-gemini-ai-and-google-workspace/
6372,Ai Powered Auto Translate Google Slides Presentation To Any Language With Gemini,https://n8n.io/workflows/6372-ai-powered-auto-translate-google-slides-presentation-to-any-language-with-gemini/
6304,Summarize Text With Rapidapi And Log Results To Google Sheets,https://n8n.io/workflows/6304-summarize-text-with-rapidapi-and-log-results-to-google-sheets/
6297,Generate Professional Proposals With Gpt 4O And Pdfmonkey,https://n8n.io/workflows/6297-generate-professional-proposals-with-gpt-4o-and-pdfmonkey/
6294,Automate Monthly Finance Reports With Google Sheets Gpt 4 Analysis And Gmail,https://n8n.io/workflows/6294-automate-monthly-finance-reports-with-google-sheets-gpt-4-analysis-and-gmail/
6286,Extract Organizations And Summarize Documents With Foxit And Diffbot,https://n8n.io/workflows/6286-extract-organizations-and-summarize-documents-with-foxit-and-diffbot/
6224,Analyze And Chat With Xml Files Using Gpt And Langchain,https://n8n.io/workflows/6224-analyze-and-chat-with-xml-files-using-gpt-and-langchain/
6209,Extract Text From Images And Pdfs Via Telegram With Mistral Ocr To Markdown,https://n8n.io/workflows/6209-extract-text-from-images-and-pdfs-via-telegram-with-mistral-ocr-to-markdown/
6177,Create Project Summaries From Meeting Transcripts With Gpt 4 And Google Docs,https://n8n.io/workflows/6177-create-project-summaries-from-meeting-transcripts-with-gpt-4-and-google-docs/
6139,Transcribe And Summarize Audio With Whisper And Gpt From Google Drive To Notion,https://n8n.io/workflows/6139-transcribe-and-summarize-audio-with-whisper-and-gpt-from-google-drive-to-notion/
6077,Transcribe Whatsapp Audio Messages With Whisper Ai Via Groq,https://n8n.io/workflows/6077-transcribe-whatsapp-audio-messages-with-whisper-ai-via-groq/
6075,Multi Jurisdiction Smart Contract Compliance Monitor With Automated Alerts,https://n8n.io/workflows/6075-multi-jurisdiction-smart-contract-compliance-monitor-with-automated-alerts/
6060,Automate Chinese To English Translation In Google Slides With Openrouter Ai,https://n8n.io/workflows/6060-automate-chinese-to-english-translation-in-google-slides-with-openrouter-ai/
6023,Compare Multi Period Financial Data From Google Sheets With Deepseek Ai Analysis,https://n8n.io/workflows/6023-compare-multi-period-financial-data-from-google-sheets-with-deepseek-ai-analysis/
6019,Synchronize Slack Status Updates With Pinecone Google Sheets And Gpt 4O,https://n8n.io/workflows/6019-synchronize-slack-status-updates-with-pinecone-google-sheets-and-gpt-4o/
6002,Track Openai Admin Api Usage And Costs Automatically With Google Sheets,https://n8n.io/workflows/6002-track-openai-admin-api-usage-and-costs-automatically-with-google-sheets/
5991,Restaurant Daily Insights With Gemini Ai Sales Waste And Feedback Email Summary,https://n8n.io/workflows/5991-restaurant-daily-insights-with-gemini-ai-sales-waste-and-feedback-email-summary/
5983,Automate Restaurant Sales And Inventory Forecasting With Gemini Ai And Google Sheets,https://n8n.io/workflows/5983-automate-restaurant-sales-and-inventory-forecasting-with-gemini-ai-and-google-sheets/
5982,Predict Restaurant Food Waste With Gemini Ai And Google Sheets Reporting,https://n8n.io/workflows/5982-predict-restaurant-food-waste-with-gemini-ai-and-google-sheets-reporting/
5925,Create A Speech To Text Api With Openai Gpt4O Mini Transcribe,https://n8n.io/workflows/5925-create-a-speech-to-text-api-with-openai-gpt4o-mini-transcribe/
5917,Extract Structured Data From Medical Documents With Google Gemini Ai,https://n8n.io/workflows/5917-extract-structured-data-from-medical-documents-with-google-gemini-ai/
5876,Sync Zendesk Knowledge Base Articles To Airtable With Markdown Conversion,https://n8n.io/workflows/5876-sync-zendesk-knowledge-base-articles-to-airtable-with-markdown-conversion/
5864,Extract Text From Images With Telegram Bot And Gemini 20 Flash Ocr,https://n8n.io/workflows/5864-extract-text-from-images-with-telegram-bot-and-gemini-20-flash-ocr/
5858,Summarize Documents Images And Spreadsheets With Gemma 3 On Ollama,https://n8n.io/workflows/5858-summarize-documents-images-and-spreadsheets-with-gemma-3-on-ollama/
5815,Automated Inventory Management With Airtable Po Creation And Supplier Emails,https://n8n.io/workflows/5815-automated-inventory-management-with-airtable-po-creation-and-supplier-emails/
5808,Create Custom Pdf Documents From Templates With Gemini And Google Drive,https://n8n.io/workflows/5808-create-custom-pdf-documents-from-templates-with-gemini-and-google-drive/
5801,Automate Legal Lien Documents With Gemini Ai Apify And Google Workspace,https://n8n.io/workflows/5801-automate-legal-lien-documents-with-gemini-ai-apify-and-google-workspace/
5746,Generate Research Ideas From Pdfs Using Infranodus Graphrag Content Gap Analysis,https://n8n.io/workflows/5746-generate-research-ideas-from-pdfs-using-infranodus-graphrag-content-gap-analysis/
5745,Auto Generate And Auto Fill Business Documents With Google Sheets And Gmail,https://n8n.io/workflows/5745-auto-generate-and-auto-fill-business-documents-with-google-sheets-and-gmail/
5744,Generate Research Questions From Pdfs Using Infranodus Content Gap Analysis,https://n8n.io/workflows/5744-generate-research-questions-from-pdfs-using-infranodus-content-gap-analysis/
5723,Automate Vendor Due Diligence Research With Gemini And Jina Ai,https://n8n.io/workflows/5723-automate-vendor-due-diligence-research-with-gemini-and-jina-ai/
5675,Transform Markdown Content Into Structured Notion Blocks,https://n8n.io/workflows/5675-transform-markdown-content-into-structured-notion-blocks/
5661,Ai Image Nudity Detection Tool With Image Moderation Api,https://n8n.io/workflows/5661-ai-image-nudity-detection-tool-with-image-moderation-api/
5631,Transform Youtube Videos Into Interactive Mcq Quizzes With Google Forms And Gemini Ai,https://n8n.io/workflows/5631-transform-youtube-videos-into-interactive-mcq-quizzes-with-google-forms-and-gemini-ai/
5607,Generate Structured Scientific Research Pdf Summaries With Gpt 4O,https://n8n.io/workflows/5607-generate-structured-scientific-research-pdf-summaries-with-gpt-4o/
5599,Find The Best Favicon From Multiple Sources With Gpt 4 Vision Analysis,https://n8n.io/workflows/5599-find-the-best-favicon-from-multiple-sources-with-gpt-4-vision-analysis/
5593,Extract Data From Driver License Uploads With Vlm Run Google Drive And Sheets,https://n8n.io/workflows/5593-extract-data-from-driver-license-uploads-with-vlm-run-google-drive-and-sheets/
5592,Process And Summarize Pdfs From Email And Messaging Apps With Openai Gpt,https://n8n.io/workflows/5592-process-and-summarize-pdfs-from-email-and-messaging-apps-with-openai-gpt/
5522,Convert And Manipulate Pdfs With Api2Pdf And Aws Lambda,https://n8n.io/workflows/5522-convert-and-manipulate-pdfs-with-api2pdf-and-aws-lambda/
5507,Analyze Images From Forms Using Gpt 4O Mini Vision And Deliver To Telegram,https://n8n.io/workflows/5507-analyze-images-from-forms-using-gpt-4o-mini-vision-and-deliver-to-telegram/
5494,Pdf Document Filling And Generation Server For Ai Agents With Doqsdev Api,https://n8n.io/workflows/5494-pdf-document-filling-and-generation-server-for-ai-agents-with-doqsdev-api/
5474,Airline Web Check In Data Extraction With Ollama Ai Google Sheets And Postgres Vector Db,https://n8n.io/workflows/5474-airline-web-check-in-data-extraction-with-ollama-ai-google-sheets-and-postgres-vector-db/
5441,Generate Professional Document Drafts From Pdfs With Google Drive Gpt 4 And Email Notifications,https://n8n.io/workflows/5441-generate-professional-document-drafts-from-pdfs-with-google-drive-gpt-4-and-email-notifications/
5424,Google Sheets Mcp Ai Powered Spreadsheet Management,https://n8n.io/workflows/5424-google-sheets-mcp-ai-powered-spreadsheet-management/
5412,Summarize Youtube Videos With Transcription Deepseek Ai And Google Sheets,https://n8n.io/workflows/5412-summarize-youtube-videos-with-transcription-deepseek-ai-and-google-sheets/
5392,Extract Clean Web Content With Anti Bot Fallback For Ai Agents And Workflows,https://n8n.io/workflows/5392-extract-clean-web-content-with-anti-bot-fallback-for-ai-agents-and-workflows/
5378,Automating Sap B1 Journal Entries Using Json Google Sheets And Gpt 4O,https://n8n.io/workflows/5378-automating-sap-b1-journal-entries-using-json-google-sheets-and-gpt-4o/
5307,Ai Audio Transcription And Google Docs Report Generator With Vlm Run,https://n8n.io/workflows/5307-ai-audio-transcription-and-google-docs-report-generator-with-vlm-run/
5221,Automate Research Paper Collection With Bright Data And N8N,https://n8n.io/workflows/5221-automate-research-paper-collection-with-bright-data-and-n8n/
5197,Automated Meeting Recording And Ai Summaries With Google Calendar Vexa And Llama 32,https://n8n.io/workflows/5197-automated-meeting-recording-and-ai-summaries-with-google-calendar-vexa-and-llama-32/
5149,Create Pdf From Html With Gotenberg,https://n8n.io/workflows/5149-create-pdf-from-html-with-gotenberg/
5147,Convert Markdown Content To Google Docs Document With Automatic Formatting,https://n8n.io/workflows/5147-convert-markdown-content-to-google-docs-document-with-automatic-formatting/
5130,Ai Powered Accounting Reports From Sabre Edi With Gpt 4 And Pinecone Rag,https://n8n.io/workflows/5130-ai-powered-accounting-reports-from-sabre-edi-with-gpt-4-and-pinecone-rag/
5124,Generate Qr Codes From Urls With Qr Server Api And Downloadable Images,https://n8n.io/workflows/5124-generate-qr-codes-from-urls-with-qr-server-api-and-downloadable-images/
5085,Convert Tour Pdfs To Vector Database Using Google Drive Langchain And Openai,https://n8n.io/workflows/5085-convert-tour-pdfs-to-vector-database-using-google-drive-langchain-and-openai/
5083,Medical Records Automation With Mistral Ocr And Google Sheets,https://n8n.io/workflows/5083-medical-records-automation-with-mistral-ocr-and-google-sheets/
5082,Ai Powered Proposal Automation Using Google Slides,https://n8n.io/workflows/5082-ai-powered-proposal-automation-using-google-slides/
5073,Summarize Youtube Videos With Ai And Extract Key Lessons To Google Docs,https://n8n.io/workflows/5073-summarize-youtube-videos-with-ai-and-extract-key-lessons-to-google-docs/
