id,title,url
1754,Identify New Google Sheets Rows,https://n8n.io/workflows/1754-identify-new-google-sheets-rows/
1750,Creating An Api Endpoint,https://n8n.io/workflows/1750-creating-an-api-endpoint/
1748,Pulling Data From Services That N8N Doesnt Have A Pre Built Integration For,https://n8n.io/workflows/1748-pulling-data-from-services-that-n8n-doesnt-have-a-pre-built-integration-for/
1747,Joining Different Datasets,https://n8n.io/workflows/1747-joining-different-datasets/
1734,Import A Json File From Gmail Into A Spreadsheet,https://n8n.io/workflows/1734-import-a-json-file-from-gmail-into-a-spreadsheet/
1731,Export Csv File To Json,https://n8n.io/workflows/1731-export-csv-file-to-json/
1700,Very Quick Quickstart,https://n8n.io/workflows/1700-very-quick-quickstart/
1692,Markdown Timesheet Report Generation,https://n8n.io/workflows/1692-markdown-timesheet-report-generation/
1690,Markdown Report Generation,https://n8n.io/workflows/1690-markdown-report-generation/
1588,Manage Adobe Acrobat E Signatures With Webhooks,https://n8n.io/workflows/1588-manage-adobe-acrobat-e-signatures-with-webhooks/
1534,Back Up Your N8N Workflows To Github,https://n8n.io/workflows/1534-back-up-your-n8n-workflows-to-github/
1435,Convert Json To An Excel File,https://n8n.io/workflows/1435-convert-json-to-an-excel-file/
1418,Create An Rss Feed Based On A Websites Content,https://n8n.io/workflows/1418-create-an-rss-feed-based-on-a-websites-content/
1395,Collects Images From Web Search Results And Send To Google Sheets,https://n8n.io/workflows/1395-collects-images-from-web-search-results-and-send-to-google-sheets/
1394,Transcribe Audio Files From Cloud Storage,https://n8n.io/workflows/1394-transcribe-audio-files-from-cloud-storage/
1393,Extract And Store Text From Chat Images Using Aws S3,https://n8n.io/workflows/1393-extract-and-store-text-from-chat-images-using-aws-s3/
1328,Use Regex To Select Date,https://n8n.io/workflows/1328-use-regex-to-select-date/
1282,Send A File From S3 To Aws Textract,https://n8n.io/workflows/1282-send-a-file-from-s3-to-aws-textract/
1111,Create Transcription Jobs Using Aws Transcribe,https://n8n.io/workflows/1111-create-transcription-jobs-using-aws-transcribe/
1083,Create An Event File And Send It As An Email Attachment,https://n8n.io/workflows/1083-create-an-event-file-and-send-it-as-an-email-attachment/
1075,Filter The Feedback From Typeform And Store In Google Sheets,https://n8n.io/workflows/1075-filter-the-feedback-from-typeform-and-store-in-google-sheets/
1035,Get All The Slides From A Presentation And Get Thumbnails Of Pages,https://n8n.io/workflows/1035-get-all-the-slides-from-a-presentation-and-get-thumbnails-of-pages/
998,Translate Cocktail Instructions Using Deepl,https://n8n.io/workflows/998-translate-cocktail-instructions-using-deepl/
890,Read In An Excel Spreadsheet File,https://n8n.io/workflows/890-read-in-an-excel-spreadsheet-file/
798,Send Financial Metrics Monthly To Mattermos,https://n8n.io/workflows/798-send-financial-metrics-monthly-to-mattermos/
797,Translate Instructions Using Lingvanex,https://n8n.io/workflows/797-translate-instructions-using-lingvanex/
694,Transform Data In Google Sheets,https://n8n.io/workflows/694-transform-data-in-google-sheets/
661,Convert The Json Data Received From The Cocktaildb Api In Xml,https://n8n.io/workflows/661-convert-the-json-data-received-from-the-cocktaildb-api-in-xml/
640,Get All The Entries From Contentful,https://n8n.io/workflows/640-get-all-the-entries-from-contentful/
2,Transfer Data From Postgres To Excel,https://n8n.io/workflows/2-transfer-data-from-postgres-to-excel/
