id,title,url
5048,Generate An Ai Summary Of Your Notion Comments,https://n8n.io/workflows/5048-generate-an-ai-summary-of-your-notion-comments/
4950,Ai Powered Receipt And Expense Tracker With Telegram Google Sheets And Openai,https://n8n.io/workflows/4950-ai-powered-receipt-and-expense-tracker-with-telegram-google-sheets-and-openai/
4944,Transcribe And Summarize Telegram Voice Notes With Openai And Deepseek Chat To Google Docs,https://n8n.io/workflows/4944-transcribe-and-summarize-telegram-voice-notes-with-openai-and-deepseek-chat-to-google-docs/
4938,Transcribe Telegram Voice Notes To Google Docs With Openai And Deepseek Summaries,https://n8n.io/workflows/4938-transcribe-telegram-voice-notes-to-google-docs-with-openai-and-deepseek-summaries/
4933,Document Parsing And Data Extraction With Mistral Ocr Ai Processing And Multi Channel Delivery,https://n8n.io/workflows/4933-document-parsing-and-data-extraction-with-mistral-ocr-ai-processing-and-multi-channel-delivery/
4927,Complete Lesson Automation For Modern Uk Teachers,https://n8n.io/workflows/4927-complete-lesson-automation-for-modern-uk-teachers/
4911,Generate Summaries From Uploaded Files Using Openai Assistants Api,https://n8n.io/workflows/4911-generate-summaries-from-uploaded-files-using-openai-assistants-api/
4869,Process Legal Documents With Ollama Ai And Generate Html Reports 100Percent Local,https://n8n.io/workflows/4869-process-legal-documents-with-ollama-ai-and-generate-html-reports-100percent-local/
4865,Google Sheets Duplication And Enrichment Automation,https://n8n.io/workflows/4865-google-sheets-duplication-and-enrichment-automation/
4832,Automated Document Translation With Straker Google Drive And Slack,https://n8n.io/workflows/4832-automated-document-translation-with-straker-google-drive-and-slack/
4808,Convert Documents To Markdown With Mineru Api And Gpt 4O Mini,https://n8n.io/workflows/4808-convert-documents-to-markdown-with-mineru-api-and-gpt-4o-mini/
4804,Ai Premium Proposal Generator With Openai Google Slides And Pandadoc,https://n8n.io/workflows/4804-ai-premium-proposal-generator-with-openai-google-slides-and-pandadoc/
4781,Get Malaysia Tax Id Number Tin For Multiple Business Reg Num Ssm Or Nric,https://n8n.io/workflows/4781-get-malaysia-tax-id-number-tin-for-multiple-business-reg-num-ssm-or-nric/
4761,Ai Powered Interview Preparation System Using Local Llm For Campus Placements,https://n8n.io/workflows/4761-ai-powered-interview-preparation-system-using-local-llm-for-campus-placements/
4757,Co2 Emissions Of Freight Shipments With Carbon Interface Api And Gpt 4O,https://n8n.io/workflows/4757-co2-emissions-of-freight-shipments-with-carbon-interface-api-and-gpt-4o/
4756,Co2 Emissions Of Business Travels With Carbon Interface Api And Gpt 4O,https://n8n.io/workflows/4756-co2-emissions-of-business-travels-with-carbon-interface-api-and-gpt-4o/
4738,Generate A Legal Website Accessibility Statement With Ai And Wave,https://n8n.io/workflows/4738-generate-a-legal-website-accessibility-statement-with-ai-and-wave/
4697,Segment Pdfs By Table Of Contents With Gemini Ai And Chunkrai,https://n8n.io/workflows/4697-segment-pdfs-by-table-of-contents-with-gemini-ai-and-chunkrai/
4621,Automated Video Analysis Ai Powered Insight Generation From Google Drive,https://n8n.io/workflows/4621-automated-video-analysis-ai-powered-insight-generation-from-google-drive/
4603,Content Summarizer Via Webhook Apyhub,https://n8n.io/workflows/4603-content-summarizer-via-webhook-apyhub/
4577,Automated Revenue Predictions From Stripe Data With Gpt 4 And Google Sheets,https://n8n.io/workflows/4577-automated-revenue-predictions-from-stripe-data-with-gpt-4-and-google-sheets/
4576,Automated Expense Approval System With Gpt 4 Airtable And Pinecone Vector Db,https://n8n.io/workflows/4576-automated-expense-approval-system-with-gpt-4-airtable-and-pinecone-vector-db/
4566,Automated Book Summarization With Deepseek Ai Qdrant Vector Db And Google Drive,https://n8n.io/workflows/4566-automated-book-summarization-with-deepseek-ai-qdrant-vector-db-and-google-drive/
4552,Index Documents From Google Drive To Pinecone With Openai Embeddings For Rag,https://n8n.io/workflows/4552-index-documents-from-google-drive-to-pinecone-with-openai-embeddings-for-rag/
4512,Automate Microsoft Teams Meeting Analysis With Gpt 41 Outlook And Memai,https://n8n.io/workflows/4512-automate-microsoft-teams-meeting-analysis-with-gpt-41-outlook-and-memai/
4495,Sync Google Drive Files To An Infranodus Knowledge Graph,https://n8n.io/workflows/4495-sync-google-drive-files-to-an-infranodus-knowledge-graph/
4486,Upload Google Drive Files To An Infranodus Graph,https://n8n.io/workflows/4486-upload-google-drive-files-to-an-infranodus-graph/
4472,Ai Powered Loom Video Qanda With Gemini 25 And Slack Notifications,https://n8n.io/workflows/4472-ai-powered-loom-video-qanda-with-gemini-25-and-slack-notifications/
4464,Export Ai Agent Conversation Logs From Postgres To Google Sheets,https://n8n.io/workflows/4464-export-ai-agent-conversation-logs-from-postgres-to-google-sheets/
4461,Telegram Chat Summarizer With Ai Using Telepilotcon8N Nodes Telepilot,https://n8n.io/workflows/4461-telegram-chat-summarizer-with-ai-using-telepilotcon8n-nodes-telepilot/
4436,Analyze Beyondpresence Video Calls With Gpt 4O Mini And Google Sheets,https://n8n.io/workflows/4436-analyze-beyondpresence-video-calls-with-gpt-4o-mini-and-google-sheets/
4406,Generate Daily E Commerce Order Reports With Supabase Gpt 41 And Gmail,https://n8n.io/workflows/4406-generate-daily-e-commerce-order-reports-with-supabase-gpt-41-and-gmail/
4400,Build A Pdf Document Rag System With Mistral Ocr Qdrant And Gemini Ai,https://n8n.io/workflows/4400-build-a-pdf-document-rag-system-with-mistral-ocr-qdrant-and-gemini-ai/
4395,Track Expenses By Parsing Telegram Transaction Messages To Google Sheets,https://n8n.io/workflows/4395-track-expenses-by-parsing-telegram-transaction-messages-to-google-sheets/
4370,Auto Meeting Summarizer With Google Drive Openai Whisper And Gpt 4 To Sheets,https://n8n.io/workflows/4370-auto-meeting-summarizer-with-google-drive-openai-whisper-and-gpt-4-to-sheets/
4369,Convert Venmo Statement Csv File To Quickbooks Csv Import,https://n8n.io/workflows/4369-convert-venmo-statement-csv-file-to-quickbooks-csv-import/
4354,Legal Case Research Extractor Data Miner With Bright Data Mcp And Google Gemini,https://n8n.io/workflows/4354-legal-case-research-extractor-data-miner-with-bright-data-mcp-and-google-gemini/
4341,Ai Powered Mis Agent,https://n8n.io/workflows/4341-ai-powered-mis-agent/
4336,Webhook Enabled Ai Pdf Analyzer,https://n8n.io/workflows/4336-webhook-enabled-ai-pdf-analyzer/
4300,Extract And Structure Thai Documents To Google Sheets Using Typhoon Ocr And Llama 31,https://n8n.io/workflows/4300-extract-and-structure-thai-documents-to-google-sheets-using-typhoon-ocr-and-llama-31/
4270,Webhookdocs Generate Swagger Preview Of Your Active Workflows,https://n8n.io/workflows/4270-webhookdocs-generate-swagger-preview-of-your-active-workflows/
4219,Create Ai Ready Vector Datasets From Web Content With Claude Ollama And Qdrant,https://n8n.io/workflows/4219-create-ai-ready-vector-datasets-from-web-content-with-claude-ollama-and-qdrant/
4008,Ai Powered Auto Generate Exam Questions And Answers From Google Docs With Gemini,https://n8n.io/workflows/4008-ai-powered-auto-generate-exam-questions-and-answers-from-google-docs-with-gemini/
3969,Summarise Slack Channel Activity For Weekly Reports With Ai,https://n8n.io/workflows/3969-summarise-slack-channel-activity-for-weekly-reports-with-ai/
3872,Extract Specific Pages From Pdfs With Customjs Api,https://n8n.io/workflows/3872-extract-specific-pages-from-pdfs-with-customjs-api/
3871,Convert Html To Pdf And Extract Text From Pdfs With Customjs Api,https://n8n.io/workflows/3871-convert-html-to-pdf-and-extract-text-from-pdfs-with-customjs-api/
3870,Convert Html And Pdf Files To Png Images With Customjs Pdf Toolkit,https://n8n.io/workflows/3870-convert-html-and-pdf-files-to-png-images-with-customjs-pdf-toolkit/
3869,Convert Html To Pdf And Compress Files With Customjs Api,https://n8n.io/workflows/3869-convert-html-to-pdf-and-compress-files-with-customjs-api/
3847,Convert Pdf To Png With Pdfco Api Multi Page Support,https://n8n.io/workflows/3847-convert-pdf-to-png-with-pdfco-api-multi-page-support/
3835,Analyze Google Sheets Data With Openai Powered Data Agent,https://n8n.io/workflows/3835-analyze-google-sheets-data-with-openai-powered-data-agent/
3771,Generate And Email Personalized Certificates From Google Forms With Score Threshold,https://n8n.io/workflows/3771-generate-and-email-personalized-certificates-from-google-forms-with-score-threshold/
3663,Business Model Canvas Ai Powered Generator Llm Flexible,https://n8n.io/workflows/3663-business-model-canvas-ai-powered-generator-llm-flexible/
3647,Transform Google Drive Documents Into Vector Embeddings,https://n8n.io/workflows/3647-transform-google-drive-documents-into-vector-embeddings/
3644,Eu Green Legislation Tracker With Gpt 4O Google Sheets And Tasks,https://n8n.io/workflows/3644-eu-green-legislation-tracker-with-gpt-4o-google-sheets-and-tasks/
3637,Build Your Own Youtube Mcp Server,https://n8n.io/workflows/3637-build-your-own-youtube-mcp-server/
3634,Build Your Own Google Drive Mcp Server,https://n8n.io/workflows/3634-build-your-own-google-drive-mcp-server/
3617,Generate Monthly Financial Reports With Gemini Ai Sql And Outlook,https://n8n.io/workflows/3617-generate-monthly-financial-reports-with-gemini-ai-sql-and-outlook/
3606,Document Analysis And Chatbot Creation With Llama Parser Gemini Llm And Pinecone Db,https://n8n.io/workflows/3606-document-analysis-and-chatbot-creation-with-llama-parser-gemini-llm-and-pinecone-db/
3578,Generate Dynamic Line Chart From Json Data To Upload To Google Drive,https://n8n.io/workflows/3578-generate-dynamic-line-chart-from-json-data-to-upload-to-google-drive/
3567,Automate Pdf Image Extraction And Analysis With Gpt 4O And Google Drive,https://n8n.io/workflows/3567-automate-pdf-image-extraction-and-analysis-with-gpt-4o-and-google-drive/
3556,Automate Currency Rates Update In Invoices With Google Sheet Exchangerate Api,https://n8n.io/workflows/3556-automate-currency-rates-update-in-invoices-with-google-sheet-exchangerate-api/
3535,Ai Agent Scrape Summarize And Save Articles To Notion Gemini Browserless,https://n8n.io/workflows/3535-ai-agent-scrape-summarize-and-save-articles-to-notion-gemini-browserless/
3517,Import Google Keep Notes To Google Sheets Using Openai And Google Drive,https://n8n.io/workflows/3517-import-google-keep-notes-to-google-sheets-using-openai-and-google-drive/
3505,Extract University Term Dates From Excel Using Cloudflare Markdown Conversion,https://n8n.io/workflows/3505-extract-university-term-dates-from-excel-using-cloudflare-markdown-conversion/
3504,Store Retell Transcripts In Sheets Airtable Or Notion From Webhook,https://n8n.io/workflows/3504-store-retell-transcripts-in-sheets-airtable-or-notion-from-webhook/
3453,Automated Weekly Project Cost Reports With Mysql And Outlook Html Emails,https://n8n.io/workflows/3453-automated-weekly-project-cost-reports-with-mysql-and-outlook-html-emails/
3451,Browser Recording Audio Transcribing And Ai Analysis With Deepgram And Gpt 4O,https://n8n.io/workflows/3451-browser-recording-audio-transcribing-and-ai-analysis-with-deepgram-and-gpt-4o/
3421,Load And Aggregate Files From A Google Drive Folder Into A Key Value Dictionary,https://n8n.io/workflows/3421-load-and-aggregate-files-from-a-google-drive-folder-into-a-key-value-dictionary/
3420,Ai Agent For Sustainability Report Audit With Gmail And Gpt 40,https://n8n.io/workflows/3420-ai-agent-for-sustainability-report-audit-with-gmail-and-gpt-40/
3388,Transcribe Audio Files With Google Gemini And Telegram,https://n8n.io/workflows/3388-transcribe-audio-files-with-google-gemini-and-telegram/
3344,Ai Agent For Logistics Order Processing With Gpt 4O Gmail And Google Sheet,https://n8n.io/workflows/3344-ai-agent-for-logistics-order-processing-with-gpt-4o-gmail-and-google-sheet/
3331,Convert Html To Pdf And Return Via Webhook Using Customjs Api,https://n8n.io/workflows/3331-convert-html-to-pdf-and-return-via-webhook-using-customjs-api/
3319,Add New Incoming Emails To A Google Sheets Spreadsheet As A New Row,https://n8n.io/workflows/3319-add-new-incoming-emails-to-a-google-sheets-spreadsheet-as-a-new-row/
3275,Convert Pdf To Html Using Pdfco And Google Drive,https://n8n.io/workflows/3275-convert-pdf-to-html-using-pdfco-and-google-drive/
3223,Ai Research Agents To Automate Pdf Analysis With Mistrals Best In Class Ocr,https://n8n.io/workflows/3223-ai-research-agents-to-automate-pdf-analysis-with-mistrals-best-in-class-ocr/
3221,Electronic Data Interchange Edi Message Parsing With Gmail And Google Sheet,https://n8n.io/workflows/3221-electronic-data-interchange-edi-message-parsing-with-gmail-and-google-sheet/
3219,Generate Ai Ready Llmstxt Files From Screaming Frog Website Crawls,https://n8n.io/workflows/3219-generate-ai-ready-llmstxt-files-from-screaming-frog-website-crawls/
3185,Compare Local Ollama Vision Models For Image Analysis Using Google Docs,https://n8n.io/workflows/3185-compare-local-ollama-vision-models-for-image-analysis-using-google-docs/
3184,Process Youtube Transcripts With Apify Openai And Pinecone Database,https://n8n.io/workflows/3184-process-youtube-transcripts-with-apify-openai-and-pinecone-database/
3149,Image Based Data Extraction Api Using Gemini Ai,https://n8n.io/workflows/3149-image-based-data-extraction-api-using-gemini-ai/
3145,Replace Data In Google Docs From N8N Form,https://n8n.io/workflows/3145-replace-data-in-google-docs-from-n8n-form/
3140,Audio Conversation Analysis And Visualization With Deepgram And Gpt 4O,https://n8n.io/workflows/3140-audio-conversation-analysis-and-visualization-with-deepgram-and-gpt-4o/
3119,Create A Rest Api For Pdf Digital Signatures With Webhooks,https://n8n.io/workflows/3119-create-a-rest-api-for-pdf-digital-signatures-with-webhooks/
3114,Automatically Issue Training Certificates And Send Via Gmail,https://n8n.io/workflows/3114-automatically-issue-training-certificates-and-send-via-gmail/
3105,Automate Audiovideo Transcription In Any Language With The New Elevenlabs Model,https://n8n.io/workflows/3105-automate-audiovideo-transcription-in-any-language-with-the-new-elevenlabs-model/
3102,Parse And Extract Data From Documentsimages With Mistral Ocr,https://n8n.io/workflows/3102-parse-and-extract-data-from-documentsimages-with-mistral-ocr/
3093,Extract Pay Slip Data With Line Chatbot And Gemini To Google Sheets,https://n8n.io/workflows/3093-extract-pay-slip-data-with-line-chatbot-and-gemini-to-google-sheets/
3079,Query Google Sheetscsv Data Through An Ai Agent Using Postgresql,https://n8n.io/workflows/3079-query-google-sheetscsv-data-through-an-ai-agent-using-postgresql/
3078,5 Ways To Process Images And Pdfs With Gemini Ai In N8N,https://n8n.io/workflows/3078-5-ways-to-process-images-and-pdfs-with-gemini-ai-in-n8n/
3076,Use Openai To Transcribe Audio Summarize With Ai Save To Google Drive,https://n8n.io/workflows/3076-use-openai-to-transcribe-audio-summarize-with-ai-save-to-google-drive/
3060,Automate Actions After Pdf Generation With Pdfmonkey,https://n8n.io/workflows/3060-automate-actions-after-pdf-generation-with-pdfmonkey/
3008,Extract Thai Bank Slip Data From Line Using Spaceocr And Save To Google Sheets,https://n8n.io/workflows/3008-extract-thai-bank-slip-data-from-line-using-spaceocr-and-save-to-google-sheets/
3005,Advanced Ai Powered Document Parsing And Text Extraction With Llama Parse,https://n8n.io/workflows/3005-advanced-ai-powered-document-parsing-and-text-extraction-with-llama-parse/
2942,Ai Agent For Top N8N Creators Leaderboard Reporting,https://n8n.io/workflows/2942-ai-agent-for-top-n8n-creators-leaderboard-reporting/
2940,Ai Agent For N8N Creators Leaderboard Find Popular Workflows,https://n8n.io/workflows/2940-ai-agent-for-n8n-creators-leaderboard-find-popular-workflows/
2922,Detect Hallucinations Using Specialised Ollama Model Bespoke Minicheck,https://n8n.io/workflows/2922-detect-hallucinations-using-specialised-ollama-model-bespoke-minicheck/
2911,Extract License Plate Number From Image Uploaded Via An N8N Form,https://n8n.io/workflows/2911-extract-license-plate-number-from-image-uploaded-via-an-n8n-form/
2904,Arxiv Paper Summarization With Chatgpt,https://n8n.io/workflows/2904-arxiv-paper-summarization-with-chatgpt/
2901,Convert Notion To Markdown And Back To Notion,https://n8n.io/workflows/2901-convert-notion-to-markdown-and-back-to-notion/
2804,Analyse Papers From Hugging Face With Ai And Store Them In Notion,https://n8n.io/workflows/2804-analyse-papers-from-hugging-face-with-ai-and-store-them-in-notion/
2797,Notion To Pinecone Vector Store Integration,https://n8n.io/workflows/2797-notion-to-pinecone-vector-store-integration/
2779,Remove Personally Identifiable Information Pii From Csv Files With Openai,https://n8n.io/workflows/2779-remove-personally-identifiable-information-pii-from-csv-files-with-openai/
2766,Extract Personal Data With Self Hosted Llm Mistral Nemo,https://n8n.io/workflows/2766-extract-personal-data-with-self-hosted-llm-mistral-nemo/
2765,Automated Hugging Face Paper Summary Fetching And Categorization Workflow,https://n8n.io/workflows/2765-automated-hugging-face-paper-summary-fetching-and-categorization-workflow/
2764,Extract And Process Information Directly From Pdf Using Claude And Gemini,https://n8n.io/workflows/2764-extract-and-process-information-directly-from-pdf-using-claude-and-gemini/
2754,Summarize The New Documents From Google Drive And Save Summary In Google Sheet,https://n8n.io/workflows/2754-summarize-the-new-documents-from-google-drive-and-save-summary-in-google-sheet/
2739,Convert Addresses To Latlong With Google Sheets And Google Maps Api,https://n8n.io/workflows/2739-convert-addresses-to-latlong-with-google-sheets-and-google-maps-api/
2732,Csv To Json Converter With Error Handling And Slack Notifications,https://n8n.io/workflows/2732-csv-to-json-converter-with-error-handling-and-slack-notifications/
2706,Auto Categorize Blog Posts In Wordpress Using Ai,https://n8n.io/workflows/2706-auto-categorize-blog-posts-in-wordpress-using-ai/
2653,Ai Data Analyst Agent And Visualization Agent For Large Spreadsheets,https://n8n.io/workflows/2653-ai-data-analyst-agent-and-visualization-agent-for-large-spreadsheets/
2651,Ai Agent For Realtime Insights On Meetings,https://n8n.io/workflows/2651-ai-agent-for-realtime-insights-on-meetings/
2650,Extract Information From A Logo Sheet Using Forms Ai Google Sheet And Airtable,https://n8n.io/workflows/2650-extract-information-from-a-logo-sheet-using-forms-ai-google-sheet-and-airtable/
2614,Extract Text From Pdf And Image Using Vertex Ai Gemini Into Csv,https://n8n.io/workflows/2614-extract-text-from-pdf-and-image-using-vertex-ai-gemini-into-csv/
2596,Export Zammad Objects Users Roles Groups Organizations To Excel,https://n8n.io/workflows/2596-export-zammad-objects-users-roles-groups-organizations-to-excel/
2549,Automate Google Analytics Reporting,https://n8n.io/workflows/2549-automate-google-analytics-reporting/
2527,Sharepoint List Fetch With Oauth Token,https://n8n.io/workflows/2527-sharepoint-list-fetch-with-oauth-token/
2501,Replace Images In Google Docs Documents And Download As Pdfdocx,https://n8n.io/workflows/2501-replace-images-in-google-docs-documents-and-download-as-pdfdocx/
2476,Convert Url Html To Markdown Format And Get Page Links,https://n8n.io/workflows/2476-convert-url-html-to-markdown-format-and-get-page-links/
2464,Scale Deal Flow With A Pitch Deck Ai Vision Chatbot And Qdrant Vector Store,https://n8n.io/workflows/2464-scale-deal-flow-with-a-pitch-deck-ai-vision-chatbot-and-qdrant-vector-store/
2444,Get Bibliographic Data From Your Zotero Library,https://n8n.io/workflows/2444-get-bibliographic-data-from-your-zotero-library/
2424,Manipulate Pdf With Adobe Developer Api,https://n8n.io/workflows/2424-manipulate-pdf-with-adobe-developer-api/
2421,Transcribing Bank Statements To Markdown Using Gemini Vision Ai,https://n8n.io/workflows/2421-transcribing-bank-statements-to-markdown-using-gemini-vision-ai/
2420,Automate Image Validation Tasks Using Ai Vision,https://n8n.io/workflows/2420-automate-image-validation-tasks-using-ai-vision/
2414,Extract Spending History From Gmail To Google Sheet,https://n8n.io/workflows/2414-extract-spending-history-from-gmail-to-google-sheet/
2395,Supabase Insertion And Upsertion And Retrieval,https://n8n.io/workflows/2395-supabase-insertion-and-upsertion-and-retrieval/
2392,Telegram Chat With Pdf,https://n8n.io/workflows/2392-telegram-chat-with-pdf/
2358,Advanced Ai Demo Presented At Ai Developers 14 Meetup,https://n8n.io/workflows/2358-advanced-ai-demo-presented-at-ai-developers-14-meetup/
2345,Convert Baserow Rich Text Markdown Field To Html,https://n8n.io/workflows/2345-convert-baserow-rich-text-markdown-field-to-html/
2339,Breakdown Documents Into Study Notes Using Templating Mistralai And Qdrant,https://n8n.io/workflows/2339-breakdown-documents-into-study-notes-using-templating-mistralai-and-qdrant/
2338,Reconcile Rent Payments With Local Excel Spreadsheet And Openai,https://n8n.io/workflows/2338-reconcile-rent-payments-with-local-excel-spreadsheet-and-openai/
2335,Build A Financial Documents Assistant Using Qdrant And Mistralai,https://n8n.io/workflows/2335-build-a-financial-documents-assistant-using-qdrant-and-mistralai/
2330,Enrich Property Inventory Survey With Image Recognition And Ai Agent,https://n8n.io/workflows/2330-enrich-property-inventory-survey-with-image-recognition-and-ai-agent/
2321,Automate Your Rfp Process With Openai Assistants,https://n8n.io/workflows/2321-automate-your-rfp-process-with-openai-assistants/
2316,Convert Image To Pdf Using Convertapi,https://n8n.io/workflows/2316-convert-image-to-pdf-using-convertapi/
2314,Convert Html To Pdf Using Convertapi,https://n8n.io/workflows/2314-convert-html-to-pdf-using-convertapi/
2310,Convert Web Page To Pdf Using Convertapi,https://n8n.io/workflows/2310-convert-web-page-to-pdf-using-convertapi/
2308,Convert Airtable Rich Text Markdown Field To Html,https://n8n.io/workflows/2308-convert-airtable-rich-text-markdown-field-to-html/
2297,Convert Docx From Url To Pdf Using Convertapi,https://n8n.io/workflows/2297-convert-docx-from-url-to-pdf-using-convertapi/
2295,Export N8N Cloud Execution Data To Csv,https://n8n.io/workflows/2295-export-n8n-cloud-execution-data-to-csv/
2294,Convert Docx To Pdf Using Convertapi,https://n8n.io/workflows/2294-convert-docx-to-pdf-using-convertapi/
2290,Store Notions Pages As Vector Documents Into Supabase With Openai,https://n8n.io/workflows/2290-store-notions-pages-as-vector-documents-into-supabase-with-openai/
2254,Streamlining Document Automation With N8N And Jsreport,https://n8n.io/workflows/2254-streamlining-document-automation-with-n8n-and-jsreport/
2244,Dynamically Replace Images In Google Slides Via Api,https://n8n.io/workflows/2244-dynamically-replace-images-in-google-slides-via-api/
2222,Convert An Xml File To Json Via Webhook Call,https://n8n.io/workflows/2222-convert-an-xml-file-to-json-via-webhook-call/
2207,Automate Screenshots With Urlbox And Analyze Them With Ai,https://n8n.io/workflows/2207-automate-screenshots-with-urlbox-and-analyze-them-with-ai/
2179,Translate Pdf Documents From Google Drive Folder With Deepl,https://n8n.io/workflows/2179-translate-pdf-documents-from-google-drive-folder-with-deepl/
2178,Transcribe Audio Files Summarize With Gpt 4 And Store In Notion,https://n8n.io/workflows/2178-transcribe-audio-files-summarize-with-gpt-4-and-store-in-notion/
2173,Auto Document Your N8N Workflows,https://n8n.io/workflows/2173-auto-document-your-n8n-workflows/
2165,Chat With Pdf Docs Using Ai Quoting Sources,https://n8n.io/workflows/2165-chat-with-pdf-docs-using-ai-quoting-sources/
2089,Shopify To Google Sheets Product Sync Automation,https://n8n.io/workflows/2089-shopify-to-google-sheets-product-sync-automation/
2071,Upload Bulk Records From Csv Airtable Interfaces,https://n8n.io/workflows/2071-upload-bulk-records-from-csv-airtable-interfaces/
1968,Import Multiple Csv To Google Sheets,https://n8n.io/workflows/1968-import-multiple-csv-to-google-sheets/
1967,Prepare Csv Files With Gpt 4,https://n8n.io/workflows/1967-prepare-csv-files-with-gpt-4/
1962,Load And Summarize Google Drive Files With Ai,https://n8n.io/workflows/1962-load-and-summarize-google-drive-files-with-ai/
1954,Ai Agent Chat,https://n8n.io/workflows/1954-ai-agent-chat/
1951,Scrape And Summarize Webpages With Ai,https://n8n.io/workflows/1951-scrape-and-summarize-webpages-with-ai/
1947,Sql To Xml Export With Xsl Template Formatting,https://n8n.io/workflows/1947-sql-to-xml-export-with-xsl-template-formatting/
1943,Comparing Data With The Compare Datasets Node,https://n8n.io/workflows/1943-comparing-data-with-the-compare-datasets-node/
1934,Telegram Ai Chatbot,https://n8n.io/workflows/1934-telegram-ai-chatbot/
1902,Convert Postgresql Table To Csv,https://n8n.io/workflows/1902-convert-postgresql-table-to-csv/
1872,Convert Sql Table Into Excel Spreadsheet,https://n8n.io/workflows/1872-convert-sql-table-into-excel-spreadsheet/
1862,Openai Gpt 3 Company Enrichment From Website Content,https://n8n.io/workflows/1862-openai-gpt-3-company-enrichment-from-website-content/
1810,Read Xml File And Store Content In Google Sheets,https://n8n.io/workflows/1810-read-xml-file-and-store-content-in-google-sheets/
1790,Generate Dynamic Contents For Emails Or Html Pages,https://n8n.io/workflows/1790-generate-dynamic-contents-for-emails-or-html-pages/
1757,Google Spreadsheet To Html Variant With Js Function,https://n8n.io/workflows/1757-google-spreadsheet-to-html-variant-with-js-function/
1756,Google Spreadsheet To Html Variant With Spreadsheet File,https://n8n.io/workflows/1756-google-spreadsheet-to-html-variant-with-spreadsheet-file/
